id,created_at,favorites,retweets,retweeted,source,text
885860686517219329,2017-07-14 13:57:00,514,145,False,b'Sprinklr',b'A beautiful story - and a powerful reminder of what it looks like when we live our faith through action. https://t.co/f3nRQai37f'
885502922892685312,2017-07-13 14:15:23,420,147,False,b'Sprinklr',b'Ann\xe2\x80\x99s teen years ended with a positive pregnancy test instead of a diploma. Here\xe2\x80\x99s what she tells young moms now. #HerFuture https://t.co/kxRkKBFBaz'
885127803427074049,2017-07-12 13:24:47,443,135,False,b'Sprinklr',"b'These two sisters are just one year apart, but live very different lives. What made the difference? Contraceptives. #HerFuture https://t.co/MHBUxriiMv'"
884990206205542400,2017-07-12 04:18:02,0,48,False,b'Twitter Web Client',b'RT @FP2020Global: Big news! Explore NEW #familyplanning commitment updates &amp; join the conversation: https://t.co/0vK3FDQHgc #FP2020Progress\xe2\x80\xa6'
884761190706163713,2017-07-11 13:08:00,2005,636,False,b'Sprinklr',"b'Our goal: access to contraceptives for every woman, everywhere.  https://t.co/by7z7CnbSe #HerFuture'"
884407625630306304,2017-07-10 13:43:04,499,144,False,b'Sprinklr',"b'When a community volunteer taught Peninah, a young mom, about family planning, it changed her life\xe2\x80\x94&amp; turned her into an advocate. #HerFuture https://t.co/Z6q2AOm263'"
883673367613714432,2017-07-08 13:05:23,2342,1519,False,b'Sprinklr',"b'Every woman, everywhere, should be able to access contraceptives. But for millions around the world, this is their reality. #HerFuture https://t.co/mmYAR2Zui3'"
883448602500222977,2017-07-07 22:12:15,2714,429,False,b'Sprinklr',"b'Always, @Malala. Empowering girls is the best path to a better future, and I\xe2\x80\x99m with you every step of the way. https://t.co/nMnWLNVru2'"
883299306886901760,2017-07-07 12:19:00,311,97,False,b'Sprinklr',"b'\xe2\x80\x9cWithout them, I would not have survived.\xe2\x80\x9d Don\xe2\x80\x99t miss this remarkable profile of midwives and their vital work. https://t.co/uMQ16VP0BS'"
882943233134919683,2017-07-06 12:44:05,447,127,False,b'Sprinklr',b'These youth have big plans for their future &amp; for the world. They\xe2\x80\x99re a reminder of what\xe2\x80\x99s possible &amp; what\xe2\x80\x99s at stake https://t.co/BUYDQqYlH2 https://t.co/pgRUj9xzIe'
882593154402308097,2017-07-05 13:33:00,1670,657,False,b'Sprinklr',"b'A generation of girls will grow up, get elected, and change America for the better\xe2\x80\x94if we teach them they can. https://t.co/19xUUmBFHU'"
881533169530531840,2017-07-02 15:21:00,1328,704,False,b'Sprinklr',b'The evidence is clear: silence makes us smarter. https://t.co/rbxvdcvh9Y'
881195444348612608,2017-07-01 16:59:00,704,191,False,b'Sprinklr',"b'Paid leave is a path to healthy families, strong businesses, and a better country. So proud WA is leading the way. https://t.co/B9uIYcExK2'"
881148384144392192,2017-07-01 13:52:00,660,262,False,b'Sprinklr',"b'The world is full of kind, caring boys. Here are a few ways we can give our sons more space to be their best selves. https://t.co/mcJOpirVQE'"
880779706081083392,2017-06-30 13:27:00,114,41,False,b'Sprinklr',"b'.@reidhoffman calls @nancylublin \xe2\x80\x9cthe entrepreneurial equivalent of Indiana Jones.\xe2\x80\x9d Listen, &amp; you\xe2\x80\x99ll understand why. https://t.co/UZLOY0iNjM'"
880423358822744064,2017-06-29 13:51:00,382,182,False,b'Sprinklr',b'We can close the gender gap in #STEM. Here\xe2\x80\x99s the approach that\xe2\x80\x99s worked for @harveymudd. https://t.co/p18ontoCsI'
880059207214616576,2017-06-28 13:44:00,243,82,False,b'Sprinklr',b'\xe2\x80\x9cCountless US companies are doing business in places that used to get American aid but have become self-sufficient.\xe2\x80\x9d https://t.co/AVX98LZ8a8'
879689773786550273,2017-06-27 13:16:00,370,141,False,b'Sprinklr',b'Does teaching computers to think like people mean teaching them to be sexist? Not if we get more women in the room. https://t.co/vUFD0zNYvI'
879333929676832769,2017-06-26 13:42:00,357,175,False,b'Sprinklr',b'So many great points here\xe2\x80\x94and I love how this illustration makes \xe2\x80\x9cinvisible work\xe2\x80\x9d plain to see. https://t.co/QK53FHaPf0'
878620477912231936,2017-06-24 14:27:00,241,86,False,b'Sprinklr',"b'I love watching graduation speeches. Here\xe2\x80\x99s why this year\xe2\x80\x99s\xe2\x80\x94from @KumailN, @ReshmaSaujani, &amp; others\xe2\x80\x94were so special. https://t.co/ZaCvn1RbTN'"
878369912573501440,2017-06-23 21:51:21,287,70,False,b'Twitter Web Client',"b'Thank you, @reidhoffman, for amplifying this story, and urging all of us to do our part to solve this problem. #DecencyPledge'"
878369477833793536,2017-06-23 21:49:37,327,63,False,b'Twitter Web Client',"b'Reading this piece, I\xe2\x80\x99m hopeful. Women are coming forward, men are taking notice, and the industry is learning to listen. That\xe2\x80\x99s progress.'"
878369207175462913,2017-06-23 21:48:32,585,242,False,b'Twitter Web Client',b'Speaking out about sexism in #VC takes incredible courage. These women deserve our thanks\xe2\x80\x94and our full attention. https://t.co/xrv24AUO4v'
878280740873621504,2017-06-23 15:57:00,398,160,False,b'Sprinklr',b'The neuroscientist who discovered where memories are stored in our brains deserves a place in all our hippocampi. https://t.co/MFPtPUNIsJ'
877877330059730944,2017-06-22 13:14:00,212,47,False,b'Sprinklr',b'A beautiful meditation on motherhood.\nhttps://t.co/9rrKAUZeSl'
877521991653355521,2017-06-21 13:42:01,212,86,False,b'Sprinklr',"b'.@Padmasree has some great advice for new grads going into tech\xe2\x80\x94and it goes for the rest of us, too. via @CNBCMakeIt https://t.co/HxTuS4Fv5q'"
877149787333808130,2017-06-20 13:03:00,199,78,False,b'Sprinklr',b'A powerful piece from @jess7bennett about why movies like #WonderWoman matter. https://t.co/FqO7Wg8EKZ'
876892738351845377,2017-06-19 20:01:35,0,454,False,b'Twitter Web Client',"b""RT @gatesfoundation: Progress is possible, but it\xe2\x80\x99s not inevitable. Help us tackle some of the world's toughest challenges. https://t.co/am\xe2\x80\xa6"""
876465548376375297,2017-06-18 15:44:05,1250,110,False,b'Sprinklr',"b'Happy Father\xe2\x80\x99s Day, @BillGates. You\xe2\x80\x99ve taught our kids so much, and they couldn\xe2\x80\x99t have asked for a better dad. https://t.co/iRpdt6MJ5y'"
876075209719246848,2017-06-17 13:53:01,718,97,False,b'Sprinklr',"b'It may have been the aerospace engineer in him, but I\xe2\x80\x99m so glad Dad taught me to aim for the stars. #HappyFathersDay https://t.co/8P2UaJObH6 https://t.co/DFVA9ccbb4'"
875711562161500160,2017-06-16 13:48:01,358,101,False,b'Sprinklr',"b'As parents, we need every bit of help we can get. I made a list of some of my favorite apps for moms and dads. https://t.co/KHsBG7euLF'"
875394723988615168,2017-06-15 16:49:00,491,158,False,b'Sprinklr',b'Courageous. Determined. Persistent. Meet the women on the front lines of the fight against polio. https://t.co/4ZI9vZVXCv'
874677566195552264,2017-06-13 17:19:17,442,124,False,b'Sprinklr',b'Something I never thought I\xe2\x80\x99d see: @BillGates tag-teaming w/ @JohnCena in the fight to #EndPolio. Not to be missed! https://t.co/bnyQKvbzVK'
874268803525468165,2017-06-12 14:15:00,808,265,False,b'Sprinklr',"b'Humanity has eradicated one disease\xe2\x80\x94ever. We\xe2\x80\x99re on the cusp of eradicating a second, thanks to partners like @Rotary https://t.co/41mrxCTiUx'"
873913965226676227,2017-06-11 14:45:00,414,126,False,b'Sprinklr',b'The first step toward any national paid leave policy is agreeing that we need one. https://t.co/7S4MEPmUjB'
873549814952329217,2017-06-10 14:38:00,1949,625,False,b'Sprinklr',"b'\xe2\x80\x9cFor more girls to be competitive in the technology-laden workforce of the future, they need role models.\xe2\x80\x9d #STEM https://t.co/43dIUiERch'"
873204667966251009,2017-06-09 15:46:30,564,231,False,b'Sprinklr',b'Women\xe2\x80\x99s groups are a powerful force for change. An investment in them is an investment in a better future for us all https://t.co/a1dtJJnqf3'
872954086244597761,2017-06-08 23:10:47,13,1,False,b'Twitter Web Client',b'@KGeorgieva @gatesfoundation I was thrilled to host you! Thank you for your incredible leadership.'
872826782868807681,2017-06-08 14:44:56,362,34,False,b'Sprinklr',"b'For decades, my friend Mary has been a steady force in my life and a source of love and laughs. Happy #NationalBestFriendsDay! #TBT https://t.co/C4hb6eSUzm'"
872447566667022336,2017-06-07 13:38:03,427,101,False,b'Sprinklr',b'Amazing young women are launching their careers in #computerscience\xe2\x80\x94and my hopes for them couldn\xe2\x80\x99t be higher. https://t.co/ayyn1sOAqc https://t.co/JrGBEOlMHU'
872202499159195649,2017-06-06 21:24:15,554,176,False,b'Sprinklr',"b'When I was learning to code back in the 80s, women like Jean were my heroes. We\xe2\x80\x99ve lost an extraordinary innovator. https://t.co/LylCK9sCeZ'"
872082146311241728,2017-06-06 13:26:00,529,263,False,b'Sprinklr',"b'If you want to get excited about the future, read this @Wired piece. https://t.co/ykdjVAdVez'"
871021656701063168,2017-06-03 15:12:00,384,191,False,b'Sprinklr',"b'.@EdYong209 surfaces a fascinating idea: for women in #STEM, mentors are like vaccines against bias https://t.co/H7qijd0XPp'"
870751039498014720,2017-06-02 21:16:40,88,14,False,b'Twitter Web Client',"b'@waltmossberg @Recode @voxmediainc Thanks for the great conversations, @waltmossberg\xe2\x80\x94and congrats on a well-deserved retirement. Bill and I will miss your thoughtful columns!'"
870627811136024577,2017-06-02 13:07:00,368,111,False,b'Sprinklr',b'I agree with @BillGates about Hillbilly Elegy\xe2\x80\x94it\xe2\x80\x99s both an important read and a great one. https://t.co/yef40DR5BI'
870303425627607040,2017-06-01 15:38:00,387,161,False,b'Sprinklr',b'We know #PovertyIsSexist. Mentorship for young women can break this vicious cycle.\nhttps://t.co/J3F127fmJe'
869987899755724800,2017-05-31 18:44:13,0,177,False,b'Twitter Web Client',"b'RT @MalalaFund: Kaya, a senior in college, made an app to help young people find books where they see themselves reflected https://t.co/Yfp\xe2\x80\xa6'"
869937517520453632,2017-05-31 15:24:01,361,102,False,b'Sprinklr',b'Fighting myths about menstruation requires work from everyone\xe2\x80\x94and I\xe2\x80\x99m inspired to see these men making change. https://t.co/gZlxP3EMUM'
869560532461924352,2017-05-30 14:26:01,1069,370,False,b'Sprinklr',b'Great to see superheroes break the silence around taboo issues\xe2\x80\x94and teach girls to tap into their own superpowers. https://t.co/2rdInHBHKb'
868842548382638080,2017-05-28 14:53:00,623,240,False,b'Sprinklr',"b'Because this woman chased her dream of being a space gynecologist, more women will be able to achieve theirs. \nhttps://t.co/PNiEF2AGzY'"
868479657737420800,2017-05-27 14:51:00,584,260,False,b'Sprinklr',b'A great read\xe2\x80\x94and a powerful reminder that contraceptives are one of the best tools we have to drive economic growth. https://t.co/2BhUrteeJM'
868156780328747009,2017-05-26 17:28:00,275,107,False,b'Sprinklr',b'#NancyGraceRoman lit the way for women in #STEM and encourages us all to reach for the stars. https://t.co/pTFgineCtF'
868092105947840512,2017-05-26 13:11:01,448,183,False,b'Sprinklr',b'\xe2\x80\x9cPurpose is what creates true happiness.\xe2\x80\x9d Wise words from the newly minted Dr. Mark Zuckerberg. https://t.co/2rOaHwKGsh'
867863307171975168,2017-05-25 22:01:51,0,54,False,b'Twitter Web Client',"b'RT @ONEDeutschland: We just met @melindagates at #dekt17 to talk about our motivation, her experiences &amp; our campaign #povertyissexist  #ON\xe2\x80\xa6'"
867855802496765952,2017-05-25 21:32:01,501,130,False,b'Sprinklr',b'Thrilled to be in Germany\xe2\x80\x94the second-largest donor of foreign aid\xe2\x80\x94discussing how we can help more people meet their full potential. #dekt17 https://t.co/kRCzJt1cub'
867470858779893760,2017-05-24 20:02:24,0,146,False,b'Twitter Web Client',"b""RT @gatesfoundation: Get ready to put your #NosesOn. We're matching every dollar donated on @RedNoseDayUSA's Facebook, up to $1 Million! ht\xe2\x80\xa6"""
867114647601782784,2017-05-23 20:26:56,750,472,False,b'Sprinklr',"b""The President's proposal to eliminate funding for international family planning would harm families around the world https://t.co/QXPCmg4tsN https://t.co/n2xnqp0jJp"""
866652619477069824,2017-05-22 13:51:00,596,223,False,b'Sprinklr',b'This is how progress begins: with women deciding to ignore gender norms &amp; pursue the futures that are right for them https://t.co/RJvxluap2t'
866287964871159808,2017-05-21 13:42:00,726,334,False,b'Sprinklr',"b'Get comfortable being uncomfortable. The reward is a fuller, more interesting life. https://t.co/Yr70hVL7eL'"
865924318647250945,2017-05-20 13:37:00,459,143,False,b'Sprinklr',"b'Investing in foreign aid keeps America healthy, safe, and prosperous. https://t.co/3piZjvwQQm'"
865704995311595520,2017-05-19 23:05:29,0,38,False,b'Twitter Web Client',b'RT @carolynrodz: How VCs talk about male vs. female entrepreneurs. #changetheconversation @sacca @jeancase @melindagates: https://t.co/d52I\xe2\x80\xa6'
865620317846159362,2017-05-19 17:29:00,293,103,False,b'Sprinklr',"b'Say hello to Alice, an #AI guide designed for female entrepreneurs. #HelloAlice! \nhttps://t.co/0avyoAtQh6'"
865573959634386946,2017-05-19 14:24:48,204,85,False,b'Medium',"b'\xe2\x80\x9cAI is everywhere. It\xe2\x80\x99s not that big, scary thing in the future. AI is here with us.\xe2\x80\x9d\xe2\x80\x8a\xe2\x80\x94\xe2\x80\x8a@drfeifei https://t.co/xQkngAmGvo https://t.co/VamsyYHide'"
865190986871427072,2017-05-18 13:03:00,552,264,False,b'Sprinklr',"b'When more women can work, the economy grows faster. It\xe2\x80\x99s past time to break down the barriers holding women back. https://t.co/2WGIjfwMDg'"
864836904944107521,2017-05-17 13:36:00,1565,352,False,b'Sprinklr',"b'My son Rory is compassionate, curious &amp; kind. But one of the things that makes me proudest is that he\xe2\x80\x99s a feminist. https://t.co/mhtePYG0YW'"
864624772746956801,2017-05-16 23:33:04,164,51,False,b'Twitter Web Client',"b'Thank you, @nprmontagne, for this incredibly heartbreaking, but important read. https://t.co/CKzkDXytyD'"
864569145903460352,2017-05-16 19:52:01,267,51,False,b'Sprinklr',b'It was such a treat talking with these bright young women from @seattlegirlsedu. https://t.co/QrybnTfH2v'
863768124671373313,2017-05-14 14:49:03,898,92,False,b'Sprinklr',"b'This Mother\xe2\x80\x99s Day, I\xe2\x80\x99m missing Mary Gates. I\xe2\x80\x99ll always be grateful for all she taught Bill and me. https://t.co/fMSgGBmD7W'"
863386597131157504,2017-05-13 13:33:00,388,135,False,b'Sprinklr',"b'This is Ati. She\xe2\x80\x99s a frontline health worker I met in Indonesia, and she stunned me with her story. https://t.co/VfD6riSnyi'"
863014645925326850,2017-05-12 12:55:00,465,212,False,b'Sprinklr',b'No woman should have to give her life to bring another into the world. via @MerckforMothers #AllforMothers https://t.co/SBRvELuKln'
862655782294360064,2017-05-11 13:09:00,213,84,False,b'Sprinklr',"b""Every mother counts\xe2\x80\x94so make your Mother's Day gift count, too. #OrangeRose @everymomcounts https://t.co/vgxNmso9Qe"""
862303212535238660,2017-05-10 13:48:01,285,119,False,b'Sprinklr',"b'Ethiopia is a global leader in saving kids\xe2\x80\x99 lives. There are about 38,000 reasons why\xe2\x80\x94and Bill met with two of them. https://t.co/jHrh70ufl7'"
861930796801818624,2017-05-09 13:08:10,479,132,False,b'Sprinklr',"b'50 years ago, 1 in 10 Indonesian women had access to contraceptives. Now it\xe2\x80\x99s 1 in 2\xe2\x80\x94and women like Ati are driving that progress. https://t.co/U9RmLbo7eP'"
861610394305024000,2017-05-08 15:55:00,0,74,False,b'Twitter Web Client',b'RT @gateshealth: Women want options! A new partnership makes injectable contraceptive method more affordable for women who need it most. ht\xe2\x80\xa6'
861576923075547137,2017-05-08 13:42:00,405,203,False,b'Sprinklr',b'An important lesson from @SueDHellmann: embrace what makes you unique. It\xe2\x80\x99ll take you a long way. https://t.co/LFuMxSZhma'
861223600967356416,2017-05-07 14:18:01,742,181,False,b'Sprinklr',"b'Happy #TeacherAppreciationWeek to the women who taught me so much, and to all the teachers who dedicate their lives to educating our kids. https://t.co/Wb2JHqQv9N'"
860872008099401728,2017-05-06 15:00:55,385,102,False,b'Sprinklr',"b'For me, it was Mrs. Bauer\xe2\x80\x94a math teacher by day, PhD candidate by night, mother of three who taught me to love code. https://t.co/JYe9aUGBZ0 https://t.co/dMPYwSw6Ed'"
860620008220753920,2017-05-05 22:19:34,195,56,False,b'Sprinklr',"b'Congrats, @theriveterco! Thrilled to see Seattle supporting women-founded businesses. https://t.co/jOtbY7kL0n\nhttps://t.co/3OZ9QOojqb'"
860477262214385664,2017-05-05 12:52:20,303,138,False,b'Sprinklr',b'How do you attract people with diverse backgrounds to AI? Help them see how they can change the world. https://t.co/4aucqbRsZM https://t.co/qqnmdXd9zC'
860151035662409728,2017-05-04 15:16:02,253,95,False,b'Sprinklr',b'Loved talking with @drfeifei about her work to build the #AI\xe2\x80\x94and the #AI workforce\xe2\x80\x94of the future. https://t.co/VlAPBeGYY3 https://t.co/lLqgPaGXxz'
859757685666967552,2017-05-03 13:13:00,468,232,False,b'Sprinklr',b'This amazing book shows young girls they can be anything they want. https://t.co/wFJ235CVXM'
859403603253002241,2017-05-02 13:46:00,473,166,False,b'Sprinklr',b'\xe2\x80\x9cWe can only build the future by standing together.\xe2\x80\x9d Such a vital message from Pope Francis at @TEDTalks. https://t.co/QgUxxmyl7h'
859036881773707265,2017-05-01 13:28:47,0,151,False,b'Twitter Web Client',"b""RT @gatesfoundation: Improving Sanitation will \n- Save hundreds of thousands of lives\n- Help girls stay in school\n- Boost India's economy h\xe2\x80\xa6"""
858707325460201472,2017-04-30 15:39:15,514,238,False,b'Twitter Web Client',b'.@Stanford @jessiwrites My advice: Be yourself. See confidence and resilience as skills to be learned. Build a network of supportive friends who lift you up.'
858707182619049984,2017-04-30 15:38:41,281,66,False,b'Twitter Web Client',b'Thanks to @Stanford and @jessiwrites for a great discussion about women in business last week. https://t.co/vE9pf18yui'
858102254573805568,2017-04-28 23:34:54,14,2,False,b'Twitter Web Client',b'@carolineghosn @JulieWroblewski @StartX @levoleague @LevoInstitute Thanks for the great conversation! I enjoyed learning about the ways @levoleague is promoting mentorship.'
858013529605111810,2017-04-28 17:42:21,234,129,False,b'Sprinklr',"b'Hemorrhages after childbirth kill 100,000 women a year. The #WOMANtrial found a low-cost drug that can save lives. https://t.co/QeTMUGjzVr'"
857971918955319297,2017-04-28 14:57:00,250,121,False,b'Sprinklr',b'\xe2\x80\x9cDon\xe2\x80\x99t be held back by stereotypes.\xe2\x80\x9d #womenintech weigh in on things they wish they\xe2\x80\x99d known from the start. https://t.co/OUDPnGpFI3'
857824450968002561,2017-04-28 05:11:01,438,187,False,b'Sprinklr',"b'Improving #nutrition means investing in the future. Thank you @BMZ_Bund, for helping lead the way with the #RuralFuture conference. https://t.co/Jri1Onc6Nb'"
857584365169246212,2017-04-27 13:17:00,370,151,False,b'Sprinklr',b'The data shows that daring to be different is a clear path to success. \nhttps://t.co/EA65yWgwc5'
857231039235850240,2017-04-26 13:53:00,232,69,False,b'Sprinklr',b'#OptionB is a remarkable book\xe2\x80\x94a raw and personal guide to building resilience. \nhttps://t.co/XsJuvYoZoE'
856920989053050880,2017-04-25 17:20:59,0,240,False,b'Twitter Web Client',"b'RT @gavi: They were key to helping modern #vaccineswork, but how many of these women have you heard of? https://t.co/gJnlRpid1D #womeninSTE\xe2\x80\xa6'"
856858538622242816,2017-04-25 13:12:49,443,193,False,b'Sprinklr',b'I\xe2\x80\x99ve met a lot of mothers like this one who are willing to do whatever it takes to get their kids vaccinated. #VaccinesWork https://t.co/P9FxL5OhYc'
856505501575778304,2017-04-24 13:49:59,1035,529,False,b'Sprinklr',b'There\xe2\x80\x99s a simple way to save millions of children\xe2\x80\x99s lives. #WorldImmunizationWeek #VaccinesWork https://t.co/Ie4f2bu45G'
856151674292973568,2017-04-23 14:24:00,811,370,False,b'Sprinklr',b'Women and girls are going to change the world. I talked to @TIME about how we can unlock their potential. #TIME100 https://t.co/SaHqZFqcYz'
855535625713459200,2017-04-21 21:36:02,4318,731,False,b'Sprinklr',"b'Today, Bill and I were deeply humbled to accept France\xe2\x80\x99s Legion of Honour award on behalf of all our foundation\xe2\x80\x99s partners and grantees. https://t.co/ydy6RAlgty'"
855405520626298880,2017-04-21 12:59:03,318,147,False,b'Sprinklr',b'The dollars we spend abroad pay dividends here at home. Here\xe2\x80\x99s my case for foreign aid. https://t.co/584xirQE2P https://t.co/TOof5ZUobE'
855058981710123010,2017-04-20 14:02:02,169,97,False,b'Sprinklr',b'Tune into @worldbank\xe2\x80\x99s #GenerationNow at 11 am ET. We\xe2\x80\x99ll discuss how investing in youth creates growth &amp; resilience. https://t.co/UDHetCDOeB https://t.co/puUtEnmU6q'
855047657538146305,2017-04-20 13:17:02,712,237,False,b'Sprinklr',b'I\xe2\x80\x99m so touched by Sheryl Sandberg\xe2\x80\x99s words in the #TIME100 list\xe2\x80\x94and I\xe2\x80\x99ll do everything I can to live up to them. https://t.co/ABvLKG2FFB https://t.co/03HWawkdL1'
854755727117864961,2017-04-19 17:57:00,432,174,False,b'Sprinklr',b'\xe2\x80\x9cWhile it\xe2\x80\x99s easy to find anger\xe2\x80\xa6 you can also find hope: girls and women are organizing like never before.\xe2\x80\x9d https://t.co/VuSXz4vPJE'
854693206600155136,2017-04-19 13:48:34,1258,693,False,b'Sprinklr',"b'Women are the greatest force for transforming societies. Empower them, and they\xe2\x80\x99ll change the world #PovertyIsSexist (via @ONECampaign) https://t.co/F5ekVMxpOL'"
854429831156707332,2017-04-18 20:22:00,111,40,False,b'Sprinklr',b'Excited to guest-edit today\xe2\x80\x99s Bloomberg @Business newsletter! Here are some of the stories I\xe2\x80\x99m following this week. https://t.co/U4eeICHBiV'
854331682660515841,2017-04-18 13:52:00,279,107,False,b'Sprinklr',"b'When it comes to contraceptives, knowing your options can be just as important as having them in the first place. https://t.co/O6o3lHghW4'"
853989929784930305,2017-04-17 15:14:00,146,37,False,b'Sprinklr',b'I\xe2\x80\x99ll be guest-editing the Bloomberg @Business newsletter tomorrow. Sign up here: https://t.co/7tEVNMfZ61'
853969205615611904,2017-04-17 13:51:39,379,188,False,b'Sprinklr',"b'For years, pandemics have moved faster than vaccines. But this new technology could help us outsmart the next Ebola or Zika. https://t.co/kjZvOG8tbu'"
853261379347808257,2017-04-15 14:59:00,425,236,False,b'Sprinklr',b'What message do we send to our kids when #AI personal assistants are designed as women? #weekendread https://t.co/KsJ0OzKTvq'
852919629185986560,2017-04-14 16:21:00,348,170,False,b'Sprinklr',"b""Nutrition not only empowers women &amp; girls\xe2\x80\x94nations benefit, too. Canada's @mclaudebibeau on unlocking this potential https://t.co/KTvomiPhrw"""
852880118926233601,2017-04-14 13:44:00,206,69,False,b'Sprinklr',b'The next Millie is out there. She\xe2\x80\x99ll change the world if we give her the chance. https://t.co/pqLAQWHkId'
852514458362675200,2017-04-13 13:31:00,655,385,False,b'Sprinklr',b'These engineers are changing the world\xe2\x80\x94and their stories deserve to be told. #womenintech https://t.co/CHsMPLrOcr'
852156347768504320,2017-04-12 13:48:00,290,182,False,b'Sprinklr',b'Great reminder from @planetmoney that the gender gap in tech starts with the messages we send our daughters. https://t.co/PAnhOdTf2H'
851787675438907392,2017-04-11 13:23:01,421,185,False,b'Sprinklr',"b'""Work for people you believe in, look for organizations you feel passionate about.\xe2\x80\x9d Great advice, @alyssamastro44. https://t.co/Ny9KturvaD'"
851428056019415041,2017-04-10 13:34:01,1209,495,False,b'Sprinklr',"b'What I saw in Indonesia makes it crystal clear: when we empower women and girls, the entire world benefits.\nhttps://t.co/8zeh2A8VLk https://t.co/RaBEOqSdAd'"
849980260544389122,2017-04-06 13:41:00,222,109,False,b'Sprinklr',"b""Too often, we put unfair and unrealistic demands on women's time. Thanks, @Tdufu, for reminding us to #droptheball. https://t.co/ufoKspHj9g"""
849611845858201600,2017-04-05 13:17:03,215,116,False,b'Sprinklr',b'When it comes to improving gender diversity in tech what does success look like? Here\xe2\x80\x99s what I told #thenationalmag. https://t.co/gJDmbnDLRj https://t.co/KlfrZxBQh1'
849356658111393792,2017-04-04 20:23:02,603,308,False,b'Sprinklr',b'\xe2\x80\x9cEqual pay is about women\xe2\x80\x99s worth in our economy &amp; society. There\xe2\x80\x99s nothing more fundamental than that\xe2\x80\x9d #equalpayday\nhttps://t.co/JyPuRCs3Ys'
848533979343069184,2017-04-02 13:54:00,1068,494,False,b'Sprinklr',"b'In Indonesia, I saw more proof that when we invest in contraceptives, we invest in a more stable &amp; prosperous future https://t.co/YKPQEAdwE6'"
847490407302934528,2017-03-30 16:47:13,292,92,False,b'Sprinklr',b'Thrilled to catch up with Barbara Bush and learn about how she and her team at @ghcorps are making history. \nhttps://t.co/BHP3uSCoT7'
847088330571341824,2017-03-29 14:09:30,249,87,False,b'Twitter Web Client',"b'In fact, nearly 7 out of 10 Americans agree that fathers should have paid parental leave. https://t.co/RMgFxXEmrW'"
847077888168001537,2017-03-29 13:28:01,265,80,False,b'Sprinklr',b'.@PoppyHarlowCNN\xe2\x80\x99s story reminds us why it\xe2\x80\x99s so important that new dads can take time to care for their kids. https://t.co/rVD7PleYVG'
