id,created_at,favorites,retweets,retweeted,source,text
1113813222426120194,2019-04-04 14:39:00,1034,354,False,b'Sprinklr',"b""In 2013, the share of women in computing and mathematical professions dropped below 1960 levels. We've got to fix this. https://t.co/BH2Uoz0ev1"""
1113463417359273985,2019-04-03 15:29:00,519,128,False,b'Sprinklr',"b""Periods are a normal, healthy part of life. \n\nAnd yet, they're still surrounded by stigma and shame in far too many parts of the world. Here\xe2\x80\x99s how @AmikaGeorge is working to change that with #freeperiods. https://t.co/EkuHNHh9RX"""
1112749214973509632,2019-04-01 16:11:01,475,55,False,b'Sprinklr',"b'""The Hate U Give"" was one of my favorite books from last year, so I really can\'t wait to read @angiecthomas\' next novel, ""On the Come Up."" It\'s next on my list! https://t.co/YA2o91U2qG'"
1112357378257833988,2019-03-31 14:14:00,915,349,False,b'Sprinklr',"b'To wrap up #WomensHistoryMonth, here are five badass women of science you should know. https://t.co/ALzxDxrANB'"
1111739054142513152,2019-03-29 21:17:00,0,62,False,b'Sprinklr',"b'RT @Ellevest: ""When the status quo isn\xe2\x80\x99t meeting women\xe2\x80\x99s needs, it deserves to be disrupted, and that\xe2\x80\x99s what this platform created by women\xe2\x80\xa6'"
1111642166298898432,2019-03-29 14:52:00,664,153,False,b'Sprinklr',"b""\xe2\x80\x9cWhen women control the money, female founders get funded.\xe2\x80\x9d Amen. \n\n@fcubedvc and other female-led venture capital firms are funding the next generation of innovative companies. I can't wait to see what they do. https://t.co/MMUGOYQUuE"""
1111279784397598720,2019-03-28 14:52:01,489,143,False,b'Sprinklr',b'Bias can be woven into the fabric of an organization\xe2\x80\x94or designed out of it. \n\nHere\xe2\x80\x99s a great read from Iris Bohnet on designing unbiased systems.\nhttps://t.co/5DLNjU6qvJ'
1110931276691705861,2019-03-27 15:47:11,216,43,False,b'Twitter Web Client',b'I\xe2\x80\x99ll be joined by two authors who I admire so much on two upcoming book tour stops: @johngreen and Ann Patchett. I hope you\xe2\x80\x99ll join us for what promises to be memorable conversations. https://t.co/IlXYGVCQpV https://t.co/XwyPPdADEy'
1110561293868720134,2019-03-26 15:17:00,496,144,False,b'Sprinklr',"b""It's remarkable (and alarming) how many components of our day-to-day lives\xe2\x80\x94from our phones to our cars to our public restrooms\xe2\x80\x94were built with men in mind. https://t.co/wwHJXeBaxm"""
1110184562506764289,2019-03-25 14:20:00,247,58,False,b'Sprinklr',"b'We were thrilled to listen in on this conversation between @robotsmarts and @timnitGebru. \n\nRead what these two remarkable thinkers had to say about leadership, discrimination, and fairness in the future of AI. #womenintech #diversityintech https://t.co/tWCpZZBCH3'"
1109798521237110785,2019-03-24 12:46:01,872,109,False,b'Sprinklr',"b'I\xe2\x80\x99m thrilled to announce that @BreneBrown will be joining me in New York as I kick off the tour for my new book, #MomentofLift. Bren\xc3\xa9 is a brilliant author, a huge source of inspiration, and most importantly, a friend\xe2\x80\x94I can\xe2\x80\x99t wait for our conversation. https://t.co/h6yqZTWdrl https://t.co/1mgbMArVeA'"
1109539816742502400,2019-03-23 19:38:01,865,204,False,b'Sprinklr',"b'Thank you, @reshmasaujani, for writing a book that sends such an important message to women and girls: It\xe2\x80\x99s more important to be brave than to be perfect. I only wish I could have read it when I was a teen. https://t.co/SQBeoDku0V'"
1109475388751859712,2019-03-23 15:22:00,479,135,False,b'Sprinklr',"b'To mark #womenshistorymonth, we put together a collection of books, podcasts and more that shed light on some of the lesser-known figures and stories. Take a look\xe2\x80\x94and tell me what you\xe2\x80\x99d add! https://t.co/uWmoju7A3U'"
1109099665474179072,2019-03-22 14:29:00,411,74,False,b'Sprinklr',"b""Meet the goat nurses who are helping some of India's poorest women become more financially secure. #heroesinthefield https://t.co/X4391pPBl6 https://t.co/bmsNNm1ju7"""
1108760431869550593,2019-03-21 16:01:01,323,49,False,b'Sprinklr',b'I am so excited to announce that @TheMandyMoore will join me on the #MomentofLift tour in San Francisco. (I promise not to talk about how much @BillGates and I love @NBCThisisUs the whole time! \xf0\x9f\x98\x82). Visit https://t.co/FjWBY7kH0Y to learn more. https://t.co/zVJ0BGALe6'
1108384953644052482,2019-03-20 15:09:00,286,58,False,b'Sprinklr',"b"".@abyahw, you inspire me. But more importantly, you're inspiring and empowering the next generation of investors and founders, too. Bravo. https://t.co/wMgsptf4jy"""
1108022315135184896,2019-03-19 15:08:00,244,66,False,b'Sprinklr',"b'What more can we be doing to help young people around the world reach their full potential?\n\n@asudi shares his perspective on which approaches work best, and why there is power in numbers. https://t.co/lgYUkdJkVv'"
1107691134883631106,2019-03-18 17:12:01,563,115,False,b'Sprinklr',"b""For 2019, my word of the year is \xe2\x80\x9cshine.\xe2\x80\x9d It's a reminder for all of us to turn on the lights inside of us, lift each other up, and shine together. Here\xe2\x80\x99s why I choose a word of the year: https://t.co/izUl1vFDeM \n\nIllustration by @kesalt. https://t.co/2kEhKwP4qF"""
1107285458109808640,2019-03-17 14:20:00,658,174,False,b'Sprinklr',b'Let\xe2\x80\x99s fight for a world where we all have a seat at the table. https://t.co/3i4YGMrUk0'
1106918540253241344,2019-03-16 14:02:00,594,135,False,b'Sprinklr',"b"".@_GirlsGarage is a dedicated workspace where girls can fuse metal, build furniture, repair bikes, and more\xe2\x80\x94and it's got a waiting list of 150.\n\nRead this piece from founder Emily Pilloton, and you'll understand why. #girlsinSTEM https://t.co/eF8Eo5b6NA"""
1106204587676090368,2019-03-14 14:45:00,572,167,False,b'Sprinklr',"b""If we want young women to grow up believing they can be and do anything they put their minds to, we've got to first make sure they can see other girls and women being and doing those things, too.  \n\nRead more in this fascinating piece. https://t.co/2EHdCcT6Gq"""
1105892529914998784,2019-03-13 18:05:00,566,142,False,b'Sprinklr',b'ICYMI: Watch this fantastic interview with @SallieKrawcheck about championing diversity in the workplace. https://t.co/Q7eenV1MzZ'
1105847506687180801,2019-03-13 15:06:05,262,69,False,b'Sprinklr',"b'Joining in for #Web30 to celebrate milestones in the 30 years of the internet: In 2018, @UNSGdigicoop formed to identify steps the world can take to ensure the benefits of digital technology are extending to the world\xe2\x80\x99s poorest people, too. #ForTheWeb https://t.co/g3RxPrBETH'"
1105467583791161350,2019-03-12 13:56:25,487,101,False,b'Twitter Media Studio',"b""In my new book, #MomentofLift, I share the stories of women who are lifting up their communities and changing the world\xe2\x80\x94women who have inspired me to be more courageous in my life. I hope they'll do the same for you. Pre-order your copy today. https://t.co/FjWBY7ChSw https://t.co/U1KoCiYS5J"""
1105214221757739008,2019-03-11 21:09:39,852,171,False,b'Twitter Web Client',"b'If enacted, this proposal would reduce international family planning funding. Support for family planning is essential to promoting women\xe2\x80\x99s economic empowerment and ending gender inequality around the world.'"
1105214220520415232,2019-03-11 21:09:38,2088,599,False,b'Twitter Web Client',b'I get asked all the time whether I think this administration supports women. The budget the White House released today speaks for itself. The cuts it proposes would have a devastating impact on women\xe2\x80\x99s health and women\xe2\x80\x99s futures.'
1104762840819339267,2019-03-10 15:16:01,314,62,False,b'Sprinklr',"b'This audio recording of #MomentofLift was made possible by hot tea, a balance board, and yoga breaks. Follow along with my day in the studio on my Instagram story and learn more at https://t.co/FjWBY7kH0Y. https://t.co/AZIn32G1xj'"
1104457826615738368,2019-03-09 19:04:00,717,193,False,b'Twitter Media Studio',"b'If a girl can see it\xe2\x80\x94then she can be it. \n\nI am so excited for the official launch of IF/THEN, a new initiative working to inspire the next generation of women to enter into STEM. Visit https://t.co/GxFTBJS3UY to learn more. #IfThenSheCan https://t.co/E7TofZsJMk'"
1104396673411895296,2019-03-09 15:01:00,329,48,False,b'Sprinklr',b'.@AbbyWambach has a new rule for women\xe2\x80\x94and I am loving it. \xf0\x9f\x92\xaa https://t.co/198dcWpGq0'
1104115822887428097,2019-03-08 20:25:00,0,89,False,b'Sprinklr',"b'RT @MalariaNoMore: This #WomensDay we\xe2\x80\x99re celebrating the women leaders, innovators, community activists &amp; heads of state who are saving the\xe2\x80\xa6'"
1104084617131380736,2019-03-08 18:21:00,337,66,False,b'Sprinklr',b'Follow along today and be inspired! \xf0\x9f\x91\x87 #InternationalWomensDay https://t.co/hapde68z6Q'
1104069518186430470,2019-03-08 17:21:00,0,289,False,b'Sprinklr',b'RT @ONECampaign: Over 40 African activists came together to create this bold demand for gender equality. These women won\xe2\x80\x99t stop until every\xe2\x80\xa6'
1104045359507140608,2019-03-08 15:45:00,155,28,False,b'Sprinklr',"b'@momgerm @momgerm mental well-being is such an important issue, and I\xe2\x80\x99m so inspired by the work you and @ladygaga do with @BTWFoundation to empower and support young people.'"
1104043597928767498,2019-03-08 15:38:00,849,132,False,b'Sprinklr',"b""Thanks, @momgerm. You inspire me, too!\n\nI'm tagging in @ava, whose commitment to telling important stories and bringing powerful perspectives to light isn't just changing Hollywood\xe2\x80\x94it's changing the world. #SheInspiresMe https://t.co/9AzwUD0S1f"""
1104021411113263104,2019-03-08 14:09:50,2301,667,False,b'Twitter Media Studio',"b'Something powerful happens when you ask a woman to tell her story. \n\nAnd sometimes, the most powerful statement of support we can offer to a woman is the one we make by listening.\n\nThis #IWD2019, here\xe2\x80\x99s what that means to me. https://t.co/hDxx8WOeeZ https://t.co/95qB3IKe8i'"
1103661076682547200,2019-03-07 14:18:00,700,137,False,b'Sprinklr',"b'I\xe2\x80\x99m excited to share an early look at my first book, \xe2\x80\x9cThe Moment of Lift."" In this excerpt, I explain what the title means to me\xe2\x80\x94and why I believe that lifting up women lifts up humanity. #MomentofLift https://t.co/HQSAIfeKyH'"
1103314291204284416,2019-03-06 15:20:00,400,125,False,b'Sprinklr',b'Nine photographers from around the world. Nine interpretations of forward progress. https://t.co/dvYTiMss3a'
1103015069640740864,2019-03-05 19:31:00,474,121,False,b'Sprinklr',"b""Welcome to Evoke\xe2\x80\x94a place to start conversations, amplify new voices, and forge stronger bonds between change-makers. I hope you'll join us. https://t.co/fT0VNmtkjx"""
1102638842564218883,2019-03-04 18:36:00,426,60,False,b'Sprinklr',"b"".@UW is right across the lake from our home, and even closer to our hearts.\n\nWe're excited to see the opening of its new computer science building\xe2\x80\x94doubling UW's annual enrollment capacity for computer science. I can't wait to see what these students do. https://t.co/AExTRjdyfr"""
1101888615762735104,2019-03-02 16:54:52,856,119,False,b'Twitter Media Studio',b'We had a lot of fun answering important questions like \xe2\x80\x9cWhich one of you is worse at responding to texts?\xe2\x80\x9d (Spoiler alert: definitely Bill.) https://t.co/oLzD5e7lq0'
1101516444880302080,2019-03-01 16:16:00,1521,195,False,b'Sprinklr',b'\xf0\x9f\x91\x87\xf0\x9f\x91\x87\xf0\x9f\x91\x87I couldn\xe2\x80\x99t agree more. I\xe2\x80\x99m glad that \xe2\x80\x9cPeriod. End of Sentence.\xe2\x80\x9d brought this important topic to the Oscars. https://t.co/6IIySnXuzj'
1101154312733028352,2019-02-28 16:17:01,901,139,False,b'Sprinklr',"b""#TBT to some of my goals from high school. I still think setting ambitious goals is hugely important, but I've also come to realize it's just as important to give yourself space to learn from the unexpected. \nSometimes it's those surprises that show you the way forward. https://t.co/ELCCZmC4tN"""
1100793436179976198,2019-02-27 16:23:01,300,56,False,b'Sprinklr',"b""Loved chatting with @KristenScholer of @cheddar about how cell phones can change the lives of the world's poorest women. Watch it here. https://t.co/CKj5rOqvAo https://t.co/dn2NTW0k8b"""
1100442965883772928,2019-02-26 17:10:22,773,240,False,b'Twitter Media Studio',b'How much income did women in developing countries earn last year? How much property do they own? \n\nI don\xe2\x80\x99t know. Neither does anyone else. The data just doesn\xe2\x80\x99t exist. I spoke with @jessiwrites about how we change this. https://t.co/5y6RNw9l48'
1100091807688548354,2019-02-25 17:55:00,370,78,False,b'Sprinklr',"b""Last year, a group of teenage boys in Chicago changed how @BillGates thinks about processing anger.\n\nRead that story\xe2\x80\x94and eight other times we've been surprised. https://t.co/tWvY4K3uCy"""
1099711475713662982,2019-02-24 16:43:42,1595,421,False,b'Twitter Media Studio',"b'If you\xe2\x80\x99re anything like me, toilets probably aren\xe2\x80\x99t your favorite topic of conversation. But if you care about keeping girls in school, expanding women\xe2\x80\x99s economic participation, and protecting them against violence, then we have to be willing to talk about toilets. https://t.co/bFLhvs71nA'"
1099347666624950272,2019-02-23 16:38:03,2385,490,False,b'Twitter Media Studio',"b""It\xe2\x80\x99s time our data reflected the full picture of a woman's life. https://t.co/rGRVvqRAkt"""
1099082837746040832,2019-02-22 23:05:43,102,29,False,b'Twitter Web Client',"b'Mobile phones are used to change social norms &amp; challenge the power structures that continue gender inequality.\n\nAccording to a study of 10 countries across Africa, Asia &amp; South America\xe2\x80\x93how much less likely are women to have used the internet than men? https://t.co/roSmvHssE8'"
1099082836550705152,2019-02-22 23:05:42,85,24,False,b'Twitter Web Client',b'There have been several breakthroughs recently in understanding what causes babies to be born early. \n\nHow many premature babies are born every year around the world?\n\nLearn the answer here: https://t.co/mNpyfuEUTc'
1099082835615395840,2019-02-22 23:05:42,64,24,False,b'Twitter Web Client',"b'The more education a woman has, the better equipped she is to raise healthy children.\n\n@UNESCO estimates if all women in low- and middle-income countries finished secondary school, child mortality in those countries would fall by\xe2\x80\xa6\n\nLearn the answer here: https://t.co/rScSsEuM9H'"
1099082834361241602,2019-02-22 23:05:42,55,16,False,b'Twitter Web Client',"b'When data is flawed, it\xe2\x80\x99s easy to undervalue women\xe2\x80\x99s economic activity.\n\nWhich data about women are developing countries least likely to have?\n\nLearn the answer here: https://t.co/vnMyKBwapz'"
1099079605753864192,2019-02-22 22:52:52,266,48,False,b'Twitter Web Client',"b'In our 2019 Annual Letter, Bill and I share the biggest surprises we\xe2\x80\x99ve come across in our work. Take this quiz to see if our findings surprise you as well \xf0\x9f\x91\x87'"
1098998610254090241,2019-02-22 17:31:01,629,136,False,b'Sprinklr',b'Young Africans will shape the future of not only their own communities but the entire world. Here\xe2\x80\x99s why.  https://t.co/xv34VKz2je https://t.co/DUP06fZwxv'
1098720269949120514,2019-02-21 23:05:00,0,226,False,b'Sprinklr',"b""RT @gatesfoundation: Africa is the world's youngest continent, with a median age of only 18 years. Investing in Africa's youth can unlock t\xe2\x80\xa6"""
1098403978977587200,2019-02-21 02:08:10,0,4552,False,b'Twitter Web Client',b'RT @BillGates: I wish more people fully understood what it will take to stop climate change. I break down the five grand challenges we face\xe2\x80\xa6'
1097910442184396800,2019-02-19 17:27:02,739,145,False,b'Sprinklr',"b""We often get asked whether we're still optimistic about the future. Our answer: Absolutely. A big reason is that, for every challenge we see, there are people devoting their lives to finding innovative solutions. https://t.co/eBXHq9uWLR https://t.co/64mfyfYKlz"""
1097501630902218752,2019-02-18 14:22:34,3707,1119,False,b'Sprinklr',b'What is the most powerful phone in the world? The one in the hands of the world\xe2\x80\x99s poorest women. https://t.co/lKlSzih9nr'
1097181631738249216,2019-02-17 17:11:00,203,32,False,b'Sprinklr',b'I loved sitting down with @ingridnilsen to talk about some of the surprises we cover in this year\xe2\x80\x99s Annual Letter. https://t.co/HhN5ejWntO'
1096941985468837888,2019-02-17 01:18:44,282,40,False,b'Twitter Web Client',b'It was an honor to be included in such a special event. I hope you enjoy watching these candid #SuperSoulConversations. https://t.co/5jktHt5dJF'
1096937900430766080,2019-02-17 01:02:30,1539,331,False,b'Sprinklr',"b'If anyone can get me to reveal my word of the year this early, it\xe2\x80\x99s @Oprah. \xf0\x9f\x98\x8a Here\xe2\x80\x99s a peek into what we talked about on #SuperSoulConversations. https://t.co/7seBqWbneB'"
1096552190590607360,2019-02-15 23:29:49,0,351,False,b'Twitter Web Client',b'RT @Oprah: They\xe2\x80\x99ve all used their lives &amp; art to propel conversation and culture forward. @BetoORourke @MichaelB4Jordan #BradleyCooper @Mel\xe2\x80\xa6'
1096440706812526592,2019-02-15 16:06:50,1485,167,False,b'Sprinklr',"b'When I moved to Seattle to work for Microsoft, I would never have imagined Bill and I dating, let alone falling in love and getting married. That\xe2\x80\x99s been one of the best surprises of my life. \n\nWhat have been some of the best surprises in your life? https://t.co/MN60XdLSbZ'"
1095731829485772800,2019-02-13 17:10:00,0,35,False,b'Sprinklr',"b""RT @CBSThisMorning: WATCH: @BillGates and @MelindaGates join us to reveal their 11th annual letter highlighting nine things they didn't see\xe2\x80\xa6"""
1095687034251952128,2019-02-13 14:12:00,950,115,False,b'Sprinklr',b'And you might also be surprised to find out Bill doesn\xe2\x80\x99t know what color the Space Needle is. \xf0\x9f\x98\x89 https://t.co/4svyCGrTz1'
1095377377369251840,2019-02-12 17:41:32,171,17,False,b'Sprinklr',"b""@BillGates and I are live with @wkamaubell and high schoolers from across New York. We can't wait to hear how they're going to change the world. Tune in. https://t.co/rHJsxk2aEU https://t.co/KD3CWk2Fka"""
1095307785108111361,2019-02-12 13:05:00,749,232,False,b'Sprinklr',"b'In our new Annual Letter, @BillGates and I share some of the biggest surprises that have called us to action. https://t.co/gR8frOuI1P'"
1095008566275121152,2019-02-11 17:16:01,691,74,False,b'Sprinklr',b'Throwback to the early days of the \xe2\x80\x9cStephen and Melinda Gates Foundation.\xe2\x80\x9d \xf0\x9f\x98\x82 Excited to chat with @StephenAtHome on Tuesday night. Tune in for @colbertlateshow! https://t.co/GRsnqi27yP'
1094612955675664385,2019-02-10 15:04:00,1322,300,False,b'Sprinklr',b'So many wonderful observations in here from @priyankachopra about the implications of the lack of diversity in tech. Read the whole interview. https://t.co/Mep3M1rGNP'
1093914604785336321,2019-02-08 16:49:00,413,105,False,b'Sprinklr',"b""The good news: There are more women in Japan's labor force than ever before. The bad news: The workload at home isn't getting any lighter. \n\nThis is a must-read on the cost of unpaid labor. https://t.co/b4r81Bjnmt"""
1093535456569057284,2019-02-07 15:42:24,851,178,False,b'Sprinklr',"b'Each of us can be a force pushing toward gender equality\xe2\x80\x94in our homes, in our workplaces, and in our communities. That\xe2\x80\x99s the message I\xe2\x80\x99ll be sharing this spring on my book tour. I hope you\xe2\x80\x99ll join me. https://t.co/aFlIHY3d3y #MomentofLift https://t.co/Qr7x2dtz7j'"
1093212486797545476,2019-02-06 18:19:02,782,111,False,b'Sprinklr',"b'Any day I get to talk with @Oprah is a good day. Loved speaking with her yesterday about #MomentofLift and my journey as a woman, wife, mother, and everything in between. Look out for the episode on @SuperSoulSunday and @OWNTV this spring! #SuperSoulConversations https://t.co/evU4L0W9M1'"
1091713098044583937,2019-02-02 15:01:00,963,262,False,b'Sprinklr',"b""These brilliant women are an inspiration. But the fact remains that black women are still among the least likely to get investments from venture capitalists. That's a problem, and we've all got to own the solution. https://t.co/cFGdDv9eHE"""
1091441308063989761,2019-02-01 21:01:00,629,207,False,b'Sprinklr',"b""These nine black women\xe2\x80\x94whose contributions span law, activism, academia, and culture\xe2\x80\x94almost certainly weren't in your history books. It's high time you met them. #BlackHistoryMonth https://t.co/WWuU7bcaSs"""
1090657895677538306,2019-01-30 17:08:00,1037,186,False,b'Sprinklr',"b""It's an amazing compliment to be included in @InStyle\xe2\x80\x99s \xe2\x80\x9cBadass Women\xe2\x80\x9d issue. Kudos to the millions of badass women around the world, who do what it takes to get the job done every day. https://t.co/GAZVxfvegm"""
1090292238381445120,2019-01-29 16:55:00,975,283,False,b'Sprinklr',"b""The Global Polio Eradication Initiative. @gavi. @GlobalFund. @theGFF. These four organizations quietly save millions of lives around the world\xe2\x80\x94and right now, they're at risk. Learn what's at stake and help them continue their life-saving work. https://t.co/Uq1LFlfFNw"""
1089938908643819521,2019-01-28 17:31:00,466,96,False,b'Sprinklr',"b""2018 may be past us, but as far as I'm concerned, every year is the \xe2\x80\x9cYear of the Woman.\xe2\x80\x9d Thank you, @sarah_hendriks, for this inspiring list of women making real change around the world. https://t.co/UuAOrsI6Yu"""
1089195512492896256,2019-01-26 16:17:01,569,87,False,b'Sprinklr',"b'Library workers are the guardians of our stories\xe2\x80\x94the ones who collect them and protect them and pass them on. Thank you, @ALALibrary and @Nancy_Pearl, for the opportunity to share a few stories of my own. #alamw19 #MomentofLift https://t.co/zMfrsWtfr6'"
1088483205521522688,2019-01-24 17:06:33,1252,295,False,b'Sprinklr',"b""Since 2000, the number of children dying in poor countries has dropped by 40 percent. That didn't happen by accident.\n\nInvesting in global health works. https://t.co/lrthfLQsf0"""
1088134019475300352,2019-01-23 17:59:01,392,96,False,b'Sprinklr',"b'Yesterday, I shared the stage with @BrunoLeMaire to advocate for women\xe2\x80\x99s access to digital financial services across Africa. G7 leaders can help accelerate financial inclusion and women\xe2\x80\x99s economic empowerment by investing in these crucial tools. #RDVBercy2019 https://t.co/G9JUUFOrI0'"
1087733628539416582,2019-01-22 15:28:00,802,128,False,b'Sprinklr',b'Great to be in Geneva talking about the best investment Bill and I ever made\xe2\x80\x94helping fund global health institutions. Thanks @Gavi @theGFF @GlobalFund @stopTB @unitaid @WHO and #rollbackmalaria for your leadership in improving the health of families around the world. https://t.co/AbbSw9T7HS'
1087452609969938432,2019-01-21 20:51:20,662,103,False,b'Twitter Web Client',"b""Honored to co-chair the @UNSGdigicoop meeting with Jack Ma today to talk about how civil society, companies, and governments can work together to ensure more people benefit from technology. I'm looking forward to sharing our final recommendations later this year. https://t.co/auB6Gc8dHE"""
1087356897278246918,2019-01-21 14:31:01,2821,1001,False,b'Sprinklr',"b""Today and every day, let's make sure we're answering Dr. King's essential question not only with words but with action. #MLKDay https://t.co/OJpyXStwd0"""
1087009102495182849,2019-01-20 15:29:00,1239,389,False,b'Sprinklr',b'Need a little inspiration this 2019? Meet 11 women doing incredible work in the fight for gender equality. \nhttps://t.co/6jq2JwWiah'
1086636900591587328,2019-01-19 14:50:00,1206,253,False,b'Sprinklr',"b""Do yourself a favor and scroll through these beautiful portraits at some point today. Think about how far we've come\xe2\x80\x94and remember that we're only getting started. https://t.co/sZS1qrdmne"""
1086319178523512833,2019-01-18 17:47:29,499,101,False,b'Sprinklr',b'My hope for the decade ahead? Cutting child deaths in half again. The decisions we make in the next two years will determine whether this goal is within reach. https://t.co/iPuTkOJ0zt'
1086034182688645120,2019-01-17 22:55:01,774,161,False,b'Sprinklr',b'One of my favorite poems. Mary Oliver\xe2\x80\x99s legacy will live on through her powerful words. https://t.co/stnorLsmor'
1085936287549452294,2019-01-17 16:26:01,438,83,False,b'Sprinklr',"b'Honored to be included on this @oprahmagazine list alongside so many authors I admire. Now, I just have to figure out which of these to read first... https://t.co/zzT23rdmqv'"
1085183070771257344,2019-01-15 14:33:00,571,124,False,b'Sprinklr',"b'Last month, Joy became one of the first babies in Vanuatu to receive her vaccines via drone. This program could be a game-changer for remote villages around the world. https://t.co/8PJ2Tq3W6w'"
1083378685493821441,2019-01-10 15:03:01,1341,206,False,b'Sprinklr',"b'One of the books at the top of my 2019 reading list is out. Congratulations, @Malala \xe2\x80\x94 you continue to be an inspiration to the world.  #WeAreDisplaced https://t.co/OWSkWGPeEn'"
1083035670820483072,2019-01-09 16:20:00,419,116,False,b'Sprinklr',"b'Dr. Bernice Sandler leaves behind an extraordinary legacy. She spent decades fighting for our rights to learn, to teach, to be seen as equals\xe2\x80\x94and the landmark legislation she helped pass began a new era for women in this country. https://t.co/EXdGvPMHI8'"
