id,created_at,favorites,retweets,retweeted,source,text
1120783469171433472,2019-04-23 20:16:16,757,137,False,b'Sprout Social',b'About to head on stage for my conversation with @mollyesque at the #TIME100 Summit!\n\nBe sure to watch: https://t.co/rzZHAnncqX'
1120738247418765314,2019-04-23 17:16:35,536,121,False,b'Buffer',b'Looking forward to speaking with @mollyesque at 4 pm ET as part of the #TIME100 Summit.\n\nTune in here: https://t.co/rzZHAnncqX'
1120406677801656323,2019-04-22 19:19:02,8856,1762,False,b'Sprout Social',"b'Today, we celebrate #EarthDay &amp; the diversity of the planet we call home, and renew our commitment to combat the climate crisis and protect the air we breathe, the water we drink and the beauty of God\xe2\x80\x99s creation for generations to come. https://t.co/kCImbkR6WC'"
1120051915356889089,2019-04-21 19:49:20,3808,397,False,b'Buffer',b'Wishing you all a Happy #Easter filled with joy &amp; family! https://t.co/wDdu1fQjDC'
1119958473427623936,2019-04-21 13:38:02,15714,2602,False,b'Buffer',b'Today\xe2\x80\x99s heartbreaking attacks in Sri Lanka come as the country has worked hard to build a common future after years of war. Our thoughts are with the injured &amp; the families of those killed in today\xe2\x80\x99s Easter Sunday attacks.'
1119715838905475072,2019-04-20 21:33:53,9759,1926,False,b'Buffer',"b'20 years after Columbine, our thoughts remain with the survivors &amp; the families of those killed. We must honor our responsibility to #EndGunViolence in all its forms. https://t.co/sbsVeZtBqB'"
1119591805035716609,2019-04-20 13:21:01,0,339,False,b'Twitter Web App',b'RT @RepDebDingell: The first #100DaysForThePeople brought progress on countless issues that impact working men and women every single day.\xe2\x80\xa6'
1119352673973805057,2019-04-19 21:30:48,2410,399,False,b'Sprout Social',b'Wishing the very best to all marking the start of #Passover tonight at sundown! https://t.co/xkgqvjd1lF'
1119323989174837248,2019-04-19 19:36:49,4411,1331,False,b'Twitter Media Studio',"b'The first #100DaysForThePeople were defined by action on the issues that matter most to Americans: improving health care, stopping domestic abuse, preventing gun violence. And as @RepDebDingell says, we\xe2\x80\x99re just getting started. https://t.co/Ph3JflgFn9'"
1118995356988190725,2019-04-18 21:50:57,16169,4709,False,b'Twitter Web Client',b'Read my full statement with @SenSchumer \xe2\x80\x93 including a description of several of the ways Attorney General Barr misled the public \xe2\x80\x93 here: https://t.co/rzIylA2MoH'
1118995356245725184,2019-04-18 21:50:57,31621,7141,False,b'Twitter Web Client',"b'The #MuellerReport paints a disturbing picture of a president who has been weaving a web of deceit, lies and improper behavior and acting as if the law doesn\xe2\x80\x99t apply to him.'"
1118995355498995712,2019-04-18 21:50:57,66968,14813,False,b'Twitter Web Client',b'We\xe2\x80\x99ve learned today that AG Barr deliberately distorted significant portions of the #MuellerReport.'
1118938413082787841,2019-04-18 18:04:41,15384,4213,False,b'Twitter Web Client',"b'As we continue to review the report, one thing is clear: AG Barr presented a conclusion that @realDonaldTrump did not obstruct justice while the #MuellerReport appears to undercut that finding. https://t.co/mHCzGc8RGT'"
1118938412294316033,2019-04-18 18:04:41,32603,7449,False,b'Twitter Web Client',b'The differences are stark between what Attorney General Barr said on obstruction and what Special Counsel Mueller said on obstruction. #MuellerReport'
1118883825550024705,2019-04-18 14:27:46,40369,13944,False,b'Twitter Web Client',b'AG Barr has confirmed the staggering partisan effort by the Trump Admin to spin public\xe2\x80\x99s view of the #MuellerReport \xe2\x80\x93 complete with acknowledgment that the Trump team received a sneak preview. It\xe2\x80\x99s more urgent than ever that Special Counsel Mueller testify before Congress. https://t.co/waoGzLntlt'
1118840805295366144,2019-04-18 11:36:49,10939,3285,False,b'Twitter Web App',b'Read my full statement with @SenSchumer: https://t.co/KTA1FW3XFQ'
1118840804519350272,2019-04-18 11:36:49,28209,6451,False,b'Twitter Web App',b'The only way to begin restoring public trust in the handling of the Special Counsel\xe2\x80\x99s investigation is for Special Counsel Mueller himself to provide public testimony in the House and Senate as soon as possible.'
1118840803693146112,2019-04-18 11:36:49,59057,13500,False,b'Twitter Web App',b'Attorney General Barr\xe2\x80\x99s partisan behavior has triggered a crisis of independence &amp; impartiality.'
1118662257439858688,2019-04-17 23:47:20,30760,10433,False,b'Buffer',"b'AG Barr has thrown out his credibility &amp; the DOJ\xe2\x80\x99s independence with his single-minded effort to protect @realDonaldTrump above all else. The American people deserve the truth, not a sanitized version of the Mueller Report approved by the Trump Admin. https://t.co/fgXwiLuQfr'"
1118639411443400711,2019-04-17 22:16:33,2920,588,False,b'Twitter Media Studio',"b'For generations, Ireland has been the emerald thread in the fabric of American history and national life. America is grateful for your partnership, glad to share in the joy of this centennial, and looking forward to another 100 years of Irish leadership in the world. #D\xc3\xa1il100 https://t.co/kGGxHBFHB0'"
1118625935794868225,2019-04-17 21:23:00,23009,8254,False,b'Sprout Social',"b'Let me be clear: if the Brexit deal undermines the Good Friday Accords, there will be no U.S.-U.K. trade agreement. #D\xc3\xa1il100'"
1118612652509618177,2019-04-17 20:30:13,1188,214,False,b'Sprout Social',"b'It was a great honor to accept @SOFearghail_TD\xe2\x80\x99s invitation to speak before the Oireachtas today in Dublin, celebrating the centennial of the D\xc3\xa1il and the great shared history and partnership between the United States and Ireland. #D\xc3\xa1il100 https://t.co/Est9jv58P4'"
1118592111383863297,2019-04-17 19:08:36,32665,5307,False,b'Twitter Web Client',"b'\xe2\x80\x9cIf you want something done, ask a busy woman to do it.\xe2\x80\x9d  Thank you to Secretary @HillaryClinton for your kind words. Honored to be included in the #TIME100. https://t.co/B2jU4J3LRQ'"
1118553549439406080,2019-04-17 16:35:22,9834,2326,False,b'Twitter Media Studio',b'We all stand on the shoulders of the women who came before us \xe2\x80\x93 and those who follow us will build the future off the progress we achieve today. #TIME100 https://t.co/QiCsctZckQ'
1118316370008182785,2019-04-17 00:52:54,12171,2501,False,b'Twitter Web App',"b'This conflict must end, now. The House of Representatives calls on the President to put peace before politics, and work with us to advance an enduring solution to end this crisis and save lives.'"
1118316369307742208,2019-04-17 00:52:54,21273,5964,False,b'Twitter Web App',"b'The conflict in Yemen is a horrific humanitarian crisis that challenges the conscience of the entire world. Yet the President has cynically chosen to contravene a bipartisan, bicameral vote of the Congress &amp; perpetuate America\xe2\x80\x99s shameful involvement in this heartbreaking crisis.'"
1118229289328050177,2019-04-16 19:06:52,5457,1372,False,b'Twitter Media Studio',b'The effort to #ProtectOurDemocracy is about patriotism \xe2\x80\x93 not partisanship. #60Minutes https://t.co/6dhRgGdYaF'
1118190559439544321,2019-04-16 16:32:59,5549,987,False,b'Twitter Media Studio',"b'You can take the girl out of Baltimore, but you can\xe2\x80\x99t take Baltimore out of the girl. #60Minutes https://t.co/Ibudl4ooVl'"
1117890590471884800,2019-04-15 20:41:00,3650,565,False,b'Buffer',"b'We were honored to be welcomed to Westminster yesterday by the Speaker of the House of Commons, John Bercow, hearing his deep expertise on Parliament \xe2\x80\x94 and on how to get the most of a call for \xe2\x80\x9cOrder!\xe2\x80\x9d https://t.co/b0Brk0zlgi'"
1117882490889351171,2019-04-15 20:08:49,23738,4389,False,b'Sprout Social',"b'.@NotreDameParis has stood as a beating heart of religion &amp; culture for centuries, inspiring all who have visited her. The footage of today\xe2\x80\x99s fire is nothing short of heartbreaking. To the people of Paris &amp; France: know that America stands with you.'"
1117826153253888001,2019-04-15 16:24:57,481,122,False,b'Sprout Social',b'Looking forward to today\xe2\x80\x99s conversation with @ptrubowitz of @LSEnews here in London at 6:30 pm local time/1:30 pm ET. #LSEPelosi\n\nBe sure to tune in here: https://t.co/BNni3Upecf'
1117645975894614017,2019-04-15 04:29:00,33155,7655,False,b'Twitter Media Studio',b'Why focus on describing the President when he does it so well for us each and every day. #60Minutes https://t.co/xujZo0sEJz'
1117624668826013696,2019-04-15 03:04:20,7424,1742,False,b'Twitter Media Studio',"b'Our first #100DaysForThePeople showed America that change is possible. Now, we need to work together to make it last. #60Minutes https://t.co/cp8eTPe2iC'"
1117607118088081408,2019-04-15 01:54:35,13872,3060,False,b'Twitter Media Studio',b'We cannot fail to live up to the example set for us by our Founders. #60Minutes https://t.co/GPCWNv6Pll'
1117516865331396609,2019-04-14 19:55:57,4358,1062,False,b'Buffer',"b'Pleased to have had a candid discussion with @jeremycorbyn today about the direction of Brexit, Northern Ireland, NATO, acting boldly on climate, protecting human rights, and the necessity of forcefully confronting anti-Semitism &amp; Islamophobia. https://t.co/xadfAaZO8d'"
1117499876328267787,2019-04-14 18:48:27,33219,9988,False,b'Buffer',"b'.@realDonaldTrump\xe2\x80\x99s dangerous video must be taken down. I have spoken with the Sergeant-at-Arms to ensure that Capitol Police are conducting a security assessment to safeguard Rep. @Ilhan Omar, her family &amp; her staff. They will continue to monitor &amp; address the threats she faces. https://t.co/Grb9c8S18d'"
1117395599685558273,2019-04-14 11:54:05,4812,1221,False,b'Buffer',"b'Important discussion with former Labour Party MPs @MikeGapes,@ChrisLeslieMP &amp; @IanAustinMP to hear their perspective on Brexit, why they left the Labour Party, and the importance of standing unequivocally against anti-Semitism wherever it is found. https://t.co/RcQKfjd37d'"
1117188615979839490,2019-04-13 22:11:37,15036,4354,False,b'Buffer',b'No American with the bravery &amp; ability to serve should be turned away by our military because of who they are. To the author &amp; their fellow trans service members: we will not stop fighting for you. Our thoughts are with you &amp; your loved ones. #FightTheBan https://t.co/6K8UCWbpcy'
1117176969068724226,2019-04-13 21:25:20,1422,385,False,b'Buffer',"b'Today, our delegation was briefed by Gen. Thomas Waldhauser, Commander of @USAfricaCommand &amp; Lt. Gen. Stephen Twitty, Deputy Commander of @US_EUCOM \xe2\x80\x94 covering the range from developing situations in Africa, to climate-change driven instability, to NATO &amp; Russian aggression. https://t.co/fHXx9EnNmb'"
1117155702705934338,2019-04-13 20:00:49,814,268,False,b'Buffer',"b'This week, I had the chance to sit down with @karaswisher of @recode for nearly an hour to discuss our first #100DaysForThePeople. You can listen to our conversation here: https://t.co/fXhvA76ta3 https://t.co/by50lVR5ln'"
1117108233016094721,2019-04-13 16:52:12,1973,373,False,b'Buffer',b'.@the_USO has always symbolized our nation\xe2\x80\x99s commitment to our warriors. These care packages \xe2\x80\x94 which we helped assemble on Thursday \xe2\x80\x94 are a small token on behalf of a grateful nation to the men &amp; women who don the uniform. https://t.co/uNgfg84kmc'
1117067025942233088,2019-04-13 14:08:27,5612,975,False,b'Buffer',b'Major Bill Collins served as a Wounded Warrior Fellow in my office almost ten years ago. I was delighted to see him again when I visited Lt. General Twitty and our troops for top-level briefings at @US_EUCOM in Stuttgart today. Thank you for your service! https://t.co/9fv4ijNRa8'
1117024803515445248,2019-04-13 11:20:41,23989,4449,False,b'Twitter Web App',"b'As we visit our troops in Stuttgart to thank them and be briefed by them, we honor our first responsibility as leaders to protect and defend the American people.  It is wrong for the President, as Commander-in-Chief, to fan the flames to make anyone less safe.'"
1117024802403840000,2019-04-13 11:20:40,61600,11863,False,b'Twitter Web App',"b'The memory of 9/11 is sacred ground, and any discussion of it must be done with reverence.  The President shouldn\xe2\x80\x99t use the painful images of 9/11 for a political attack.'"
1116943118614585345,2019-04-13 05:56:05,0,306,False,b'Twitter Web App',b'RT @RepEliotEngel: Today as we intro the #DayOfSilence Res. we not only stand w/#LGBTQ students to call attention to the widespread harassm\xe2\x80\xa6'
1116871602711429120,2019-04-13 01:11:55,2304,490,False,b'Buffer',"b'For 13 years, Rep. @DaveLoebsack has been a proud champion for the hard-working men &amp; women of Iowa. His leadership &amp; uncompromising voice will be missed in the halls of Congress. We wish him the best as he prepares for his next chapter. https://t.co/4B9MtZm9i2'"
1116809216365355008,2019-04-12 21:04:01,4631,1400,False,b'Sprout Social',b'No part of our government should ever refer to a transgender person\xe2\x80\x99s need to transition as a \xe2\x80\x9cdefect\xe2\x80\x9d or a \xe2\x80\x9cdeficiency.\xe2\x80\x9d Those ideas belong in the past \xe2\x80\x93 and they should stay there. #ProtectTransTroops https://t.co/u8nzy0rWEl'
1116793615282368513,2019-04-12 20:02:01,0,212,False,b'Twitter Web Client',"b'RT @EdLaborCmte: PROMISES KEPT: In the first 100 days of the 116th Congress, this Committee has approved legislation to\xe2\x80\xa6\n\xe2\x9c\x85 improve public s\xe2\x80\xa6'"
1116791844149399553,2019-04-12 19:54:59,0,471,False,b'Twitter Web App',b'RT @PelosiPress: Numbers don\xe2\x80\x99t lie. Here\xe2\x80\x99s a quick look at some of the key data points behind @HouseDemocrats\xe2\x80\x99 first #100DaysForThePeople.\xe2\x80\xa6'
1116786305659219969,2019-04-12 19:32:58,0,171,False,b'TweetDeck',b'RT @RepGilCisneros: These first 100 days have been one for the books. My team &amp; I are proud to have helped over 50 people from #CA39 &amp; look\xe2\x80\xa6'
1116786148972597251,2019-04-12 19:32:21,0,151,False,b'Twitter Web Client',b'RT @RepBonnie: The first #100DaysForThePeople has seen a wave of action in the House on issues the American people care about:\n-lowering he\xe2\x80\xa6'
1116785923616854016,2019-04-12 19:31:27,0,101,False,b'Twitter Web Client',"b'RT @RepJoeNeguse: I joined @SpeakerPelosi and @USRepKCastor to introduce #HR9, legislation to ensure the U.S. upholds its commitment to red\xe2\x80\xa6'"
1116781295516962816,2019-04-12 19:13:04,0,1188,False,b'Twitter Web Client',"b'RT @RepUnderwood: 100 days ago, a brand new wave of Democrats took office ready to get to work. We haven\xe2\x80\x99t wasted any time! We were elected\xe2\x80\xa6'"
1116781003190800386,2019-04-12 19:11:54,0,271,False,b'Twitter Web Client',b'RT @RepWilson: This is what change looks like. Looking forward to the work ahead. #100DaysForThePeople https://t.co/CuFwcLYNSy'
1116780720268169218,2019-04-12 19:10:47,0,80,False,b'TweetDeck',b'RT @RepMcEachin: The first 100 days of this Congress have been a whirlwind with significant work being done for the people of the Commonwea\xe2\x80\xa6'
1116780577422749702,2019-04-12 19:10:13,0,138,False,b'TweetDeck',b'RT @RepAdams: The first #100DaysForThePeople were just the beginning. Excited about continuing to show the American people we are serious a\xe2\x80\xa6'
1116778400822251521,2019-04-12 19:01:34,3092,1032,False,b'Sprout Social',"b'100 days ago, our Democratic Majority started the process of refocusing the Congress on the needs of Americans in communities nationwide. Here\xe2\x80\x99s a look at a few moments that stand out. #100DaysForThePeople https://t.co/pUV9mTxV5q'"
1116767053069914118,2019-04-12 18:16:28,5517,1683,False,b'Twitter Web Client',"b'From passing the #ForThePeopleAct to introducing to make affordable health care available to 13 million people, @HouseDemocrats have put the issues facing American families at the heart of our first #100DaysForThePeople \xe2\x80\x93 and there\xe2\x80\x99s only more to come. https://t.co/YeLKGKM83F'"
1116472714372558849,2019-04-11 22:46:52,37858,7026,False,b'Twitter Web Client',"b'Congratulations to Dr. Katie Bouman, who developed the algorithm which captured the first ever image of a black hole! You are an inspiration to all Americans and especially to young women and girls with STEAM dreams! https://t.co/OPV0X55lcc'"
1116144074447364097,2019-04-11 01:00:58,14936,1228,False,b'Buffer',b'So thrilled to be introducing @chrissyteigen and @johnlegend at the House Democratic Issues Conference tonight! https://t.co/8YnOW7iZPm'
1116129230025261057,2019-04-11 00:01:59,1369,529,False,b'Twitter Web App',"b'We met today with Ambassador @CarlosVecchio to discuss the urgent situation in Venezuela. The staggering number of Venezuelans living in poverty &amp; the brutal, ongoing repression of peaceful protesters seeking a brighter future is unforgivable. US should provide TPS. https://t.co/wItdSdm3Ms'"
1116121934327054336,2019-04-10 23:33:00,64526,18056,False,b'Buffer',b'Attorney General Barr is not the Attorney General of Donald Trump. He is the Attorney General of the United States. It\xe2\x80\x99s about time he started acting like it. https://t.co/61pCkAICyg'
1116105373881176064,2019-04-10 22:27:12,1331,319,False,b'Buffer',"b'As @HouseDemocrats start our issues conference this evening, we\xe2\x80\x99re committed to building on the extraordinary progress we\xe2\x80\x99ve achieved in the first 100 days of our Congress #ForThePeople. https://t.co/p1GeiAHW95'"
1116020591193145346,2019-04-10 16:50:18,1242,299,False,b'Twitter Media Studio',"b'Tune in as we send the Colorado River Drought Contingency Plan Authorization Act, a bipartisan victory for public health, local economies &amp; good-paying jobs, to the President\xe2\x80\x99s desk for his signature. https://t.co/sWQkuSYJio'"
1115699314947502080,2019-04-09 19:33:40,4443,1458,False,b'Twitter Media Studio',"b'House Democrats are making a strong statement today, as my signature sends a War Powers Resolution on Yemen to @realDonaldTrump\xe2\x80\x99s desk that directs the removal of U.S. Forces that have not been authorized by Congress. https://t.co/C1u41em93j'"
1115684725518217216,2019-04-09 18:35:41,0,276,False,b'TweetDeck',"b'RT @RepMcEachin: I\xe2\x80\x99m proud to support the #SaveTheNet Act, a bill that enacts common-sense #NetNeutrality protections to safeguard a free a\xe2\x80\xa6'"
1115684686272114689,2019-04-09 18:35:32,0,344,False,b'TweetDeck',"b'RT @RepLBR: Since the repeal of #NetNeutrality, ISPs are already throttling streaming speeds, up charging for HD and picking winners and lo\xe2\x80\xa6'"
1115684607226195970,2019-04-09 18:35:13,0,155,False,b'TweetDeck',b'RT @FrankPallone: The #SaveTheNet Act enacts legacy #NetNeutrality principles and empowers the FCC to perform effective oversight. I am pro\xe2\x80\xa6'
1115650130898767873,2019-04-09 16:18:13,1957,591,False,b'Twitter Web Client',"b'Regardless of education or income, black mothers in America experience significantly worse maternal health outcomes than other women. Thanks to @RepAdams &amp; @RepUnderwood, the #BMHCaucus will be at the forefront of the fight for life-saving solutions for years to come! https://t.co/pDCiwQv8IA'"
1115639203336003586,2019-04-09 15:34:48,5977,2253,False,b'Sprout Social',"b'Americans deserve to see their health care costs go down \xe2\x80\x93 and that starts with getting the facts needed to design effective policy. Behavior like this is unhelpful, to say the least. #ProtectOurCare https://t.co/s0Otb5NT9Z'"
1115585235830362112,2019-04-09 12:00:21,0,2681,False,b'Twitter Web App',"b'RT @RepJerryNadler: Americans deserve to know what drives their government\xe2\x80\x99s policy-making, especially when it threatens health protections\xe2\x80\xa6'"
1115061705023873025,2019-04-08 01:20:01,28017,9474,False,b'Buffer',"b'As Homeland Security Secretary, Kirstjen Nielsen oversaw the implementation of the Trump Admin\xe2\x80\x99s increasingly toxic anti-immigrant policies. That she is reportedly resigning because she is not extreme enough for the White House\xe2\x80\x99s liking is deeply alarming. https://t.co/MVKarszG06'"
1115038157014294528,2019-04-07 23:46:27,1970,489,False,b'Buffer',"b'This week saw us welcome Jens Stoltenberg, Secretary General of NATO, to the Capitol, and continued steps in our fight to improve health care #ForThePeople. That and more is covered in this week\xe2\x80\x99s photo series. https://t.co/aIOZbIzJuW'"
1114905588482359296,2019-04-07 14:59:40,9240,1143,False,b'Twitter Web Client',"b'That energy, faith and fire have inspired my work in the Congress and as Speaker, and it is my hope that my receiving this award will encourage others to pursue public service, and lead with courage, conviction and conscience.'"
1114905587567951872,2019-04-07 14:59:40,9220,1199,False,b'Twitter Web Client',"b'At President Kennedy\xe2\x80\x99s inauguration, I heard him speak of \xe2\x80\x98the energy, the faith, the devotion\xe2\x80\xa6that will light our country and all who serve it \xe2\x80\x93 and the glow from that fire can truly light the world.\xe2\x80\x99  It is inspiring that the award itself is a manifestation of that light.'"
1114905350870847493,2019-04-07 14:58:44,33414,5881,False,b'Twitter Media Studio',"b'It is a great personal and official honor to receive the Profile in Courage Award, which stands as a powerful testament to the extraordinary legacy and leadership of President Kennedy. #ProfileInCourage https://t.co/npd15vRtOj'"
1114892911718621184,2019-04-07 14:09:18,0,1358,False,b'Twitter Web App',"b""RT @JFKLibrary: .@SpeakerPelosi is the 2019 #ProfileInCourage Award honoree! She put the national interest above her party's interest to ex\xe2\x80\xa6"""
1114549844918583296,2019-04-06 15:26:05,2853,516,False,b'Twitter Web App',"b'Deeply saddened to hear of the passing of Fritz Hollings: a giant of the Senate, a hero of South Carolina and a beloved statesman of great courage and conviction. May it give his loved ones comfort that so many grieve with and pray for them at this sad time. https://t.co/3Hju2OD2xy'"
1114527303852331009,2019-04-06 13:56:30,0,403,False,b'Twitter Web App',"b'RT @RepColinAllred: I was proud to share Natalie\xe2\x80\x99s story this week, and her fight to protect health care and the ACA.\n\nLet\xe2\x80\x99s carry on Natal\xe2\x80\xa6'"
1114276605797515266,2019-04-05 21:20:19,1960,604,False,b'Twitter Media Studio',"b'For @RepColinAllred &amp; families throughout America, protecting Americans with pre-existing conditions is personal. #ProtectOurCare https://t.co/JrmMg9BdoI'"
1114256702940090368,2019-04-05 20:01:14,0,102,False,b'Twitter Web Client',"b""RT @RepDeanPhillips: On #GoldStarSpousesDay, I'm inspired by the strength of my mom and Gold Star Families across Minnesota and our nation\xe2\x80\xa6"""
1114201126671474689,2019-04-05 16:20:24,11508,2246,False,b'Sprout Social',"b'Fifteen years after he gave his life in service of our country, the Congress will recognize Captain Humayun Khan\xe2\x80\x99s memory &amp; sacrifice with a post office named in his honor. https://t.co/SSTc6lOx0J'"
1113942578733383681,2019-04-04 23:13:01,9422,2063,False,b'Sprout Social',"b'Shutting down America\xe2\x80\x99s southern border would threaten American jobs &amp; our broader economy, while also running counter to our nation\xe2\x80\x99s values.'"
1113934360745525248,2019-04-04 22:40:22,687,236,False,b'Twitter Web App',b'I join my colleagues @CECCgov in expressing concern about the proposed changes to Hong Kong\xe2\x80\x99s extradition laws. Members of Congress continue to support Hong Kong\xe2\x80\x99s autonomy and we are monitoring this situation closely. https://t.co/t6iGLHz9BB'
1113922047942565888,2019-04-04 21:51:26,3662,1276,False,b'Sprout Social',"b'The President\xe2\x80\x99s unlawful transfers of funds violate the Constitution. The House will once again defend our Democracy and our Constitution, this time in the courts. https://t.co/9Fas9D3uQ3 https://t.co/XG1Isz7l5S'"
1113909863539777536,2019-04-04 21:03:01,3016,1028,False,b'Sprout Social',b'-Savings for seniors on prescription drugs\n-Protections for ppl with pre-existing conditions\n-Critical protections for every family\xe2\x80\x99s health care\n\nThese and more are at stake if @realDonaldTrump gets his way &amp; the Texas v. U.S. lawsuit is successful. #ProtectOurCare'
1113899544520085507,2019-04-04 20:22:01,12371,3039,False,b'Sprout Social',b'My message is clear: just #ReleaseTheReport. https://t.co/WzW8apnJFa'
1113886412649189376,2019-04-04 19:29:50,49107,12108,False,b'Sprout Social',b'No president in the modern era has worked so diligently to keep their tax returns out of the public eye. What is President Trump hiding? https://t.co/PnOvRl9pMp'
1113840724393582592,2019-04-04 16:28:17,31570,3480,False,b'Buffer',b'.@QueerEye: feel free to let us know when you want @RepAOC &amp; me to fill in next. #Fab5 https://t.co/THjnPSCFcR'
1113819435893252097,2019-04-04 15:03:41,1833,465,False,b'Twitter Media Studio',b'It\xe2\x80\x99s time for this week\xe2\x80\x99s press conference here at the Capitol. Be sure to tune in! https://t.co/3QN3qNzBU9'
1113796185574322176,2019-04-04 13:31:18,0,446,False,b'Twitter Web App',"b'RT @RepMGS: Here\xe2\x80\x99s the reality about #VAWA: it saves lives. In the nearly 25 years since it was enacted, intimate partner violence among wo\xe2\x80\xa6'"
