id,created_at,favorites,retweets,retweeted,source,text
1250243445047861249,2020-04-15 02:04:00,144403,36688,False,b'Twitter Web App',"b'Now more than ever, we need the truth. And the truth is that Donald Trump dismantled the infrastructure handed to him which was meant to plan for and overcome a pandemic, resulting in unnecessary deaths and economic disaster.'"
1250147351576150017,2020-04-14 19:42:09,24548,6016,False,b'Twitter Media Studio',b'I understand the instincts of scientists who don\xe2\x80\x99t want to appear political. But make no mistake: the decision not to speak is a political decision. #FamiliesFirst #LateLateShow https://t.co/jXCvUJN1Bn'
1250100801588080641,2020-04-14 16:37:11,3901,983,False,b'Twitter Media Studio',b'The Administration needs to prioritize understanding who is most at risk during this crisis. Only then can we make the data-driven decisions that will allow us to fight &amp; defeat this coronavirus. #FamiliesFirst #LateLateShow https://t.co/eNtrMT5ezx'
1250080704446238725,2020-04-14 15:17:19,19199,4075,False,b'Twitter Media Studio',b'We all have found our ways to keep our spirits up during these trying times. Mine just happens to fill up my freezer. #LateLateShow https://t.co/dqA32d5lU1'
1249726058250809346,2020-04-13 15:48:05,25052,5617,False,b'Twitter Web App',"b'Grocery, pharmacy &amp; food processing workers are doing their part to be sure families have what they need!\n\nSay thank you by being sure to #ShopSmart:\n\n1) Wear a mask inside the store\n2) Keep 6+ ft between yourself &amp; others\n3) Properly dispose of gloves\n\n#SaveLives'"
1249700320571265026,2020-04-13 14:05:49,6789,2095,False,b'Sprout Social',"b'Small businesses, hospitals, frontline workers and state &amp; local governments across America are struggling to keep up with this crisis. They need more help from the federal government &amp; they need it fast. #FamiliesFirst\n\nRead my statement with @SenSchumer: https://t.co/L6u2FPVyKh'"
1249360939092193281,2020-04-12 15:37:14,15270,1315,False,b'Sprout Social',b'Wishing you all a #HappyEaster! https://t.co/CbpSRwMjDY'
1249006058019999744,2020-04-11 16:07:04,6038,1324,False,b'Twitter Web App',"b'On a bipartisan basis, governors are crying out for help and Congress must act. Democrats will continue to push for urgently needed funds for state and local governments in the interim emergency bill and #CARES2. #FamiliesFirst'"
1249006056237342721,2020-04-11 16:07:03,18035,5292,False,b'Twitter Web App',"b'Our state and local governments are in crisis, and between emergency expenses and rising unemployment sapping revenue, they need an immediate infusion of funds to prevent the collapse of essential services. https://t.co/a7a9RFn2b5'"
1248682925211750400,2020-04-10 18:43:03,4081,668,False,b'Twitter Web App',"b'So much has changed in the 37 days since we came together to honor you during Women\xe2\x80\x99s History Month, @DoloresHuerta. Yet as we mark your birthday today, we take strength from your decades-long example of fighting for working families across the country. \xc2\xa1Si, se puede! https://t.co/Pr9ME90ZIl'"
1248673114059350017,2020-04-10 18:04:04,5018,1582,False,b'Sprout Social',b'Congress cannot ignore the issues that have emerged in the Small Business Administration\xe2\x80\x99s relief programs. Main Street small businesses in underbanked or rural communities must not be left behind by the Paycheck Protection Program. #FamiliesFirst https://t.co/TAWuRIlLkO'
1248590183819329538,2020-04-10 12:34:32,5148,728,False,b'Sprout Social',b'I was heartbroken to learn of the passing of Phyllis Lyon: an icon of San Francisco and an LGBTQ rights trailblazer who used her voice to fight for justice and hold our nation accountable to its Founding values. https://t.co/izTQdY9vGF https://t.co/sWJ745dZT4'
1248416105426644992,2020-04-10 01:02:48,4072,1065,False,b'Twitter Media Studio',b'Hospitals and our state &amp; local governments are carrying much of the burden of fighting the coronavirus. We must make sure they have the resources they need to succeed. @MadMoneyOnCNBC #FamiliesFirst https://t.co/G1vxB51GeW'
1248399484855312395,2020-04-09 23:56:45,7259,2000,False,b'Twitter Media Studio',b'Testing is the key to reopening our economy. We must have a clear picture of just how the coronavirus is affecting our communities. @MadMoneyOnCNBC #FamiliesFirst https://t.co/gj5vXDIlJl'
1248394387467296769,2020-04-09 23:36:30,10506,3446,False,b'Sprout Social',b'Reports of abuse and neglect inflicted by U.S. immigration agents on a pregnant Guatemalan woman in labor during asylum processing are deeply concerning. @DHSOIG must immediately begin an investigation into this unacceptable behavior. https://t.co/e5i6m5YZWN'
1248285104109207559,2020-04-09 16:22:15,1958,400,False,b'Twitter Web App',b'I\xe2\x80\x99m speaking with reporters right now.\n\nListen in here: https://t.co/IBz3VB26If https://t.co/IEy4fDrF22'
1248242470510616577,2020-04-09 13:32:50,9372,2030,False,b'Twitter Web App',b'I will be holding my weekly press conference call with reporters at 12:15 pm ET today.\n\nListen in here: https://t.co/IBz3VB26If'
1248022407987765251,2020-04-08 22:58:23,4087,628,False,b'Twitter Web App',b'Wishing the very best to each and every member of America\xe2\x80\x99s Jewish community as families across the country mark the start of Passover this evening. https://t.co/74bADCF1ah'
1247995323072610309,2020-04-08 21:10:46,19469,2983,False,b'Sprout Social',"b'30 years after his death, Ryan White\xe2\x80\x99s courageous legacy remains an inspiration to all fighting to relegate HIV/AIDS to the history books and ensure all people living with HIV are able to live full lives free from discrimination.'"
1247955972510842880,2020-04-08 18:34:24,10560,2514,False,b'Twitter Media Studio',b'No American should be forced to choose between staying healthy and exercising their right to vote. @cnnnewsroom #FamiliesFirst https://t.co/YQj1zLlVGa'
1247614962605928453,2020-04-07 19:59:21,55275,17960,False,b'Sprout Social',b'The sudden removal &amp; replacement of Acting IG Glenn Fine is part of a disturbing pattern of retaliation by the President against independent overseers fulfilling their duties to conduct oversight on behalf of the American people. https://t.co/4QmyMdJ1S9'
1247362447293415425,2020-04-07 03:15:56,11567,2354,False,b'Twitter Media Studio',b'The Congress has taken decisive action to respond to the coronavirus \xe2\x80\x93 but there is still more to do to protect the health and financial security of America\xe2\x80\x99s families. #TRMS #FamiliesFirst https://t.co/GDeMOHcYHP'
1246440243324207105,2020-04-04 14:11:26,72103,20627,False,b'Twitter Web App',"b'The late-night firing of Inspector General Atkinson is a brazen act against a patriotic public servant who has honorably performed his duty to protect the Constitution and our national security, as required by the law and by his oath. https://t.co/MzFFY9xPgT'"
1246439404203278336,2020-04-04 14:08:06,0,319,False,b'Twitter Web App',b'RT @NitaLowey: We will get through this crisis together. @HouseDemocrats are committed to supporting working families struggling to pay ren\xe2\x80\xa6'
1246203557772230659,2020-04-03 22:30:56,53207,14849,False,b'Twitter Media Studio',b'Vote-by-mail is essential to protecting the future of our democracy as we confront this public health crisis. There is no legitimate argument against enacting it. #LSSC https://t.co/WPgOgIivK0'
1246192803316740096,2020-04-03 21:48:12,11594,2879,False,b'Twitter Media Studio',b'We\xe2\x80\x99re up to about 90% of Americans being under shelter-in-place orders. It should be 100 percent. #FamiliesFirst #LSSC https://t.co/vCibvjoUJw'
1246179979093782528,2020-04-03 20:57:14,1862,484,False,b'Twitter Media Studio',"b'Chairwoman @NitaLowey is an invaluable leader in the fight to put #FamiliesFirst during this crisis. Her message is clear: by working together, Americans can save lives and set the stage for a strong recovery. https://t.co/ZsqoEBXlb9'"
1246122597919711232,2020-04-03 17:09:13,8884,2492,False,b'Sprout Social',"b'The coronavirus is moving swiftly, and our communities cannot afford for us to wait. House Democrats will continue to work relentlessly and in a bipartisan way to lift up American families and workers. #FamiliesFirst https://t.co/Uy3JyoySqn'"
1246104596017225732,2020-04-03 15:57:41,9784,2471,False,b'Twitter Media Studio',"b'History shows us that proper, timely Congressional oversight not only saves money \xe2\x80\x93 it saves lives. #FamiliesFirst #LSSC https://t.co/Mzj0Ic2f4F'"
1246078761419837441,2020-04-03 14:15:02,5148,1229,False,b'Twitter Media Studio',b'Our work goes on to ensure that the #CARESAct is properly implemented and to prepare for the next phase of our #FamiliesFirst agenda. #LSSC https://t.co/UdJonNstXR'
1245882912123375627,2020-04-03 01:16:48,29132,7551,False,b'Twitter Media Studio',"b'Either the Administration didn\xe2\x80\x99t know how to respond to the coming crisis, or they refused to accept the threat that it posed. Anything else is just an excuse. #AMR https://t.co/qmTMSVKy67'"
1245856515208228865,2020-04-02 23:31:54,9127,2960,False,b'Twitter Media Studio',"b'We need to be doing more to ensure Americans have the health care they need. Instead, the President is continuing his mission to steal coverage from millions &amp; tear protections away from the more than 130 million Americans living with pre-existing conditions. #AMR #FamiliesFirst https://t.co/ragUalVgHP'"
1245834448844787713,2020-04-02 22:04:13,6449,1619,False,b'Twitter Media Studio',b'The House will not walk away from its duty to ensure that the resources provided through our #FamiliesFirst legislative packages are used wisely &amp; effectively. #AMR https://t.co/VMiUDJ97TQ'
1245819579084963840,2020-04-02 21:05:08,15757,4396,False,b'Twitter Media Studio',b'We have no right to even pay respects to frontline medical workers if we can\xe2\x80\x99t get them the equipment they need to stay safe and save lives. President Trump must use the full power of the Defense Production Act to meet their needs. #AMR #FamiliesFirst https://t.co/3TyQWEGgC8'
1245768253487661056,2020-04-02 17:41:11,7277,1874,False,b'Twitter Web App',"b'Led by @WhipClyburn, the Select Committee will root out waste, fraud, and abuse, and ensure money makes it to those who need it most \xe2\x80\x93 the working families struggling to pay rent and put food on the table. #FamiliesFirst https://t.co/mlqwIZdA9O'"
1245768251956760582,2020-04-02 17:41:11,45635,9427,False,b'Twitter Web App',"b'The Congress has so far passed three pieces of legislation totaling over $2 trillion in emergency relief. To ensure that your tax dollars are being spent carefully &amp; effectively, I am announcing the formation of the bipartisan House Select Committee on the Coronavirus Crisis.'"
1245763471582679040,2020-04-02 17:22:11,3795,1065,False,b'Sprout Social',"b'With Native communities across the United States at risk, @HouseDemocrats are working to protect lives in Indian Country \xe2\x80\x93 ensuring tribes and @IHSgov have the resources needed to stop the spread of the coronavirus and save lives. #CoronavirusIndianCountry'"
1245726109611802624,2020-04-02 14:53:43,1641,379,False,b'Sprout Social',b'I am speaking with reporters as House Democrats continue our work supporting health care workers nationwide and protecting the livelihoods of American families. #FamiliesFirst https://t.co/pC4yPo5ByK https://t.co/zITx4UEO9n'
1245714843962925056,2020-04-02 14:08:57,7607,1674,False,b'Sprout Social',b'I will be holding my weekly press conference at 10:45 am ET via conference call.\n\nListen in here: https://t.co/pC4yPo5ByK'
1245479611661778946,2020-04-01 22:34:13,1094,317,False,b'Sprout Social',"b'\xc2\xa1Hoy es el D\xc3\xada del Censo! D\xc3\xada de unirnos por la democracia, de luchar por nuestras familias, de luchar por nuestras comunidades y de ser contados en el #Censo2020. https://t.co/SyyZMoqkXB'"
1245454949867302912,2020-04-01 20:56:14,5651,1381,False,b'Twitter Media Studio',"b'As our heroic frontline health care workers continue the fight against the coronavirus, we must lay the groundwork for our recovery &amp; act to protect the livelihoods of millions of Americans. #FamiliesFirst @cnnnewsroom https://t.co/gBAd4n7w1r'"
1245419402083930115,2020-04-01 18:34:58,3504,850,False,b'Sprout Social',"b'From representation in the House to the allocation of taxpayer dollars, the #2020Census is at the heart of the proper function of our democracy. Stand up and #BeCounted from the comfort of your own home. https://t.co/hfLr8bnHy0'"
1245074174399447047,2020-03-31 19:43:10,0,252,False,b'Twitter Web App',"b'RT @RepRoKhanna: Startups are essential to innovation in the American economy. \n\nToday, @SpeakerPelosi and I sent a letter to Sec Mnuchin a\xe2\x80\xa6'"
1245060069672312832,2020-03-31 18:47:07,2788,657,False,b'Sprout Social',"b'During this difficult time for America\xe2\x80\x99s workers, equal pay for equal work remains as important as ever.\n \nRead my full statement on #EqualPayDay here: https://t.co/tAr8h2DyI2 https://t.co/KnD7swT3Xz'"
1245040446419668997,2020-03-31 17:29:08,2133,593,False,b'Sprout Social',b'C\xc3\xa9sar Ch\xc3\xa1vez\xe2\x80\x99s towering vision and determined voice helped put the American dream within reach for millions. His commitment to putting workers and families first remains our inspiration and our responsibility. #CesarChavezDay https://t.co/2tFSiONuwG https://t.co/yX7NQgBACF'
1245027162467508230,2020-03-31 16:36:21,15775,4634,False,b'Twitter Media Studio',b'President Trump must immediately implement the Defense Production Act. American lives depend on quickly &amp; efficiently delivering personal protective equipment and ventilators to communities across the country. #FamiliesFirst https://t.co/0VwE6lpAhQ'
1244774653131919360,2020-03-30 23:52:58,4799,1675,False,b'Twitter Web App',b'Read my full statement here: https://t.co/HsTKqD7BtU'
1244774652179886080,2020-03-30 23:52:58,56273,14001,False,b'Twitter Web App',"b'While the President has made clear he will ignore oversight provisions in the #CARESAct, Acting IG Fine must exercise his full oversight authority to ensure that the Admin uses this relief package to help workers, not to pad the pockets of corporations &amp; the wealthiest few.'"
1244734490444017664,2020-03-30 21:13:23,14276,2936,False,b'Sprout Social',"b'Ten years ago, Democrats made the single largest investment in student aid in U.S. history with the Student Aid &amp; Fiscal Responsibility Act. Last week, we secured student borrower relief in the CARES Act &amp; will prioritize student debt throughout this crisis. #FamiliesFirst'"
1244339556058611715,2020-03-29 19:04:03,16301,3970,False,b'Twitter Media Studio',b'We cannot deny the facts on the ground. We owe it to those working to save lives to quickly ramp up testing and deliver personal protective equipment. #FamiliesFirst #CNNSOTU https://t.co/Etr4Nk402b'
1244295869152854018,2020-03-29 16:10:27,8627,2254,False,b'Twitter Media Studio',b'The #CARESAct was just a down payment in the fight against the coronavirus. We can and will do more to help state &amp; local governments as they fight this public health crisis. #FamiliesFirst #CNNSOTU https://t.co/nybwe0EtWR'
1244091443007889408,2020-03-29 02:38:08,7550,1577,False,b'Twitter Web App',b'I will be joining CNN\xe2\x80\x99s @jaketapper at 9 am ET on Sunday to discuss the ongoing efforts to fight the coronavirus in communities across the country. #CNNSOTU https://t.co/cJWP4EOe1U'
1244034462373023748,2020-03-28 22:51:43,17217,4217,False,b'Twitter Media Studio',"b'The #CARESAct is nothing short of an act of legislative jujitsu. Republicans presented a corporate-focused plan, and Democrats flipped it around and delivered expansions to unemployment insurance, support for small businesses, and so much more. #FamiliesFirst #TRMS https://t.co/7xKLP8S7xd'"
1244003876178743297,2020-03-28 20:50:11,11957,2719,False,b'Sprout Social',"b'We will get through this epidemic by working together, guided by the best advice from our nation\xe2\x80\x99s public health experts and frontline medical workers. #FamiliesFirst https://t.co/Mkje6KfGCh'"
1243987372250992641,2020-03-28 19:44:36,0,1518,False,b'Twitter Web App',"b'RT @HouseDPCC: .@realdonaldtrump: Mr. Pres, this is abt getting $ to the American ppl as soon as possible, not abt getting credit. Don\xe2\x80\x99t de\xe2\x80\xa6'"
1243971804986839040,2020-03-28 18:42:44,3324,725,False,b'Twitter Web App',"b'A life-long fighter of freedom for all &amp; a giant of the civil rights movement, Rev. Joseph Lowery\xe2\x80\x99s legacy of equality &amp; justice will live on. May it be a comfort to his family that so many mourn with them during this difficult time. https://t.co/K5BSlGLQR6'"
1243945769998172161,2020-03-28 16:59:17,28506,7579,False,b'Twitter Media Studio',b'The President\xe2\x80\x99s attempts to avoid oversight are a surprise to no one. Rest assured: the Congress will exercise its oversight responsibilities. #FamiliesFirst #TRMS https://t.co/qczjTzJOy0'
1243922348081889280,2020-03-28 15:26:13,7392,1787,False,b'Twitter Media Studio',b'The #CARESAct is an important step in supporting our frontline health care workers and the broader health system as we confront the coronavirus \xe2\x80\x93 but there is far more to do to ensure they have all the resources they need. #FamiliesFirst #TRMS https://t.co/TautfznX82'
1243612299392430080,2020-03-27 18:54:12,6246,1391,False,b'Twitter Web App',b'The House\xe2\x80\x99s passage of the bipartisan #CARESAct sends a clear message: we are all committed to protecting America\xe2\x80\x99s workers and families as our nation confronts this public health crisis. #FamiliesFirst https://t.co/2WnvA0U9aG'
1243595383529517061,2020-03-27 17:46:58,5505,1235,False,b'Twitter Media Studio',"b'Members of Congress are coming together following the passage of the bipartisan #CARESAct, a families &amp; workers-first relief package. With my signature, this legislation heads to the President\xe2\x80\x99s desk. #FamiliesFirst https://t.co/XzVQB96i0e'"
1243594501131833347,2020-03-27 17:43:28,1550,274,False,b'Twitter Web App',"b'In a short time, Members of Congress will mark the passage of the workers and families-focused, bipartisan #CARESAct. #FamiliesFirst\n\nTune in here: https://t.co/rFd2fqW3Qv'"
1243242692047495169,2020-03-26 18:25:30,0,248,False,b'Twitter Web App',"b'RT @CAPAC: #ICYMI: Earlier today, #CAPAC First Vice Chair @RepGraceMeng introduced a congressional resolution to denounce anti-Asian sentim\xe2\x80\xa6'"
1243222379968544770,2020-03-26 17:04:47,13119,3121,False,b'Twitter Media Studio',b'We must heed the guidance of the experts as we confront this pandemic. Science is an answer to our prayers. #FamiliesFirst https://t.co/wVgHALQdTc'
1243203665059614726,2020-03-26 15:50:26,7110,2003,False,b'Sprout Social',b'The next steps as we put #FamiliesFirst?\n\n-Expanding who qualifies for paid family &amp; medical leave\n\n-Stronger OSHA protections for workers\n\n-Action to protect pensions\n\n-Increase SNAP funding\n\n-More funding for state &amp; local governments\n\n-Ensuring free coronavirus treatment'
1243202605364494342,2020-03-26 15:46:13,83326,20887,False,b'Sprout Social',b'Testing. Masks. Ventilators.\n\nIt\xe2\x80\x99s not a mystery \xe2\x80\x93 we need many more.\n\nThe President must invoke the Defense Production Act to immediately mass produce and coordinate distribution of these vital supplies. #FamiliesFirst'
1243189625440608256,2020-03-26 14:54:38,5555,1062,False,b'Sprout Social',b'I\xe2\x80\x99m speaking with reporters live at the U.S. Capitol.\n\nTune in here: https://t.co/meX96g9nDK'
1243173584819965961,2020-03-26 13:50:54,5229,1259,False,b'Sprout Social',b'I will be speaking with reporters live at 10:45 am ET at the U.S. Capitol as the House continues its work to put workers and #FamiliesFirst in the fight against the coronavirus.\n \nWatch here: https://t.co/meX96g9nDK'
1243008062165856257,2020-03-26 02:53:10,17001,3618,False,b'Twitter Media Studio',"b'Congressional Democrats have turned the Senate Republicans\xe2\x80\x99 bill upside down, transforming it from trickle down proposal into a relief plan that puts #FamiliesFirst. #SitRoom https://t.co/42EEjFBC8H'"
1242996510142406656,2020-03-26 02:07:16,12651,2906,False,b'Twitter Media Studio',b'The best way we can show our thanks to our frontline health care workers is by getting them the personal protective equipment they need to carry out their task. #FamiliesFirst #SitRoom https://t.co/Ext1aNGNPa'
1242939648869117956,2020-03-25 22:21:19,0,179,False,b'Twitter Web App',b'RT @NewsHour: TONIGHT: @JudyWoodruff interviews @SpeakerPelosi as Congress takes up an economic aid package to blunt the fallout of COVID-1\xe2\x80\xa6'
1242918386973229056,2020-03-25 20:56:50,0,166,False,b'Twitter Web App',b'RT @wolfblitzer: I\xe2\x80\x99ll speak live with House @SpeakerPelosi in the @CNNSitRoom today during the 6PM ET. I\xe2\x80\x99ll get her reaction to all the lat\xe2\x80\xa6'
1242467257902456833,2020-03-24 15:04:12,0,209,False,b'Twitter Web App',b'RT @mitchellreports: https://t.co/PgCL73V1rV'
1242450780696829955,2020-03-24 13:58:44,47255,9831,False,b'Twitter Web App',"b'The best way to protect our economy in this crisis is to protect workers &amp; families, who are the life-blood of it. That is why we are working to get money into the hands of workers as soon as possible. #FamiliesFirst @SquawkStreet'"
1242439811849424896,2020-03-24 13:15:09,0,245,False,b'Twitter Web App',"b""RT @SquawkStreet: Don't miss House Speaker Nancy Pelosi on Squawk on the Street with @davidfaber and @jimcramer.\n\n@CNBC @SpeakerPelosi http\xe2\x80\xa6"""
1242246905771503619,2020-03-24 00:28:36,25817,6871,False,b'Twitter Media Studio',"b'As we mark the 10th anniversary of the Affordable Care Act, I call on the President to drop his lawsuit attacking Americans\xe2\x80\x99 health care. We should be fighting to ensure more people have access to quality care, not doing the opposite. #ProtectOurCare https://t.co/LC6QS8SroY'"
1242180062956400642,2020-03-23 20:03:00,26586,5927,False,b'Twitter Media Studio',"b'10 years ago, President Obama signed the Affordable Care Act into law, because we believe health care must be a right, not a privilege.\n\nToday, Americans know their coverage is protected thanks to the ACA \xe2\x80\x93 coverage they need now more than ever. #ProtectOurCare https://t.co/sEW3UzPJiD'"
1242150100987719687,2020-03-23 18:03:56,6626,1877,False,b'Twitter Media Studio',"b'Today, we mark the 10th anniversary of the Affordable Care Act and introduce the third #FamiliesFirst proposal, the Take Responsibility for Workers and Families Act. https://t.co/90N9ahn72B'"
1242137162994368514,2020-03-23 17:12:32,13083,2928,False,b'Twitter Web App',"b'I will be making a statement at 2 pm ET as we mark the 10th anniversary of the Affordable Care Act and introduce the third #FamiliesFirst proposal, the Take Responsibility for Workers and Families Act.\n\nWatch here: https://t.co/2fi357l3G3'"
1242135206448050178,2020-03-23 17:04:45,41854,13594,False,b'Twitter Web App',"b'The Senate Republicans\xe2\x80\x99 bill put corporations first, not workers &amp; families. Today, @HouseDemocrats will unveil a bill that takes responsibility for the health, wages &amp; well-being of America\xe2\x80\x99s workers: the Take Responsibility for Workers &amp; Families Act. https://t.co/WbHY9CNGFa'"
1241401678454239232,2020-03-21 16:29:58,3006,630,False,b'Twitter Web App',"b'55 years after the Selma marches, we honor the stories of the brave, patriotic men and women who risked everything on the long, dangerous march toward freedom. https://t.co/epThY6q19y https://t.co/CRkIsZROqH'"
1241356952032219136,2020-03-21 13:32:15,0,518,False,b'Twitter Web App',b'RT @RepPeterDeFazio: The coronavirus is driving an unprecedented crisis that will have a lasting impact on our country. But by working toge\xe2\x80\xa6'
1241122859466067968,2020-03-20 22:02:03,2639,655,False,b'Twitter Media Studio',b'.@RepPeterDeFazio is working to put #FamiliesFirst and keep the essential workers &amp; resources moving that are the backbone of the fight against the coronavirus. https://t.co/ePEuuPEq1G'
1241006612665507840,2020-03-20 14:20:07,3810,646,False,b'Twitter Web App',"b'Today, we join our Iranian American friends &amp; neighbors in marking the celebration of Nowruz and praying for the health &amp; safety of our communities, including all those in Iran who have lost loved ones and those who are suffering during this challenging time. https://t.co/MIVXDZVMeh'"
1240810075410792448,2020-03-20 01:19:09,60395,18722,False,b'Twitter Web App',"b'.@SenSchumer &amp; I are beginning to review Senator McConnell\xe2\x80\x99s proposal and on first reading, it is not at all pro-worker and instead puts corporations way ahead of workers.'"
1240766829636857864,2020-03-19 22:27:19,1636,575,False,b'Twitter Web App',b'Read my full statement with @SenSchumer here: https://t.co/pBsnjRNoPK'
1240766828714110978,2020-03-19 22:27:18,5009,1164,False,b'Twitter Web App',"b'Any economic stimulus proposal must include new, strong and strict provisions that prioritize and protect workers, such as banning the recipient companies from buying back stock, rewarding executives and laying off workers.'"
1240766827917201409,2020-03-19 22:27:18,15058,3489,False,b'Twitter Web App',b'Congressional Democrats are united in our commitment to using all tools available to fight the coronavirus outbreak like the health crisis it is &amp; make sure workers are protected from the loss of a paycheck or that no family falls into financial ruin because of this pandemic.'
