id,created_at,favorites,retweets,retweeted,source,text
1185908242796470273,2019-10-20 13:18:52,61212,16249,False,b'Twitter Web App',"b'Republicans face a simple question: is the president allowed to pressure a foreign country into interfering in our elections?\n\nHistory will remember their answer, or their silence. #TruthExposed https://t.co/ps02g1AlYL'"
1185621543315038210,2019-10-19 18:19:38,120209,30720,False,b'Twitter Web App',"b""The President's Chief of Staff says there\xe2\x80\x99s \xe2\x80\x9cno cover-up.\xe2\x80\x9d\n\nBut President Trump\xe2\x80\x99s:\n\nState Department\nDepartment of Defense\nOMB\nEnergy Department\n&amp; Vice President\n\nAre all defying lawful subpoenas &amp; document requests.\n\nIf they have nothing to hide, why not comply? #TruthExposed"""
1185577839023869953,2019-10-19 15:25:58,42050,6916,False,b'Twitter Web App',"b'God blessed America with the life &amp; leadership of Elijah Cummings. May we all be inspired by his example to go forth in a way that is worthy of our oaths of office, worthy of the vision of our Founders &amp; worthy of the aspirations of our children. https://t.co/aiVkZb8ZxF'"
1185558542440378368,2019-10-19 14:09:17,0,1201,False,b'Twitter Web App',b'RT @RepShalala: Our government negotiates better prices on everything from military equipment to contractors. Only the pharmaceutical indus\xe2\x80\xa6'
1185315203073925122,2019-10-18 22:02:21,5804,1391,False,b'Twitter Media Studio',"b'As Secretary for Health &amp; Human Services in the Clinton Administration, @RepShalala fought to allow Medicare to negotiate for lower drug prices. Now, we\xe2\x80\x99re making it happen under H.R. 3, the #LowerDrugCosts Now Act. #ForThePeople https://t.co/OR8ZGKezJZ'"
1185268291436199936,2019-10-18 18:55:56,44049,14543,False,b'Twitter Media Studio',"b'Yesterday, @realDonaldTrump\xe2\x80\x99s top staffer joined Trump, his lawyer, and his diplomats in confessing that the Trump Admin used taxpayer-funded military aid to pressure Ukraine into interfering in the 2020 election. There\xe2\x80\x99s a simple question facing Republicans now. #TruthExposed https://t.co/tVkwkPk0VI'"
1185166280489390082,2019-10-18 12:10:35,11506,2522,False,b'Twitter Web App',b'.@NASA has captured the imaginations of the world for generations. Congratulations to @Astro_Christina &amp; @Astro_Jessica for leaving their mark on history with today\xe2\x80\x99s #AllWomanSpacewalk. You are an inspiration to women &amp; girls across America. https://t.co/HQZIDUpBNZ'
1184967491879100418,2019-10-17 23:00:40,5418,1264,False,b'Twitter Web App',b'Read my full statement with @SenSchumer here: https://t.co/MPt8xAolQ6'
1184967491241594888,2019-10-17 23:00:40,9414,1455,False,b'Twitter Web App',"b'Yesterday, the House sent an overwhelming bipartisan message demanding a clear strategy to defeat ISIS, and the Senate should do the same immediately.'"
1184967490469814272,2019-10-17 23:00:40,9884,1920,False,b'Twitter Web App',"b'This sham ceasefire does nothing to stop thousands of ISIS from prisoners from escaping, and shows the President\xe2\x80\x99s complete lack of strategy to defeat ISIS.'"
1184967489593270272,2019-10-17 23:00:39,62875,13389,False,b'Twitter Web App',b'.@realDonaldTrump is flailing. Reversing sanctions against Turkey for brutally attacking our Kurdish partners in exchange for a sham ceasefire seriously undermines the credibility of America\xe2\x80\x99s foreign policy and sends a dangerous message to our allies and adversaries alike.'
1184955944440094720,2019-10-17 22:14:47,13722,3561,False,b'Twitter Web App',"b""For 47 years, the #CleanWaterAct has safeguarded our children\xe2\x80\x99s clean water. But since Day One, the Trump Admin has given big special interests free rein to poison our communities &amp; threaten families' health. @HouseDemocrats are ending this corruption &amp; fighting #ForThePeople."""
1184947815350505472,2019-10-17 21:42:29,27918,4914,False,b'Twitter Media Studio',"b'When Chairman Elijah Cummings spoke, America listened. He pushed each and every one of his colleagues to work for a higher purpose. May we all seek to follow his example. https://t.co/pYgeNqpvko'"
1184925740841816067,2019-10-17 20:14:46,95300,26876,False,b'Twitter Media Studio',b'The Constitution is clear: the President cannot accept gifts or payments from foreign governments. No one is above the law. #EmolumentsClause https://t.co/bHEx2qI2D3'
1184879517493579776,2019-10-17 17:11:05,1922,246,False,b'Sprout Social',"b'30 years after the devastation of the #LomaPrieta earthquake, San Franciscans remember the loved ones we lost, the courage of our first responders and the determination &amp; spirit to repair and rebuild \xe2\x80\x93 rising stronger than ever. https://t.co/MvUcjU6NAF https://t.co/jfCe2zB6il'"
1184871464878645248,2019-10-17 16:39:05,32574,4465,False,b'Sprout Social',"b'The House has lost our North Star. Chairman Elijah Cummings was a leader of towering character &amp; integrity. His wisdom, his warm friendship and his great humanity will be deeply missed. Rest in peace, my friend. https://t.co/WP0830KCkV https://t.co/Hx8RFIWFPC'"
1184862791360040961,2019-10-17 16:04:37,6796,1096,False,b'Twitter Media Studio',b'It is a privilege to welcome President Sergio #Mattarella of Italy to the U.S. Capitol to discuss the deep ties between our countries. https://t.co/k2zZcvKVTB'
1184846365500809216,2019-10-17 14:59:21,6825,1304,False,b'Twitter Media Studio',b'I am speaking with reporters live from the U.S. Capitol as the Congress mourns the loss of @OversightDems Chairman Elijah Cummings. https://t.co/5VvDKV6pq8'
1184841372576157696,2019-10-17 14:39:31,4617,693,False,b'Twitter Web App',b'I will be holding my weekly press conference at 10:45 am ET.\n\nTune in here to watch: https://t.co/rFd2fqW3Qv'
1184841123954659328,2019-10-17 14:38:31,0,229,False,b'Twitter Web App',b'RT @RepKatieHill: Stories like Doug\xe2\x80\x99s are at the very heart of the fight to pass H.R. 3 and #LowerDrugCosts for Americans nationwide. Grate\xe2\x80\xa6'
1184589618605367298,2019-10-16 21:59:08,15751,2252,False,b'Twitter Web App',"b'It was my pleasure to congratulate my friend, Speaker John Bercow, for his well-deserved @PinkNews award in recognition of his steadfast work to advance the rights of the LGBTQ community in the UK. Congrats, Mr. Speaker! https://t.co/GH8nU2eDBO'"
1184546092525993986,2019-10-16 19:06:10,155100,36110,False,b'Twitter Web App',"b'I am deeply concerned that the White House has canceled an all-Member classified briefing on the dangerous situation the President has caused in Syria, denying the Congress its right to be informed as it makes decisions about our national security.'"
1184532713770049541,2019-10-16 18:13:01,2359,751,False,b'Sprout Social',"b'California: Health Care Open Enrollment is now here. The deadline is January 31, so make sure you &amp; your loved ones sign up before time runs out.\n\nAlready enrolled? You can use Open Enrollment to shop &amp; save, finding the best plan for 2020. #CoveredCA https://t.co/9vk7YwTWVK'"
1184523803101204482,2019-10-16 17:37:36,40672,10464,False,b'Twitter Web App',"b'Our inquiry is deadly serious. Our Republican colleagues should end their stunts, consult their oaths, and answer this simple question honestly to the American people: is it acceptable for the President to ask a foreign country to investigate his political rivals? #TruthExposed https://t.co/6VFx7bE4xH'"
1184494451097559050,2019-10-16 15:40:58,3366,629,False,b'Sprout Social',b'The #LowerDrugCosts Now Act will improve financial opportunity for families &amp; save lives across America by reining in out-of-control drug prices. #ForThePeople'
1184492421041836032,2019-10-16 15:32:54,2661,579,False,b'Twitter Media Studio',b'American seniors &amp; families shouldn\xe2\x80\x99t be forced to pay more for their medications than people in other countries. @HouseDemocrats are committed to passing H.R. 3 to #LowerDrugCosts nationwide. https://t.co/r9NBGgnpbU'
1184485260865740805,2019-10-16 15:04:27,1768,290,False,b'Sprout Social',b'.@HouseDemocrats are coming together at 11:30 am ET to highlight the ongoing fight to #LowerDrugCosts for seniors &amp; families across the country. https://t.co/rFd2fqW3Qv'
1184475357455568896,2019-10-16 14:25:06,0,2660,False,b'Twitter Web App',b'RT @EdLaborCmte: NEWS: The Trump Administration finally released its internal analysis showing how many kids would lose access to free scho\xe2\x80\xa6'
1184447670246621188,2019-10-16 12:35:05,0,433,False,b'Twitter Web App',b'RT @RepColinAllred: It\xe2\x80\x99s simple: American seniors and families should not pay more than folks in other countries for the medications they c\xe2\x80\xa6'
1184280405408653312,2019-10-16 01:30:26,30324,11423,False,b'Twitter Web App',"b'On one side, you have a repressive regime crushing democratic freedoms in #HongKong. On the other, you have young people speaking out for freedom &amp; democratic reforms. Proud to stand with @RepMcGovern in support of today\xe2\x80\x99s bipartisan votes showing the House\xe2\x80\x99s commitment to HK. https://t.co/fmwA6KkR7b'"
1184242455836811264,2019-10-15 22:59:38,7343,1923,False,b'Twitter Media Studio',b'I am taking questions from reporters following a meeting of @HouseDemocrats. #TruthExposed https://t.co/WgJeVUWjO1'
1184221178501718017,2019-10-15 21:35:05,3845,986,False,b'Sprout Social',b'I will be taking questions from reporters tonight at 6:30 pm ET following @HouseDemocrats\xe2\x80\x99 Caucus meeting. #TruthExposed https://t.co/rFd2fqW3Qv'
1184194492477378562,2019-10-15 19:49:02,2449,496,False,b'Twitter Web App',"b'Every time we meet with students &amp; families, we hear the same thing: college is far from being affordable. Now we are putting an end to years of Republican inaction by introducing the #CollegeAffordabilityAct. https://t.co/95Yar7WFEj'"
1184191964876562433,2019-10-15 19:39:00,5491,1526,False,b'Twitter Media Studio',"b'Today, @HouseDemocrats are unveiling the #CollegeAffordabilityAct to protect students &amp; families across the country and put money back in their pockets. Thank you to @RepBobbyScott, whose relentless leadership has made this historic day possible. https://t.co/tSgg8j7QkS'"
1184182549431668739,2019-10-15 19:01:35,2528,617,False,b'Sprout Social',"b'Over 44 million Americans are struggling with $1.5 trillion in student loan debt. Today, @HouseDemocrats are introducing the #CollegeAffordabilityAct at 3:30 pm ET. https://t.co/rFd2fqW3Qv'"
1183908192037855233,2019-10-15 00:51:23,31401,8142,False,b'Twitter Web App',b'.@realDonaldTrump\xe2\x80\x99s newly-announced sanctions against Turkey fall very short of reversing the humanitarian disaster brought about by his own erratic decision-making. https://t.co/MMvt0S9Tl6'
1183805740189978624,2019-10-14 18:04:17,6928,1868,False,b'Twitter Web App',b'We can save billions by finally negotiating for #LowerDrugCosts. And that\xe2\x80\x99s just the beginning: H.R. 3 would extend those lower prices to Americans across the country. https://t.co/evDporagP8'
1183773447282933760,2019-10-14 15:55:57,10836,1649,False,b'Twitter Web App',"b'As we find ourselves in a situation where the President gave a green light to the Turks to bomb and effectively unleashed ISIS, we must have a stronger sanctions package than what the White House is suggesting.'"
1183773446398005249,2019-10-14 15:55:57,8737,965,False,b'Twitter Web App',"b'Next, we must put together the strongest bipartisan, bicameral sanctions package similar to the bipartisan bill the House is advancing.'"
1183773445559148544,2019-10-14 15:55:57,62955,10422,False,b'Twitter Web App',"b'Pleased to have a conversation with Senator @LindseyGrahamSC this morning. Our first order of business was to agree that we must have a bipartisan, bicameral joint resolution to overturn the President\xe2\x80\x99s dangerous decision in Syria immediately.'"
1182855421960380417,2019-10-12 03:08:03,30006,7152,False,b'Twitter Web App',"b'The departure of the Acting Homeland Security Secretary is the latest sign of this Administration\xe2\x80\x99s failed leadership, which has worsened the humanitarian situation at the border, and injected pain and tragedy into countless lives. https://t.co/XvIERZL1qF'"
1182847128697217024,2019-10-12 02:35:06,5748,1202,False,b'Twitter Web App',"b'When we have the power to negotiate for fair drug prices, we put money back into the pockets of seniors &amp; families, reduce insurance premiums, &amp; improve the personal and financial health of the American people. #LowerDrugCosts https://t.co/DB9TCQT3Xi'"
1182823527046627328,2019-10-12 01:01:19,88640,11757,False,b'Twitter Web App',"b'MEDIA ALERT: They\xe2\x80\x99ve found Mr. Ghirardelli, Ben and Jerry, and Grandmother See from See\xe2\x80\x99s Candies! \xf0\x9f\x8d\xab https://t.co/NrPdDK1mPz'"
1182703116040462344,2019-10-11 17:02:51,4410,846,False,b'Twitter Web App',"b'Everyone\xe2\x80\x99s story is different, and everyone\xe2\x80\x99s story matters. #ComingOutDay https://t.co/tcsqkWitAn'"
1182687145468796928,2019-10-11 15:59:23,1925,391,False,b'Twitter Web App',"b'During this difficult time, we hope all impacted by the California #poweroutages stay safe and consult the available resources found here: https://t.co/LCc90Rzs9F.'"
1182663265446481920,2019-10-11 14:24:29,33191,8264,False,b'Twitter Web App',b'There\xe2\x80\x99s a simple question at the heart of our inquiry: is it Ok for a President to pressure foreign governments to undermine our elections for his political gain? Republican Members of Congress should consult their oath on this question.\nhttps://t.co/oidmxcT2NL'
1182381212033310727,2019-10-10 19:43:43,37378,8222,False,b'Twitter Web App',"b'I agree, General McMaster. This is a simple question. It\xe2\x80\x99s shocking that so many Republicans refuse to answer it. https://t.co/rXegGkyrk2'"
1182373461433434112,2019-10-10 19:12:55,1217,199,False,b'Sprout Social',"b'Chairwoman @NitaLowey is a master legislator whose values-based leadership has touched countless lives in New York and around the world. While we will miss her deeply, we look forward to benefiting from her leadership in the months to come. https://t.co/KNmDsXyEnp https://t.co/0UoaEBKfsY'"
1182352113231380481,2019-10-10 17:48:05,37099,8882,False,b'Sprout Social',"b'Republicans need to end the cover-ups, deceptions, and distractions. Their oath is to the Constitution, not to White House talking points. #TruthExposed\nhttps://t.co/FJRO9r8ZZ6'"
1182282711953809408,2019-10-10 13:12:18,51450,13644,False,b'Twitter Web App',"b'Republicans are now refusing to answer the simplest question: whether it\xe2\x80\x99s acceptable for a president to pressure foreign countries to undermine our elections. \n \nAmerican elections should be decided by Americans, not by \xe2\x80\x9cfavors\xe2\x80\x9d from foreign governments.\nhttps://t.co/wrx4NhPT48'"
1182066572602552322,2019-10-09 22:53:27,86942,19773,False,b'Twitter Web App',"b'What the Republicans fear most is the truth. To avoid the facts they stage confusion, undermine the Constitution and attack the person the President fears most, @RepAdamSchiff.   \n\nThe American people want the #TruthExposed.'"
1182024771598524417,2019-10-09 20:07:21,7181,3069,False,b'Twitter Web App',b'In their own words. @realDonaldTrump pressured a foreign leader to manufacture political dirt for his 2020 reelection campaign. #TruthExposed https://t.co/9RKvPKGd8u'
1182003219477737472,2019-10-09 18:41:42,13716,3672,False,b'Sprout Social',"b'Americans pay up to 10 times as much as consumers in other countries for the same medications. By passing H.R. 3, we can #LowerDrugCosts for seniors &amp; families nationwide. https://t.co/MMM9awCCtc'"
1181729848882012161,2019-10-09 00:35:26,72298,16681,False,b'Twitter Web App',"b'.@realDonaldTrump, you are not above the law. You will be held accountable. #TruthExposed https://t.co/elMCHdLYlK'"
1181714110129541121,2019-10-08 23:32:53,5410,732,False,b'Twitter Web App',"b'Congratulations to World Champions @USAGym women! And a special shout-out to the legendary @Simone_Biles on your record-breaking 21st world medal! Your teamwork, athleticism and drive to be the best is an inspiration to us all! #Stuttgart2019 https://t.co/LibdCxc9em'"
1181634561303818243,2019-10-08 18:16:47,4104,1323,False,b'Sprout Social',"b'.@HouseDemocrats are not going to sit back and watch as @realDonaldTrump attempts to kick countless working Americans off SNAP, Medicaid and assisted housing. #WarOnWorkingFamilies https://t.co/da6vYg36ig'"
1181600787677532161,2019-10-08 16:02:35,1872,415,False,b'Twitter Web App',b'It\xe2\x80\x99s time to #LowerDrugCosts for seniors &amp; working people nationwide. Tune in as @RepDelBene and I come together in Seattle for discussion about @HouseDemocrats\xe2\x80\x99 bill to level the playing field for patients &amp; taxpayers now. #SpeakerInTheHouse https://t.co/pc8p5zKbpW'
1181327350446919680,2019-10-07 21:56:03,26513,7151,False,b'Twitter Web App',b'Generations of US leaders have understood that accepting \xe2\x80\x93 let alone seeking out \xe2\x80\x93 political favors from foreign countries is unacceptable. Republicans who say otherwise today are putting loyalty to Trump ahead of our national security. #TruthExposed https://t.co/XuKZv2iCNK'
1181266907820941313,2019-10-07 17:55:52,45141,12271,False,b'Sprout Social',"b'Once again, @realDonaldTrump is deserting an ally in a foolish attempt to appease a foreign strongman \xe2\x80\x93 this time betraying our Kurdish allies who have been instrumental partners in our mission to eradicate ISIS. https://t.co/Bfa1MzxxCU'"
1180929689940119553,2019-10-06 19:35:53,0,12634,False,b'Twitter Web App',"b'RT @CNN: \xe2\x80\x9cThe Republican party has got to get a grip on itself,\xe2\x80\x9d Former Secy. of State Colin Powell on the state of the current GOP. \xe2\x80\x9cRepub\xe2\x80\xa6'"
1180478164641996800,2019-10-05 13:41:41,0,506,False,b'Twitter Web App',"b'RT @RepLBR: Soaring drug prices touch everyone\xe2\x80\x99s wallets, from millennials to middle-aged parents to seniors.  America\xe2\x80\x99s patients and taxpa\xe2\x80\xa6'"
1180252527020986369,2019-10-04 22:45:05,17335,4571,False,b'Twitter Web App',"b'The Supreme Court must uphold the rulings of lower courts across the country, which have determined that the Trump Admin\xe2\x80\x99s cruelty in terminating DACA was illegal &amp; must be overturned. https://t.co/ydz70jkWJ5'"
1180238408310018048,2019-10-04 21:48:58,3426,1053,False,b'Twitter Media Studio',"b'Soaring drug prices impact everyone, from millennials to middle aged parents to seniors. Thankfully, leaders like @RepLBR are spreading the word about @HouseDemocrats\xe2\x80\x99 efforts to #LowerDrugCosts for Americans nationwide. https://t.co/O01OcRE9PA'"
1180127746707660800,2019-10-04 14:29:15,17578,8469,False,b'Sprout Social',"b""Hong Kong invoking the Emergency Regulations Ordinance to ban face masks does not answer the people's grievances, and only intensifies concerns about freedom of expression. https://t.co/tmOuwFFWeQ"""
1180098406326382592,2019-10-04 12:32:39,13955,2933,False,b'Twitter Web App',b'Congress must not back down from our duty to defend the Constitution as @realDonaldTrump ignores the Founders\xe2\x80\x99 warnings about foreign interference at every turn. #TruthExposed'
1180098404669693952,2019-10-04 12:32:39,52822,14410,False,b'Twitter Web App',b'What did @realDonaldTrump promise China in exchange for interfering in our election? An easier deal on trade? Ignoring crackdown on Hong Kong\xe2\x80\x99s pro-democracy movement? Condoning repression of religious freedom? #TruthExposed'
1179924196689895425,2019-10-04 01:00:25,1748,318,False,b'Twitter Web App',"b'Thank you to @RepWilson for inviting me to join today\xe2\x80\x99s roundtable in Miami to discuss the current unrest in Haiti with members of the south Florida Haitian community. And, as always, such a pleasure to meet some of the @5000RoleModels! https://t.co/jsa3EFdFBU'"
1179913353675837441,2019-10-04 00:17:19,43922,10069,False,b'Twitter Media Studio',b'The fact that the @HouseGOP\xe2\x80\x99s loyalty is to Trump and not to the Constitution is not going to slow down or impair our ability to keep the republic our Founders envisioned. #TruthExposed https://t.co/AlxphEf8eS'
1179884855192178688,2019-10-03 22:24:05,2021,436,False,b'Twitter Web App',"b'.@HouseDemocrats stand with the people of Venezuela. It was an honor to join @RepDWStweets, @RepShalala, @RepDMP, @RepSires and the U.S. Venezuelan community in FL today to fight for TPS, for human rights and for democracy in Venezuela. https://t.co/szX4yH5WfF'"
1179857535366512641,2019-10-03 20:35:31,18068,5678,False,b'Twitter Media Studio',"b'Democrats have already passed legislation to protect people with pre-existing conditions, #EndGunViolence, &amp; raise wages.\n\n@SenateMajLdr must do his job &amp; finally allow a vote on these measures. https://t.co/00nQ78DP48'"
1179826657500319744,2019-10-03 18:32:49,73595,15844,False,b'Sprout Social',"b'Once again, @realDonaldTrump has called on a foreign country to interfere in our elections \xe2\x80\x93 just the latest example of him putting his personal political gain ahead of defending the integrity of our elections. #TruthExposed'"
1179556328068583424,2019-10-03 00:38:38,7646,2131,False,b'Twitter Web App',b'Be sure to tune in to watch my full conversation with @GStephanopoulos at 7:05 am ET tomorrow on ABC\xe2\x80\x99s @GMA! https://t.co/eKMNK3JG7m'
1179527730792161285,2019-10-02 22:45:00,47169,10486,False,b'Twitter Media Studio',b'The Founding Fathers could never have imagined a president who claimed the Constitution empowered them to do what ever he or she wanted. #TruthExposed https://t.co/gDBQO3NIQO'
1179513304621998080,2019-10-02 21:47:40,34419,8844,False,b'Twitter Media Studio',"b'The sequence of events makes it clear:\n \n@realDonaldTrump personally delayed delivery of critical security aid to Ukraine in order to create leverage.\n \nThen, he told the Ukrainian president that he wanted a \xe2\x80\x9cfavor\xe2\x80\xa6\xe2\x80\x9d\n \n#TruthExposed https://t.co/HVAnOApM8i'"
1179446197909676032,2019-10-02 17:21:01,44512,7987,False,b'Sprout Social',"b""This is a very sad time for our country. Investigating a president for impeachment is not a joyful thing. Yet @realDonaldTrump's behavior leaves us no choice but to move forward. #TruthExposed https://t.co/kmUGVjiETR"""
1179412607087923201,2019-10-02 15:07:32,17887,4553,False,b'Twitter Media Studio',"b'Over the past week, we\xe2\x80\x99ve learned a great deal about @realDonaldTrump\xe2\x80\x99s abuses of power &amp; betrayal of his oath of office. #TruthExposed https://t.co/J28dwDVNnZ'"
1179398288778366977,2019-10-02 14:10:38,7049,1659,False,b'Sprout Social',b'Tune in at 10:45 am ET as @RepAdamSchiff joins me to speak with reporters live from the U.S. Capitol as the House continues its inquiry into @realDonaldTrump\xe2\x80\x99s abuses of power. #TruthExposed https://t.co/rFd2fqW3Qv'
1179093500043956227,2019-10-01 17:59:31,48849,7520,False,b'Sprout Social',b'Wishing a joyous 95th birthday to President Jimmy Carter today. Your devotion to public service &amp; commitment to improving the lives of countless people around the world drive us all to work for a better future. https://t.co/WQXJoZx7Lq'
1179037172768243713,2019-10-01 14:15:42,14608,3444,False,b'Sprout Social',"b'Two years after 58 lives were lost &amp; hundreds more injured in a horrific shooting in Las Vegas, we remain committed to the fight to #EndGunViolence so other families may be spared the pain caused every day across America by the gun violence epidemic. https://t.co/RjCsC5PRoy'"
1178686740070055936,2019-09-30 15:03:12,29537,8693,False,b'Sprout Social',b'.@realDonaldTrump &amp; Admin officials are engaged in a cover-up. It is that simple. #TruthExposed https://t.co/bhIOuXxuXa'
1178469134738296832,2019-09-30 00:38:31,40560,9418,False,b'Twitter Media Studio',b'The most startling thing about @realDonaldTrump\xe2\x80\x99s behavior is how he fails to recognize the severity of his abuses of power. @60Minutes #ExposeTheTruth https://t.co/3wIrUqQMWo'
1178446483189850112,2019-09-29 23:08:30,2368,409,False,b'Twitter Web App',"b'May this new year usher in a time of joy, prosperity and peace for Jewish families in the United States and around the world.  Shana tovah u\xe2\x80\x99metukah \xe2\x80\x93 may you have a happy, healthy, sweet new year. https://t.co/pVcCqjXH9O https://t.co/CMYJbi2Goh'"
1178438016815321095,2019-09-29 22:34:52,25805,5808,False,b'Twitter Media Studio',b'.@SenateMajLdr McConnell seems to think he can wait out the calls for him to bring up background check legislation.\n\nHe\xe2\x80\x99s wrong \xe2\x80\x93 we aren\xe2\x80\x99t going anywhere. #EndGunViolence https://t.co/XaFFieISEG'
1178415551015718913,2019-09-29 21:05:35,11247,2397,False,b'Twitter Web App',"b'This week, in addition to officially launching a formal impeachment inquiry into @realDonaldTrump\xe2\x80\x99s abuses of power, we continued the fight to #EndGunViolence and met with @jvn to discuss the #EqualityAct. https://t.co/en04DNOLAh'"
1178368335572078593,2019-09-29 17:57:58,85092,19213,False,b'Twitter Media Studio',"b'Last time I checked, the Constitution doesn\xe2\x80\x99t say anything about presidents being allowed to use taxpayer dollars to shake down foreign leaders for investigations that will help their political campaigns. #ExposeTheTruth https://t.co/qpDXiB3nMT'"
1178333532453781505,2019-09-29 15:39:41,21816,4726,False,b'Twitter Media Studio',"b'Congress must not turn away from its duty to protect America\xe2\x80\x99s elections and defend our constitution, just as generations before us have done. #ExposeTheTruth https://t.co/THMMWGXlqA'"
