id,created_at,text
621001044026388480,2015-07-14 16:59:21,Here's my full statement on today's tragic and outrageous Planned Parenthood news. https://t.co/cs8zUmUNNa
620976072318824448,2015-07-14 15:20:07,Excited to join @HappeningNow on @FoxNews around 1:20 ET. Tune in! http://t.co/VUHR7rCOut #Carly2016
620970555131432960,2015-07-14 14:58:12,"Hillary Clinton has engaged in a cover up, and has blood on her hands. https://t.co/rvtYyNQlq7 #Carly2016 (2/2)"
620970425414221826,2015-07-14 14:57:41,We now have enough info. to know that Hillary Clinton has engaged in gross dereliction of duty. https://t.co/rvtYyNQlq7 #Carly2016 (1/2)
620953578673426432,2015-07-14 13:50:44,"RT @IngrahamAngle: .@CarlyFiorina: ""History tells us that Iran will cheat. Contrary to what this administration has said; this will give Ir…"
620945154418061312,2015-07-14 13:17:16,Joining @IngrahamAngle live shortly. Tune in! http://t.co/NaC5DdtpCM #Carly2016
620938105760055296,2015-07-14 12:49:15,Iran has demonstrated bad behavior &amp; we know they have been trying to cheat on this deal. https://t.co/fwQYuA1Eys #Carly2016
620921953268858881,2015-07-14 11:45:04,Excited to join @CBSThisMorning shortly. I hope you'll tune in! http://t.co/Vj0swFANuI  #Carly2016
620776803066470400,2015-07-14 02:08:17,Hillary Clinton has blood on her hands. https://t.co/dTzoJMtGNe
620773092625772544,2015-07-14 01:53:33,Tune into #KellyFile! @MegynKelly. http://t.co/VUHR7rCOut #Carly2016 http://t.co/aIcr0HCSOt
620769392645775360,2015-07-14 01:38:51,.@MonicaCrowley It was great seeing you!
620769333057294337,2015-07-14 01:38:36,RT @MonicaCrowley: So good to visit with @CarlyFiorina in NYC tonight. She's dynamite. No one should underestimate her.
620737431088730112,2015-07-13 23:31:50,Looking forward to talking with @MegynKelly on #KellyFile tonight. Tune in! http://t.co/VUHR7rCOut #Carly2016 http://t.co/ndDSJ3sujR
620619668856832000,2015-07-13 15:43:54,Excited to join @CoffeeAndMarket for its first show on @1590WCGO. Tune in! http://t.co/xGVgs4OFwk #Carly2016
620615033236525057,2015-07-13 15:25:29,"What are my thoughts on Hillary Clinton's speech this morning? #Carly2016
https://t.co/iY2jLO4beN"
620308905105584133,2015-07-12 19:09:02,"Thank you New Hampshire for a great week. #Carly2016 #nhpolitics
https://t.co/gKXEuUuFm2"
620294163381161984,2015-07-12 18:10:27,"We need to understand that small businesses are the true engine of economic growth. #Carly2016
https://t.co/7D9uw9Rf5P"
620238906093535233,2015-07-12 14:30:53,"What would I do about Iran if I were president? #Carly2016
https://t.co/Pyai6tgs2p"
620237703280357376,2015-07-12 14:26:06,Great joining @ThisWeekABC by way of @saintanselm. #Carly2016 http://t.co/oA1qQr0Q2d
620214782298185728,2015-07-12 12:55:01,Tune in now to @ThisWeekABC. I'm coming up! http://t.co/dUE7PuMCTX #Carly2016 http://t.co/VXMQsgbEnr
620029810744561664,2015-07-12 00:40:01,Thank you to Tom Eaton for today's house party in Spofford! #Carly2016 #nhpolitics http://t.co/Y8K1ksFTUw
619929202750418944,2015-07-11 18:00:14,Joining @ThisWeekABC tomorrow around 9:00 a.m. ET. Tune in! http://t.co/dUE7PuMCTX #Carly2016 http://t.co/kvO3syc9x5
619678166748037120,2015-07-11 01:22:42,Wall to wall crowd at Robie's in Hooksett this evening. Great to be at a staple of #NHpolitics! #Carly2016 http://t.co/m2lgFUAzD3
619618356715393025,2015-07-10 21:25:02,Looking forward to joining @HowieCarrShow soon. I hope you can listen in! http://t.co/OioBFm86f6 #Carly2016
619589823444189184,2015-07-10 19:31:39,.@DanaPerino Maybe it's a sign I should guest host @TheFive soon? I'll bring the Diet Coke. #ShareaCoke
619560691121422336,2015-07-10 17:35:54,On the trail earlier in Londonderry. Thanks Rep. David Lundgren for hosting! #nhpolitics #Carly2016 http://t.co/H01SbAlK2G
619524288325025793,2015-07-10 15:11:15,I’m excited to join @ThisWeekABC on Sunday and hope you can tune in. http://t.co/xUeR2dgXKD #Carly2016
619497166264999936,2015-07-10 13:23:28,About to join Peter Boyles on @710KNUS. You can listen here! http://t.co/oqLRpPJwiG #Carly2016
619295999995940865,2015-07-10 00:04:07,"Less rhetoric, more results. RT if you agree. #Carly2016
https://t.co/zxtD9PYrnO"
619288237694173184,2015-07-09 23:33:16,Big crowd at this evening's house party in Nashua. Thanks to Stephen &amp; Terry Negron for hosting! #Carly2016 http://t.co/qhWjFrpWzX
619246324353925120,2015-07-09 20:46:43,More proof the status quo isn't working: Over 25MM Americans had their personal info stolen in this OPM breach. Where's the accountability?
619203916522258433,2015-07-09 17:58:12,I enjoyed visiting Main St. in Nashua today! #nhpolitics #Carly2016 http://t.co/iejbwVvouU
619158946188775424,2015-07-09 14:59:30,"I salute @JennyHorne — a woman of courage, conviction, and compassion. She led when leadership was called for. http://t.co/3ZQ4HLQDHu"
619145175533641728,2015-07-09 14:04:47,"Our insecure border points out that we have too many sound bites and not enough problem solving. #Carly2016
https://t.co/Smq08eyh3y"
619131271378288640,2015-07-09 13:09:32,Now I'm about to join Peter St. James on the NH Wake Up Show. You can listen here. http://t.co/Cjft3Dwfah #nhpolitics #Carly2016
619121889131253761,2015-07-09 12:32:15,Joining @mrtalkradio George Russell shortly on WSMN. Listen live here. http://t.co/4SLk4F3Luq #Carly2016 #nhpolitics
618969966075736064,2015-07-09 02:28:34,"Thank you Hampstead for a great welcome this evening! #nhpolitics #Carly2016
https://t.co/HZtXspRdML"
618932655237693440,2015-07-09 00:00:18,Tune into @SeanHannity tonight. I'll be joining around 10:45 EST. http://t.co/TuJDhKJ42a #Carly2016
618892261875691521,2015-07-08 21:19:48,Technology is a tool that can be used to reimagine gov't &amp; galvanize citizen pressure on Washington. http://t.co/wfbdO7uSHQ #Carly2016
618885010578382848,2015-07-08 20:50:59,Looking forward to answering your questions! http://t.co/RRdSk0PVVe @BreitbartNews #Carly2016
618845786684588036,2015-07-08 18:15:07,RT if you agree that we must radically simplify the tax code &amp; lower rates. http://t.co/D1ISr24yPR #Carly2016
618838298803335168,2015-07-08 17:45:22,Lunch meet &amp; greet with the Greater Salem Chamber. Great crowd! #nhpolitics #Carly2016 http://t.co/FeT0vZ9QnC
618813355185303552,2015-07-08 16:06:15,"I enjoyed stopping by the Salem, NH Chamber of Commerce! #nhpolitics #Carly2016 http://t.co/6rDeVr6CQi"
618789199492182017,2015-07-08 14:30:16,Yesterday showed @HillaryClinton is going to continue to try &amp; run away from accountability. https://t.co/PwmrLGTxB2 #Carly2016
618765253204135936,2015-07-08 12:55:07,"Good, thoughtful conversation with business leaders in Concord at J. Hampe &amp; Associates. #nhpolitics #Carly2016 http://t.co/OaEfzLeJqP"
618751245659078657,2015-07-08 11:59:27,Enjoyed joining @foxandfriends this morning. You can watch the full interview here. https://t.co/PwmrLHb8ZC #Carly2016
618735051077873664,2015-07-08 10:55:06,Coming up on @foxandfriends. Watch live here! http://t.co/TuJDhKJ42a #Carly2016 http://t.co/bkNJFmRzQ8
618604379910897665,2015-07-08 02:15:51,Tomorrow around 7:00 a.m EST I'll be joining @foxandfriends. Tune in! http://t.co/TuJDhKrtaC #Carly2016 http://t.co/riCQeIaNDA
618555170742403073,2015-07-07 23:00:19,"With your help, I look forward to making it onto the debate stage in less than a month. https://t.co/UsOPl1d8f1 #Carly2016"
618501746839695360,2015-07-07 19:28:02,Pit stop at Johnson's for some chocolate lover's chocolate ice cream. #Carly2016 http://t.co/nH3NtoxAPP
618466600115666945,2015-07-07 17:08:22,Enjoying this afternoon's tour of Laars Heating Systems in Rochester. #nhpolitics #Carly2016 http://t.co/9fNguqethY
618415411961438208,2015-07-07 13:44:58,Great stop at Russo's Barber Shop. #nhpolitics #Carly2016 http://t.co/WiFRSk2ayf
618398504558268417,2015-07-07 12:37:47,Meeting voters at Geno's in Portsmouth this morning. #nhpolitics #Carly2016 http://t.co/HE5UUI4Gpp
618228584998666241,2015-07-07 01:22:35,Enjoyed touring @TurbocamIntl in Barrington today! #nhpolitics #Carly2016 http://t.co/PAMJXwxrzD
618185012270137346,2015-07-06 22:29:26,Full house for today's townhall. Thanks @StraffordNHGOP and @TurboCamIntl! #nhpolitics #Carly2016 http://t.co/Ub35SmcE7i
618184059647193088,2015-07-06 22:25:39,RT @StraffordNHGOP: @StraffordNHGOP @CarlyFiorina packed house w/ Carly #Carly2016 #nhpolitics #fitn http://t.co/bGFPr0ghJw
618127960604717056,2015-07-06 18:42:44,Join our campaign at one of our stops this week in New Hampshire. #nhpolitics #Carly2016 http://t.co/Qo2Ol2nVHm
618067278710444034,2015-07-06 14:41:37,Touring Turbcam International &amp; joining @StraffordNHGOP around 4:30 pm EST. Catch the livestream here. http://t.co/YlcQflDc53 #nhpolitics
618039626486427648,2015-07-06 12:51:44,RT @StraffordNHGOP: Reminder: @CarlyFiorina Townhall today 5PM at Turbocam in Barrington #nhpolitics
617860458545061889,2015-07-06 00:59:47,Congrats @ussoccer_wnt! Shoutout to @CarliLloyd for an historic performance and a great first name. #USWNT
617354722693885953,2015-07-04 15:30:10,"Celebrating American ingenuity and innovation with my granddaughters in Kitty Hawk, NC. http://t.co/KdieyRciNb"
617309643790880769,2015-07-04 12:31:02,Here's what I'm thinking about on our nation's 239th birthday. Happy Independence Day. http://t.co/Wc5MId6OjH
616928144944050176,2015-07-03 11:15:06,I'll be joining @SenJeb shortly as he guest hosts for @JackHeathRadio on NH Today. Tune in! http://t.co/fOLRrISaWp #Carly2016 #nhpolitics
616688072118390784,2015-07-02 19:21:08,"With your help, we are quickly building the momentum necessary to get on the debate stage. #Carly2016 http://t.co/Uz2X5ofqLS"
616611050306166784,2015-07-02 14:15:05,"This morning I’m joining @Betsy_McCaughey, guest hosting for @IngrahamAngle. Hope you can tune in! http://t.co/NaC5DdbOec #Carly2016"
616355612117499904,2015-07-01 21:20:03,"Coming up shortly with fmr. Iowa state Sen. @JeffAngelo1, guest hosting for @SimonRadio1776. Tune in! http://t.co/4jlMJQ3Akr #iapolitics"
616348065880866816,2015-07-01 20:50:04,Tune into @MedvedShow if you can. I’m coming up in a few minutes. http://t.co/rU8CRO902z #Carly2016
616267553300611074,2015-07-01 15:30:09,Thankful for the support we’re building in New Hampshire and across the country. http://t.co/C32PaqXyw1 #Carly2016 #nhpolitics
616258727604150272,2015-07-01 14:55:04,I'll be joining @amtalker Jan Mickelson shortly on @whoradio. You can listen here. http://t.co/pwUpU7kJav #iapolitics #Carly2016
616246140443320320,2015-07-01 14:05:03,"Great talking with you last night, @hughhewitt. https://t.co/J7Cs67Fgyh #Carly2016"
616046663870869504,2015-07-01 00:52:24,Cheering on @ussoccer_wnt tonight! #USWNT
616032232168255488,2015-06-30 23:55:04,I'm about to join @LarsLarsonShow live. I hope you can tune in! http://t.co/t7K4AK1mxj #Carly2016
616017135429521408,2015-06-30 22:55:04,I’m about to join my friend @hughhewitt live on the air. I hope you’ll tune in! http://t.co/luPX43QZ4T #Carly2016
615935384174768132,2015-06-30 17:30:13,The FEC fundraising deadline is today! Please chip in $3 before midnight. http://t.co/yMa1rj51fW #Carly2016 http://t.co/DlmfUiPybP
615922238433263616,2015-06-30 16:37:59,"Here is why we must repeal Obamacare. #Carly2016
https://t.co/wD9v9RBwfq"
615588126795247616,2015-06-29 18:30:21,Our first fundraising deadline is coming up. Will you chip in to help prove our momentum? http://t.co/yMa1rj51fW #Carly2016
615583143677067264,2015-06-29 18:10:33,RT if you agree that you cannot unlock potential without challenging the status quo. #Carly2016 http://t.co/omvXaYjX1p
615308454165549058,2015-06-28 23:59:02,What you are is God’s gift to you. What you make of yourself is your gift to God http://t.co/qCqXfqUIVB #WCS15
615263035343683585,2015-06-28 20:58:33,I believe that ours was intended to be a citizen government http://t.co/Usyn7DpkxM #Carly2016
614849036001116160,2015-06-27 17:33:28,"Great opportunity to speak at #WCS15 , thank you for inviting me http://t.co/LWjWIJMRVV"
614833108563550213,2015-06-27 16:30:10,I’m coming up soon for #WCS15 ! Tune in live at http://t.co/YAdSXJGwLW
614593699566194688,2015-06-27 00:38:51,"Tomorrow I will be speaking at #WCS15 , I hope you will join me!"
614532918543822848,2015-06-26 20:37:19,ICYMI Here's a link to my hour with @seanhannity last night! http://t.co/3oaUQKV8UR
614501622526398465,2015-06-26 18:32:58,Thanks for hosting this great #Powering2016 event @realclearnews! It was great to be here http://t.co/7YY5C5AoYu
614465082278473730,2015-06-26 16:07:46,Thank you for having me on @710KNUS! It was a pleasure to talk with you @DanCaplis
614443213638791168,2015-06-26 14:40:52,"Agree w Alito: ""All Americans... should worry about what the majority’s claim of power portends.” #SCOTUS http://t.co/xckkwMv205"
614442117117661184,2015-06-26 14:36:31,My statement on today’s #SCOTUS ruling http://t.co/UalM0QnBuF
614268366367367169,2015-06-26 03:06:05,I can win this job and I can do this job. #Carly2016 http://t.co/PwrE60pBMj
614267845325758464,2015-06-26 03:04:01,"When I was a little girl, my mother told me what you are is God's gift to you, what you become is your gift to God http://t.co/XzCZgfxYUy"
614267310807904257,2015-06-26 03:01:54,I think now we need someone in the Oval Office who understands what leadership really means #Hannity #Carly 2016 http://t.co/XzCZgfxYUy
614265775088607232,2015-06-26 02:55:47,"When we are not leading, the world is a far more dangerous and tragic place #Hannity #Carly2016 http://t.co/XzCZgfxYUy"
614264498355093504,2015-06-26 02:50:43,We need to secure the border. We need to fix the basics before we talk about citizenship #Hannity #Carly2016 http://t.co/XzCZgfxYUy
614263840843407361,2015-06-26 02:48:06,"One nation acting alone will make no difference in climate change, the answer is innovation #Hannity #Carly2016 http://t.co/XzCZgfxYUy"
614263384159178752,2015-06-26 02:46:17,We don't have to run away from our principles to bring others to our party. How we talk about our principles matters http://t.co/XzCZgfxYUy
614263101534380032,2015-06-26 02:45:10,Small and family owned businesses employ half the nation and our government is crushing them #Hannity #Carly2016 http://t.co/XzCZgfxYUy
614261928773480448,2015-06-26 02:40:30,"We need a leader in the Oval Office that will challenge the status quo of Washington, DC #Hannity #Carly 2016 http://t.co/XzCZgfxYUy"
614261293575442433,2015-06-26 02:37:59,We need to go to real zero based budgeting: every program needs to be justified every year http://t.co/XzCZgfxYUy #Hannity #Carly2016
614260512164040705,2015-06-26 02:34:53,"The only way to get our debts and deficits under control: grow the economy, cut spending #Hannity #Carly2016 http://t.co/XzCZgfxYUy"
614259926198820866,2015-06-26 02:32:33,"We are China's largest market, and this is our greatest leverage #Hannity #Carly2016 http://t.co/XzCZgfxYUy"
614259495900983297,2015-06-26 02:30:50,"We can, should, will become the major energy power of the 21st century #Hannity #Carly 2016 http://t.co/XzCZgfxYUy"
614258896635441152,2015-06-26 02:28:27,"Iran won't agree to a deal without consistent pressure, this administration hasn't done that #Hannity http://t.co/XzCZgfPzM6"
614258182312095744,2015-06-26 02:25:37,"It's called hypocrisy. Going to China in 1993 is one thing, actions matching your words is another.  #Hannity http://t.co/XzCZgfxYUy"
614257101796413440,2015-06-26 02:21:20,know how vital it is that our allies believe we will stand with them http://t.co/XzCZgfxYUy #Hannity #Carly2016
614253379687198720,2015-06-26 02:06:32,The only way to change the government is to have someone who challenges the status quo #Hannity #Carly2016
614236674994757636,2015-06-26 01:00:09,Be sure to watch @seanhannity tonight at 10 on @FoxNews to see my full hour interview! http://t.co/ybbVaalHyX
614209852143841280,2015-06-25 23:13:34,"Join our team today.
https://t.co/xxSrYow1yC"
614140795076091904,2015-06-25 18:39:10,Coming up soon on the @MedvedSHOW. Listen in!  http://t.co/rU8CRNRpb1 #Carly2016
614118831204749312,2015-06-25 17:11:53,"In case you missed it, here's my interview with @hughhewitt last night! Thanks for having me! http://t.co/DjyFpMkzcL"
614084037175582720,2015-06-25 14:53:38,Repeal Obamacare and let the free market—not more crony capitalism—improve access and care for all Americans. http://t.co/qaAR7pNVQJ
614083467941412864,2015-06-25 14:51:22,"ObamaCare has not lived up to what we were promised. It has become clear that this law isn’t working
http://t.co/qaAR7pNVQJ"
614083118413291520,2015-06-25 14:49:59,"It is outrageous that the Supreme Court once again rewrote ObamaCare to save this deeply flawed law 
https://t.co/NBAnohFTW7"
613821655559704576,2015-06-24 21:31:01,I'll be joining @hughhewitt tonight on his show! Listen in here: http://t.co/Dh2rbweqND http://t.co/app0RC4fMc
613810335972110336,2015-06-24 20:46:02,Be sure to tune into my full hour with @seanhannity tomorrow night on @FoxNews #Carly2016 http://t.co/1hbACuRnek
613776135143321600,2015-06-24 18:30:08,There are only 23 female CEOs in the S&amp;P 500. Fun fact: There are more CEOs named John than there are women. http://t.co/V0RTPBE9a0
613745953296678913,2015-06-24 16:30:12,"Check out my new post on @Medium, ""Redefining Feminism: The State of Women in America"" http://t.co/V0RTPBE9a0 #Carly2016"
613707988352794625,2015-06-24 13:59:21,I’ll be joining @IngrahamAngle very soon! Listen in here: http://t.co/NaC5DdtpCM
613436407797788673,2015-06-23 20:00:11,"We need a centralized command with the accountability, responsibility of protecting our government systems http://t.co/DJ8SQZ3qmq"
613394874155446272,2015-06-23 17:15:08,I do think as a party it is important that we are as diverse as the nation we hope to represent http://t.co/lm9nVbEXCX
613373134553673728,2015-06-23 15:48:45,Cybersecurity has to be a central part of any homeland security strategy http://t.co/DJ8SQZl1L0
613106623020601344,2015-06-22 22:09:44,Thank you @HuntsmanAbby and @thecyclemsnbc for sitting down with me. Check out the interview here: http://t.co/MprhN0NRtt
613047583536103424,2015-06-22 18:15:08,Only in America can a young woman go from secretary to CEO to presidential candidate http://t.co/cBagNPo7ck #Carly2016
613008637003472896,2015-06-22 15:40:22,Thank you @mboyle1 and @BreitbartNews for having me on the show last night! http://t.co/tLzwU3dOOT
612741834515705856,2015-06-21 22:00:12,I'm a conservative because I know no one of us is better than any other http://t.co/Fb89cxhSQR
612718136362672128,2015-06-21 20:26:02,Listen in tonight on @BreitbartXM as I join @mboyle1 and @BreitbartNews Sunday #Carly2016
612705819935682561,2015-06-21 19:37:05,People of sincere faith make better leaders - our faith gives us humility http://t.co/Fb89cxhSQR
612655238198079489,2015-06-21 16:16:06,Watch my speech at @FaithandFreedom #RTM2015! http://t.co/Fb89cxhSQR
612648846984937472,2015-06-21 15:50:42,"From my father, I learned that character is the core of who we are and the foundation of what we can become. http://t.co/NrnvIs0rBi"
612413388044439552,2015-06-21 00:15:04,Thanks for the invitation @FairfaxGOP #Carly2016
612371882382262272,2015-06-20 21:30:08,Excited to be with @FairfaxGOP tonight! Come join us! #Carly2016
612288633689776128,2015-06-20 15:59:20,Great to be at #RTM2015 Thank you @FaithandFreedom for hosting this wonderful event #Carly2016 http://t.co/z39zH1g81u
612254843533594624,2015-06-20 13:45:04,I'll be at #RoadtoMajority soon! Join me and @FaithandFreedom #Carly2016 http://t.co/mQGsR22hKE
612035895605116928,2015-06-19 23:15:03,Excited to speak at @FaithandFreedom #RoadtoMajority tomorrow morning! #Carly2016 http://t.co/aHNi4uY8J2
611984307008110593,2015-06-19 19:50:03,"I have a heavy responsibility now, and I have to execute that responsibility on behalf of everyone #Carly2016 http://t.co/meiJiy2Clt"
611978206430765056,2015-06-19 19:25:49,"Wonderful event with @PAGOP, @PhillyGOP and @GOPLeadership! Thank you for the invitation http://t.co/OqBQPmON99"
611949109730107392,2015-06-19 17:30:11,Speaking this afternoon with the @PAGOP for #NRLC2015 at the Sheraton Downtown Philadelphia #Carly2016
611908471609389056,2015-06-19 14:48:42,We should move to meritocracy in the federal government #Carly2016 http://t.co/meiJiy2Clt
611725096529473536,2015-06-19 02:40:02,"Ready to speak in Philadelphia tomorrow with the @PAGOP and @GOPLeadership at #NRLC2015, see you there!"
611707511398248453,2015-06-19 01:30:10,The @cpnys annual dinner tonight was a great chance to meet New York conservatives! Thanks for inviting me! #Carly2016
611685555227766784,2015-06-19 00:02:55,Watch my full interview with @MarkHalperin on @bpolitics #WADR here: http://t.co/meiJiykdK3
611635771842256896,2015-06-18 20:45:06,Watch my interview with @MarkHalperin this afternoon on @BloombergTV #Carly2016 #WADR
611629475583823872,2015-06-18 20:20:05,My radio interview with @seanhannity airs shortly. Listen live at http://t.co/tX6iGbBhl8 #Hannity #Carly2016
611604299542499328,2015-06-18 18:40:02,Excited to talk with @seanhannity this afternoon on his radio show. You can hear it via @iHeartRadio http://t.co/tvx0Z4m8vz
611511204486352898,2015-06-18 12:30:07,I'll be joining @JCats2013 later this morning on @am970TheAnswer ! Listen in here http://t.co/bACdCXDiGt #Carly2016
611488585611505665,2015-06-18 11:00:14,"Enjoyed talking with you yesterday, @hughhewitt. https://t.co/IZBQSsGFjM #Carly2016"
611277879356313600,2015-06-17 21:02:58,Joining @hughhewitt live around 5:15 ET from New York! Listen in. http://t.co/luPX43zodl #Carly2016
611254536041181184,2015-06-17 19:30:12,I'm excited for good conversation with @MedvedShow. http://t.co/rU8CRO902z #Carly2016
611180180288184320,2015-06-17 14:34:44,Here's my full interview with @NewDay on @CNN. https://t.co/458xz3wZeS #Carly2016
611178727851065345,2015-06-17 14:28:58,.@HuntsmanAbby it was great talking to you! I'm looking forward to seeing the interview on @msnbc. #Carly2016
611174772886499329,2015-06-17 14:13:15,"I started out as a secretary. My husband started as a tow truck driver. We’ve lived the American Dream. #Carly2016
https://t.co/HvVHHMQWDH"
611174355465293824,2015-06-17 14:11:36,RT @NewDay: Should the US be giving more support to Arab allies in the fight against #ISIS? @CarlyFiorina says yes. @CNNPolitics http://t.c…
611148447341678592,2015-06-17 12:28:39,Coming up with @JackHeathRadio on NH Today. Listen live. http://t.co/oHu7TAFo5I #Carly2016 #nhpolitics
611124765479301120,2015-06-17 10:54:32,This morning I'm joining @CNN's New Day. Tune in around 7:15 a.m. ET! http://t.co/8EaudN5WzD #Carly2016
610914681696288768,2015-06-16 20:59:45,"RT @trscoop: WATCH: Carly Fiorina goes on The View, handles herself FANTASTICALLY http://t.co/UE4sUPHNW4"
610835722535202816,2015-06-16 15:45:59,"Thank you @WhoopiGoldberg, @NicolleDWallace, @ravensymone, @rosieperezbklyn &amp; @michcoll! Enjoyed joining you on @TheView."
610835584513257473,2015-06-16 15:45:26,"RT @TheView: ""I believe that a feminist is any woman who lives the life she chooses."" - @CarlyFiorina #CarlyOnTheView http://t.co/XlP5tfBm1l"
610803375072915457,2015-06-16 13:37:27,"The big fight in 2016 is about who can change the status quo in Washington. #Hannity #Carly2016
https://t.co/FzaajLgk9r"
610797683280842754,2015-06-16 13:14:50,RT @TheView: Today 2016 Republican presidential candidate @CarlyFiorina joins us LIVE on @TheView #CarlyOnTheView http://t.co/YR1y10j0w7
610626617203765249,2015-06-16 01:55:05,My interview with @seanhannity is coming up! http://t.co/wMblSVWv1D #Carly2016
610582680988618752,2015-06-15 23:00:29,Tune into @TheView tomorrow &amp; tweet your questions to #CarlyOnTheView. I’ll be joining around 11:20 a.m. ET! http://t.co/JCZZLUxE2M
610560078903689216,2015-06-15 21:30:41,"I’m running because this is a great nation, but it is a great nation at a pivotal point. http://t.co/c2pzO50Ial #OpinionJournal @WSJLive"
610516554413928448,2015-06-15 18:37:44,Looking forward to it! @TheView #Carly2016 #CarlyOnTheView https://t.co/1St2eypWVS
610440821632970752,2015-06-15 13:36:47,"Enjoyed going back to @Morning_Joe and discussing the issues today. #Carly2016
https://t.co/t1Bu4rr1UY"
610417714167812096,2015-06-15 12:04:58,"Dodd-Frank has had a demonstrably bad impact. #Carly2016
https://t.co/kaMocyh0mb"
610391068442431489,2015-06-15 10:19:05,This morning I’ll be joining @JoeNBC and @morningmika on @Morning_Joe. Tune in! http://t.co/h9eTRlQU9I
610227741611274241,2015-06-14 23:30:05,"Leadership has nothing to do with title or position, it has to do with unlocking potential"
610163817893330944,2015-06-14 19:16:05,All the things that concern the American people are legitimate topics in an election @JoshMcElveen @WMUR9
610148467206295552,2015-06-14 18:15:05,The arguments over the Patriot Act are typical of why people are frustrated with government http://t.co/JuzcK4VZMx @WMUR9
610129629538484224,2015-06-14 17:00:13,Thank you @renee2i for your kind words on @WMUR9 this morning! See it here: http://t.co/AbMNLR3GbL
610117566753804288,2015-06-14 16:12:18,Great to be with the @UtahGOP last night! Thank you for the invitation!
609838926266634242,2015-06-13 21:45:04,"I'm addressing the @UtahGOP soon, hope to see you there #Carly2016"
609812545390555136,2015-06-13 20:00:15,I talk a lot about entrepreneurship because I've seen it work. Entrepreneurship works to lift people out of poverty http://t.co/0GCJxm0ovA
609782503189184512,2015-06-13 18:00:52,Great opportunity to speak with so many leaders at @E2Summit this weekend! http://t.co/MXgN6KCHRM
609747514561036289,2015-06-13 15:41:50,"Beautiful scenery and meaningful conversations, Thank you @MittRomney for hosting us this weekend http://t.co/QspRlKP5Lf"
