id,created_at,text
1075010792553103361,2018-12-18 12:52:00,"This week on By Example, I talk with @SenatorDole about his life, leadership and sense of humor. He also introduces… https://t.co/cuYYXH8MUv"
1072860093673291776,2018-12-12 14:25:53,"Thank you for sharing your story with us, Gretchen. I hope many continued to be inspired by your example.

To liste… https://t.co/W953G8Rdq5"
1072476240257409024,2018-12-11 13:00:35,NEW: I sat down with @GretchenCarlson to talk about her brave “jump off a cliff” that helped launch a movement. Lis… https://t.co/9Ek6LKN6Il
1071895170117976067,2018-12-09 22:31:38,One of the reasons I’ve released By Example is because our culture has become confused about leadership. It’s about… https://t.co/qRhIA9bCjN
1071158577631559681,2018-12-07 21:44:40,"I had a wonderful conversation with John Kemp, of the @ViscardiCenter. He is a great example of courage and leaders… https://t.co/3UoinzCZdT"
1070716595029377025,2018-12-06 16:28:23,"We use the words “public servant” a lot, when many so-called “public servants” are serving themselves.… https://t.co/P3PJBvgd73"
1070068514696900608,2018-12-04 21:33:09,"On this week's episode, hear @JayBilas explain the unlikely trait necessary to toughness and leadership. You can li… https://t.co/YOR0zw9ZX3"
1069941414019153921,2018-12-04 13:08:06,"🚨 NEW EPISODE: @JayBilas shares his perspective on teamwork and the true meaning of “toughness.”

LISTEN:
🎵 iTunes:… https://t.co/PMsBKODcMV"
1068875932155420673,2018-12-01 14:34:15,"We pray for comfort and peace for the Bush family, and know that because of their undying faith, President Bush is… https://t.co/7pHOlhrgG3"
1068875931442470912,2018-12-01 14:34:15,"Frank and I are thanking God today for the life of President @GeorgeHWBush . 41 was a war hero, public servant, fam… https://t.co/DLFNe0lGIr"
1068241202103898113,2018-11-29 20:32:04,"It was an honor to talk with Lt. Col. @Constantine_Jus today for my new podcast, By Example. Our conversation will… https://t.co/xWyIeMT5bh"
1067897353527533573,2018-11-28 21:45:44,@DavidWright_CNN [spins wheel] subscribe here: https://t.co/G82xJYUDEg
1067828292122750978,2018-11-28 17:11:18,RT @BaronDavis: It was a pleasure. Looking forward to building more. https://t.co/AflOBSxtxT
1067827708846055425,2018-11-28 17:08:59,"Thanks to @SandraSmithFox and @BillHemmer for talking about By Example on @AmericaNewsroom!

STREAM NOW:
🎵 iTunes:… https://t.co/xQaOkvxu7F"
1067819184678150144,2018-11-28 16:35:07,"Thank you for sharing this, Congressman! https://t.co/gdoQykg2mB"
1067779081142448130,2018-11-28 13:55:45,"It was an honor to be with my friend, Gen. Colin Powell, to discuss his experience in leadership &amp; how a “long run… https://t.co/1bbcAueRUP"
1067571877319708673,2018-11-28 00:12:24,Thank you Lauren! https://t.co/YUo5nf3whn
1067552058746785798,2018-11-27 22:53:39,"@deavers4 Thank you so much, Bailey!"
1067549689950674944,2018-11-27 22:44:14,"@arjunmody Thanks for the like, Arjun. Frank and I hope you're doing well!"
1067533239353524232,2018-11-27 21:38:52,"Thank you, Jay! https://t.co/hPUg60BLju"
1067518991017619457,2018-11-27 20:42:15,RT @secupp: Love this. https://t.co/ZaHtUkal2U
1067512363685986304,2018-11-27 20:15:55,"@BrandonDHowell Thanks, Brandon!"
1067505773914308613,2018-11-27 19:49:44,"Great to be with you, @SenatorDole. Thanks for your time today, and your many years of continued leadership. https://t.co/2FTGzkeaDs"
1067500730787991562,2018-11-27 19:29:42,Thank you Christopher. I hope all is well in Iowa! https://t.co/v3y0AEkmYR
1067470683045797894,2018-11-27 17:30:18,Thank you @BaronDavis https://t.co/UR85YImnti
1067457899138568194,2018-11-27 16:39:30,Thanks for having me on! I hope everyone has a chance to check out my new podcast at https://t.co/1Ch1KbZ2fi  or on… https://t.co/gpIeBV9fHl
1067457439812001793,2018-11-27 16:37:40,"Thankful for my unlikely friendship with @BaronDavis, who had the vision to bring @DrewCommish for a powerful discu… https://t.co/SBsGEm9Brc"
1067451071658958854,2018-11-27 16:12:22,Thank you my friend.  Good luck in the Ohio General Assembly! https://t.co/OTBtz8dda3
1067450498528231424,2018-11-27 16:10:05,@jannachoney @AmericaNewsroom @SandraSmithFox @BillHemmer Thanks Janna for the kind words.  I think you'd like my n… https://t.co/maFd1d9qgk
1067449902421221376,2018-11-27 16:07:43,@NanHayworth @AmericaNewsroom @GOP @IWF Hope you got to watch @NanHayworth! Check out my new podcast too: https://t.co/1Ch1KbZ2fi
1067448392182390784,2018-11-27 16:01:43,@DAChadSMith @AmericaNewsroom Thanks for watching!  You can listen on iTunes at https://t.co/jnab6t8YL1
1067423882389463040,2018-11-27 14:24:19,"My new podcast, By Example, is out today!

We'll lift up real leaders, people focused on changing the order of thin… https://t.co/bFJXTFOAEZ"
1063472765813047296,2018-11-16 16:44:00,"Life expectancy in D.C.'s Georgetown is 30 yrs longer than areas of Northeast D.C., such as Trinidad.

I’m proud of… https://t.co/KHFP08hRyP"
1062804856518426624,2018-11-14 20:29:58,It was great to spend part of last week with the staff &amp; partners of @GWSMHS Rodham Institute. They're working to s… https://t.co/mIi9vID2Yd
1059780184017002496,2018-11-06 12:11:00,"Today is election day! Read my op-ed in the Washington Examiner about the type of people I'll be voting for:
https://t.co/pBxLoxWV1V"
1059622994677547008,2018-11-06 01:46:23,"Before election day, read my recent op-ed in the @dcexaminer:
https://t.co/pBxLoyewqv"
1059601506675044352,2018-11-06 00:21:00,"If we can continue to redefine leadership, increase collaboration, and forge partnerships among the social sector a… https://t.co/bcaJFpLNH0"
1059543374003429377,2018-11-05 20:30:00,"If we want to retain talent, enthusiasm, and effectiveness in the social sector, organizations and team members wil… https://t.co/ledKPn4bm5"
1059455293795508224,2018-11-05 14:40:00,"Read my op-ed with the @USCCFoundation: Why We Need to Invest in Human Potential

https://t.co/JJLv3QmdXJ"
1059188032455225345,2018-11-04 20:58:00,https://t.co/kzAD58C0uH
1059107466481405952,2018-11-04 15:37:51,"Earlier this month, I was honored to visit @TheBushCenter to join CEO Ken Hersh at the annual President's Council G… https://t.co/aHbfLvkoMG"
1057782521189031941,2018-10-31 23:53:00,"“This is an area of special importance I think, not just to me, but for many, many Americans.""

Read about why:

https://t.co/EquieqFMRP"
1057716083426115584,2018-10-31 19:29:00,"We can and must do better. Read about our work to do just that in the @dcexaminer:
https://t.co/Equieqobtf"
1057650151345610752,2018-10-31 15:07:00,Read my conversation with the @dcexaminer at last week’s https://t.co/zSAirYAWS8 event with leaders representing ve… https://t.co/eCc4j51dvd
1057045917466005504,2018-10-29 23:06:00,"I see role models and leaders all around. They aren’t famous. They don’t get to talk on TV. And yet, they change th… https://t.co/JHasgiCqha"
1057006658616848388,2018-10-29 20:30:00,We need to look in the mirror at the citizen staring back at us. We need to raise our expectations of those who wan… https://t.co/P1DxHSRSqC
1056970420132372482,2018-10-29 18:06:00,"As you consider your candidates this November, ask yourself whether they are worthy of working for you, or if they… https://t.co/vIq5uK2Aji"
1056942486449463298,2018-10-29 16:15:00,"If we want our representatives to actually make progress on the issues that matter most to us, we also need to asse… https://t.co/LCnvVO3y9x"
1056913042376511488,2018-10-29 14:18:00,"5 questions to ask yourself before you vote this November. 

Read my op-ed in the @dcexaminer: https://t.co/pBxLoxWV1V"
1056889637593960449,2018-10-29 12:45:00,"As we approach this midterm election, we should think less about our “team,” and more about the qualities we need i… https://t.co/A4VcjApcpI"
1056864472151670784,2018-10-29 11:05:00,"Who I’ll Vote for this November 

Read my new op-ed in the @dcexaminer: 

https://t.co/pBxLoxWV1V"
1055895963510996992,2018-10-26 18:56:29,"It's been a great day with men and women from across the Capital's housing, veterans &amp; homelessness organizations a… https://t.co/ffM9t6cDX2"
1054759514313052161,2018-10-23 15:40:39,"Sandra Day O’Connor is more than a trailblazer, more than a member of the highest court in the land; she is a role… https://t.co/T1H7ZZDCrd"
1054759513130176513,2018-10-23 15:40:39,"As the first woman on the Supreme Court, she made her formidable presence felt not by attacking those with whom she… https://t.co/2BvXxJDBR7"
1054759511855165440,2018-10-23 15:40:38,"Never flashy or angry, always gracious and dignified, Sandra Day O’Connor has nevertheless smashed barriers, challe… https://t.co/NdNrTRJsDU"
1054532354906017792,2018-10-23 00:38:00,"If we can maintain focus on our citizen responsibility to solve the problems we deal with every day, there is nothi… https://t.co/gzABWHnCNV"
1054472964446568448,2018-10-22 20:42:00,It’s time we stop looking up or far away and start looking within ourselves for the capacity each of us have. We sh… https://t.co/9iJ3XWliWk
1054435969749868544,2018-10-22 18:15:00,We need to remember who we are. We need to remember that each of us has enormous potential. We have the potential t… https://t.co/FdiG7PsrT0
1054412062728822784,2018-10-22 16:40:00,"Alexis de Tocqueville noted, “The health of a democratic society may be measured by the quality of functions perfor… https://t.co/6NRrbbfKzk"
1054395201215586309,2018-10-22 15:33:00,"Our nation is unique and exceptional because, unlike every other nation on earth, we were founded on ideas – three… https://t.co/U7AP83ImVi"
1054380353371041792,2018-10-22 14:34:00,We have strayed very far from our founding ideas. Instead of recognizing that each of us has inherent value and pot… https://t.co/H03iYQu23D
1054355443609350146,2018-10-22 12:55:01,Americans are rightly frustrated by festering problems that don’t seem to get better and wonder who is going to sol… https://t.co/CFXMzy3lxC
1054337719814512646,2018-10-22 11:44:35,"Read my new op-ed out today in the @dcexaminer:

https://t.co/EwoZhmobDI"
1054093211772338177,2018-10-21 19:33:00,Our communities are full of leaders solving problems all around them. To read more about https://t.co/zSAirYAWS8’s… https://t.co/4Z9DOj5hfH
1054017462432358400,2018-10-21 14:32:00,"When I was a little girl, my mother said, “What you are is God’s gift to you and what you make of yourself is your… https://t.co/z4aW0W5Xvo"
1053741393305395201,2018-10-20 20:15:00,Feeling a little ‘locked up’ across your team? Want to transform your organization into a high-performance culture?… https://t.co/CVHDwWwuMa
1053694991548248069,2018-10-20 17:10:37,"We’re proud of the work Unlocking Potential does in the social sector. 

To see more of how we are lifting leaders… https://t.co/Kj9arcIrVK"
1053466330794508288,2018-10-20 02:02:00,"Does his language perpetuate and exacerbate long-standing problems? Indeed. While this is true, the rest of us have… https://t.co/WHKtRQ8O2n"
1053436635168161792,2018-10-20 00:04:00,"Why should we care? Because when we diminish, disrespect or underutilize talent and brainpower based on someone’s “… https://t.co/1Plclry8wY"
1053405933282385920,2018-10-19 22:02:00,"Women reading this will nod knowingly, perhaps with a tinge of resignation or even despair. 
 
Men reading this may… https://t.co/WF1FG9ElXR"
1053375734453022721,2018-10-19 20:02:00,The most dramatic stories — just like the most salacious words — sometimes distract us from another long-standing r… https://t.co/V2WwSUbQDl
1053348806694182916,2018-10-19 18:15:00,"Teams discover that to accomplish more and perform at a higher level, they need to include others around the table.… https://t.co/r6uTti9zo3"
1053330688060153856,2018-10-19 17:03:00,"We won’t change things substantively unless we change our mind-set. When talent is squandered, when human potential… https://t.co/GP3otl0wvO"
1053313825561137153,2018-10-19 15:56:00,"Trump has disparaged women’s looks — including mine. But we have bigger problems.

Read my op-ed in the… https://t.co/s5hb7TFVD7"
1053300740737978368,2018-10-19 15:04:00,"Why should we care? Because when we diminish, disrespect or underutilize talent and brainpower based on someone’s “… https://t.co/8hXSjBQDZd"
1053285389006340096,2018-10-19 14:03:00,"While we are understandably troubled by words, actions of substance always speak louder and last longer.
 
Read my… https://t.co/Y1p21n0X9I"
1053268527249944576,2018-10-19 12:56:00,The most dramatic stories — just like the most salacious words — sometimes distract us from another long-standing r… https://t.co/r99XM19Mx5
1053249904640999424,2018-10-19 11:42:00,"When Donald Trump made disparaging comments about my appearance, many were shocked. I was not. He was not the first… https://t.co/21fHs1wZRt"
1053231786044444673,2018-10-19 10:30:00,"Does his language perpetuate and exacerbate long-standing problems? Indeed. While this is true, the rest of us have… https://t.co/vgehroJUeJ"
1053074167988436992,2018-10-19 00:03:41,Joining @AC360 on shortly on @CNN. Hope you’ll tune in!
1052964750978637824,2018-10-18 16:48:54,"We get confused about what leadership is today. We’re led to believe that it’s about position, title or power. It i… https://t.co/ZgBJuFavAK"
1052938401329139712,2018-10-18 15:04:12,"I greatly enjoyed my time with the WE Lead scholars, and to spend time with President and @laurawbush at… https://t.co/3JbHcv1cyI"
1052663687092334597,2018-10-17 20:52:35,The https://t.co/YIy1Ub8Kq2 team recently wrapped up our engagement with @ESealsDCMDVA. The growth they’ve demonstr… https://t.co/bWakJDR2Us
1052208533394116609,2018-10-16 14:43:58,That imbalance changes everything - even in so-called consensual relationships. Sexual misconduct is always an abus… https://t.co/JKK5q6HHrm
1052208475386863617,2018-10-16 14:43:44,"Really, @HillaryClinton?
 
Do you really think your husband (then-President of the United States) and Monica Lewins… https://t.co/fUJssZX0b9"
1052193077279027200,2018-10-16 13:42:33,"My website has a new look, and is updated to reflect the work my team and I are doing to lift up leaders everywhere… https://t.co/kkcEfHJjlE"
1051919680653418497,2018-10-15 19:36:10,"@therosholive Yes! Thanks for sharing this and encouraging others, Roshanda. Please keep in touch with us at https://t.co/A2DSYPimT6!"
1051919517465661441,2018-10-15 19:35:31,"@TheBromenator Yes! Thanks for sharing that note, Makeda! Please continue to engage with us on leadership and probl… https://t.co/tNPRtBvLj5"
1051919272312754177,2018-10-15 19:34:32,"@taylorchastain7 Yep! Thanks for sharing a note from #Live2Lead, Taylor! Hope you enjoyed it as much as I did. Plea… https://t.co/kksD9KUFEr"
1051919028967657473,2018-10-15 19:33:34,"@tamezfrench Thank you, Vivian, for sharing this! Check out https://t.co/A2DSYPimT6 for more on problem solving and leadership!"
1051827601042534400,2018-10-15 13:30:16,"@t2dai It's true, Tiesha. Thank you for sharing this, and thanks for being a part of the #Live2Lead discussion. Joi… https://t.co/eaZ8YpUIuI"
1051827339930292224,2018-10-15 13:29:14,"@SuperDaveNorris Thanks, David, for sharing this message! And thanks for participating in #Live2Lead. Please contin… https://t.co/WKZgKhrEGe"
1051827048585547777,2018-10-15 13:28:05,"@stephencarman Character is essential to leadership. Thanks for sharing this, Stephen. We've got more on leadership… https://t.co/lRwAnKqCWo"
1051826838140583941,2018-10-15 13:27:14,"@ShannonMuruli It's always true, and it just means you're challenging the status quo to change things for the bette… https://t.co/asjuAqTvoj"
1051825764872667136,2018-10-15 13:22:58,"@sareneanita This is always true, Rene. Thanks for joining me through #Live2Lead, and I hope you'll continue to joi… https://t.co/RvSrlwbn6P"
1051825416938377217,2018-10-15 13:21:36,"@rossikoonjie @JohnCMaxwell @PowerTeamTT1 @tylerperry @DanielPink @DebraSearle I'm grateful, as well. Thanks to you… https://t.co/1idpQqRLll"
1051825131742478341,2018-10-15 13:20:28,"@RickRhodes73 Thank you for sharing this, Rick! Hope you enjoyed the #Live2Lead discussion as much as I did, and I… https://t.co/p3V0f4DHOi"
1051565699100004353,2018-10-14 20:09:34,"@RickHaasl @wtamuosel @wtamu It's true! Thanks for sharing this, Rick! Please keep in touch, and join us in lifting… https://t.co/YPvCR7hRJ3"
1051565504916283393,2018-10-14 20:08:48,"@NorwalkTLC Thanks for sharing some takeaways, @NorwalkTLC! Please join us and stay in touch at https://t.co/A2DSYPimT6!"
1051565257116782600,2018-10-14 20:07:49,"@melissabraunFL @BrevardSchools Thanks for sharing this, Melissa! Hope you enjoyed #Live2Lead. More about problem-s… https://t.co/1mu4vixxUa"
1051565039071744000,2018-10-14 20:06:57,"@MarvitaFranklin Thank YOU for being part of the discussion, Marvita! I really enjoyed it. I hope you'll continue t… https://t.co/xIaD0FrxSo"
1051564879415570433,2018-10-14 20:06:19,"@MarkNewsome Thanks for sharing this, Mark! I hope you enjoyed #Live2Lead as much as I did. Please continue to enga… https://t.co/jCwTUwBcQG"
1051515879123505154,2018-10-14 16:51:36,"@LaraTexas It's true! Thanks for sharing this, Lara! Hope you enjoyed it as much as I did, and I hope you'll visit… https://t.co/SfBbuTtLKa"
1051515631697350656,2018-10-14 16:50:37,@LadiiDenishia @JohnCMaxwell @tylerperry @DanielPink @DebraSearle Great picture! Hope you enjoyed the discussion as… https://t.co/dQn2XLmI4g
1051515333943730179,2018-10-14 16:49:26,"@KeithCEnochs @JohnMaxwellTeam That saying changed so much for me - hope it helps you, too! Thanks for posting this… https://t.co/TYeP62yKNR"
1051515132738760704,2018-10-14 16:48:38,"@JRhue_ModernMsg Thanks for sharing this, Jared! I really enjoyed #Live2Lead - hope you did, as well. Please keep i… https://t.co/rO6XwhP4Zy"
1051514948415836161,2018-10-14 16:47:54,"@IvyMaeGamiao @tylerperry I enjoyed the conversation, too, Ivy. Thanks for joining us, and please continue to lead… https://t.co/lnTtShQcTU"
1051514702981935104,2018-10-14 16:46:56,"@ikereighard That's right! Thanks for posting this, Ike! Hope you enjoyed #Live2Lead as much as my team and I did.… https://t.co/QZub5Ax8v5"
1051514506713722885,2018-10-14 16:46:09,"@godprovides4us Glad you had that takeaway, Camila! Thanks for sharing this, and I hope you enjoyed the discussion… https://t.co/9CoqVNwG0G"
1051514273002901505,2018-10-14 16:45:13,"@gobles @AMTShows Thank you for sharing this, Steve! Hope you enjoyed #Live2Lead. Join us at https://t.co/A2DSYPimT6 for more!"
1051491569331781632,2018-10-14 15:15:00,https://t.co/qoYDNygUnC
1051184794401419264,2018-10-13 18:55:59,"@emadatey It's so true. Thank you for sharing this, @emadatey. I loved the discussion at #Live2Lead - I hope you en… https://t.co/oCQyFvX3HY"
1051184526263758850,2018-10-13 18:54:55,"@doufa__ Thank you for sharing these moments from #Live2Lead, @doufa__. Please keep in touch with us at https://t.co/A2DSYPimT6!"
1051184263486431232,2018-10-13 18:53:53,"@DeltaCompanies Thanks for sharing this, @DeltaCompanies! I hope you enjoyed the discussion as much as I did, and I… https://t.co/esAiPedvmn"
1051184038126518273,2018-10-13 18:52:59,"@eskovgard Thank you for sharing this, Erik! Change is hard, but leaders make those changes for the better. Join us… https://t.co/5Lyf4S4izJ"
1051183767015096320,2018-10-13 18:51:54,"@DanDoerksen It's true - Thanks for sharing this from #Live2Lead, Dan. I hope you enjoyed the discussion as much as… https://t.co/B0UTmeukg5"
1051183505563111424,2018-10-13 18:50:52,"@cruzvegallc Thank you, Raúl! I hope you enjoyed #Live2Lead, and I hope you'll continue to keep in touch and engage… https://t.co/iypbrmY7On"
1051138218350047239,2018-10-13 15:50:55,Life tells us over time that nothing worthwhile is ever accomplished by a single person acting alone. Real problem… https://t.co/TByVMiXsE0
1051130754619625472,2018-10-13 15:21:15,"@CHRISTINEARDIS Thank you so much, Chris! I hope you enjoyed #Live2Lead as much as I did, and I hope you'll stay en… https://t.co/7eem4q05hU"
1051130590446186502,2018-10-13 15:20:36,"@ChrisHoneycutt Thanks for sharing some moments from yesterday's discussion, Chris! I hope you enjoyed it. Please s… https://t.co/b4otUjPygQ"
1051130414230851584,2018-10-13 15:19:54,"@ChaseDepew That saying changed my life - I hope it impacted you, as well. Thanks for sharing, and be sure to check… https://t.co/urViOsy5SH"
1051130118322700288,2018-10-13 15:18:43,"@CharmianeGarza It's true! Thanks for sharing this, Charmain! I hope you’ll continue to engage with us at https://t.co/A2DSYPimT6!"
1051129996100689920,2018-10-13 15:18:14,"@ccherneskey You're welcome. Thank YOU for posting this, Christina! I hope you enjoyed #Live2Lead. Check out… https://t.co/Pgo06Nk3eX"
1051129443140456454,2018-10-13 15:16:02,"@CarolynHutsen Thanks for sharing this, Carolyn! I hope you enjoyed #Live2Lead. Check out https://t.co/A2DSYPimT6 f… https://t.co/Hkl51UBMGu"
1050850548763815936,2018-10-12 20:47:49,"@Btaeuber That's right. I hope you enjoyed today's discussion, Brianna. Please keep in touch with us at… https://t.co/xxzqTJAKPi"
1050850157926014976,2018-10-12 20:46:16,"@BigPatriotPapa Thanks for sharing this! I hope you enjoyed it, and are ready to seek out those who can be lifted u… https://t.co/8Q9hQcDlC6"
1050849603304783874,2018-10-12 20:44:03,"@bhramayana That's right, Tom! I hope you enjoyed #Live2Lead today - I did! Check out https://t.co/A2DSYPimT6 for m… https://t.co/SJxzAN6gf3"
1050849322210906114,2018-10-12 20:42:56,"@AndreaOdenAssoc I hope you enjoyed the presentation today, Andrea! Thanks for posting about it. I hope you’ll cont… https://t.co/dT8MYFcVGF"
1050849115758874624,2018-10-12 20:42:07,"@AmyZukSafetyBuz Thanks for joining, Amy! It was a great event. Check out https://t.co/A2DSYPimT6 for more on the basics of problem-solving!"
1050848748052594689,2018-10-12 20:40:40,"@4994793a87f24cc I hope you enjoyed it, Kathleen! I had a great time. Check out https://t.co/A2DSYPimT6 for more lessons in leadership."
1050847465979699201,2018-10-12 20:35:34,"@ChicagoTreeMD @JohnCMaxwell I hope you enjoyed it, and thanks for taking some photos! I hope you’ll continue to en… https://t.co/gsHWzmFZ4l"
1050821227852517376,2018-10-12 18:51:18,"Each of us are stronger than we know. When your character is revealed and tested in the tough times, you’re better… https://t.co/JHTE7G2iLJ"
1050813618516844544,2018-10-12 18:21:04,"RT @JeffreynDC: Live from #Leadercast in Atlanta, GA with Unlocking Potential Foundation https://t.co/0VizqZP68p"
1050748143661400065,2018-10-12 14:00:54,"An honor to be with my friend, @JohnCMaxwell this morning at #Live2Lead in Atlanta. Thanks to the many leaders who… https://t.co/fR0YBxeqqd"
1050411451368656896,2018-10-11 15:43:00,The https://t.co/zSAirYjlty team is excited to join #LeadercastWomen tomorrow in Atlanta! Go to… https://t.co/TYpJM0zIW4
1050380685205221378,2018-10-11 13:40:45,"I’m looking forward to joining @JohnCMaxwell, @TylerPerry, and more on Friday in Atlanta at #Live2Lead. 

Learn mor… https://t.co/MhqPKGQPDT"
1050036984121569280,2018-10-10 14:55:00,https://t.co/5HzNiBDox7
1049793127186399237,2018-10-09 22:46:00,The https://t.co/zSAirYAWS8 team is looking forward to joining @Leadercast at #LeadercastWomen this week in Atlanta… https://t.co/FRiF4IG9Sn
1049745861130014721,2018-10-09 19:38:11,"Last week, members of the https://t.co/zSAirYAWS8 team spoke with @FoxNews Contributor, @Richardafowler at the… https://t.co/xfqBNy3yYV"
1049709733517647872,2018-10-09 17:14:37,"“Leaders become great, not because of their power, but because of their ability to empower others.” - @JohnCMaxwell"
1049038655703175169,2018-10-07 20:48:00,"""The price of success is hard work, dedication to the job at hand, and the determination that whether we win or los… https://t.co/oaZv8H3F2c"
1048983039219363840,2018-10-07 17:07:00,https://t.co/Wf3s0i5F0p
1048592465991618561,2018-10-06 15:15:00,https://t.co/PxGEFRlZUS
1048579604510851078,2018-10-06 14:23:54,"I’m often asked for a piece of advice for young people. What I always say is: Get a job, any job, and do it with ex… https://t.co/abIwdJu5It"
1048297049739972609,2018-10-05 19:41:07,"We all need structure in our lives, connection with others, and accountability for something to someone.… https://t.co/g5DgrWxjXR"
1048213971600195584,2018-10-05 14:11:00,Any job performed with excellence can be a source of pride. Not all jobs are viewed as glamorous in our celebrity c… https://t.co/FF8iCw4g8V
1047495236849684485,2018-10-03 14:35:00,Looking forward to addressing the 2018 Principled Entrepreneurship Conference on the #DignityofWork at the… https://t.co/wcMlNZzpfj
1047183624842477569,2018-10-02 17:56:46,Honored to spend time on Capital Hill w/ the @HeroZonaOrg. I'm happy to support a cause that provides the dignity o… https://t.co/HRR7cbjtU2
1046887603746852865,2018-10-01 22:20:29,I’m looking forward to addressing @TheBuschSchool and the @NapaInstitute this week for the 2018 Principled Entrepre… https://t.co/oZKc5ZZH5d
1045752998742421504,2018-09-28 19:11:58,"Thanks to @DCstartupweek for hosting the https://t.co/zSAirYAWS8 team, and to those who came to our presentations!… https://t.co/QaJ4udGfVQ"
1045463902170042368,2018-09-28 00:03:12,I'm so glad to have made it to speak at @spfdpublicforum. Thank you @massmutual for inviting me and… https://t.co/XsepXSDbYR
