id,created_at,text
235442593880756224,2012-08-14 18:27:43,"Stand with @BarackObama and @PPact, and hear @ElizabethBanks inspiring message: http://t.co/lmPkuC5f"
235158048598020096,2012-08-13 23:37:03,"That one conversation you have could be the one that puts @BarackObama over the top: http://t.co/71WHsVle, http://t.co/sUwZslAz"
235117558498488320,2012-08-13 20:56:08,85 days to go—and you can make the difference. Sign up for a volunteer shift here: http://t.co/828mzKXD
235085341575491584,2012-08-13 18:48:07,"RT @whitehouse: I can't wait to stop by @JayLenoTonight on 8/13 to talk about the #Olympics, @LetsMove &amp; how this happened: http://t ..."
235071529162006529,2012-08-13 17:53:14,Quote of the day: “It’s a once-in-a-lifetime opportunity to play our trumpets for the First Lady!” http://t.co/z4xZB231
234428498935173120,2012-08-11 23:18:04,The First Lady in New Hampshire: “The grassroots work that you all are doing ... that work is at the core of this campaign.”
234083214300438528,2012-08-11 00:26:02,A lot of ways to say you're a Woman for Obama: http://t.co/MTHxdjZd
234069290016464897,2012-08-10 23:30:42,Commit to making 10 calls for #Obama2012 tonight using the handy online call tool: http://t.co/7qMSwdRN
234039513226280961,2012-08-10 21:32:22,88 days left—here’s how you could be spending them: http://t.co/Zgwsjzxh #ItTakesOne
233986590505046016,2012-08-10 18:02:06,The First Lady was fired up in Philadelphia yesterday: http://t.co/UX6Pjovt
233734689473576960,2012-08-10 01:21:07,"This campaign is growing in Pennsylvania because volunteers are making it happen. Keep it up, @OFA_PA! —mo"
233641149531836416,2012-08-09 19:09:25,RT @SandraFluke: Check out my op ed on @HuffingtonPost on why I stood w/ @BarackObama yesterday in #Colorado &amp; will thru Nov http:// ...
233600281869422593,2012-08-09 16:27:01,Let your #Obama2012 story inspire someone else’s—share yours here: http://t.co/JsiyVWXH
233375433058578432,2012-08-09 01:33:33,The next 90 days are critical for this campaign—help make the most of them: http://t.co/40ZOsqZ6
233323685770035200,2012-08-08 22:07:56,Lilly Ledbetter: Proof that it only takes one person to make a difference. http://t.co/kDVAnGWL #ItTakesOne
233305833662988290,2012-08-08 20:57:00,Don’t wait—get registered to vote today: http://t.co/wpI5R73o
233304653352275968,2012-08-08 20:52:19,A good sign: http://t.co/CiMdnHSU
233294086394761216,2012-08-08 20:10:19,"""Reaching out to one person feels doable. There's no reason I can't do that, then do it again tomorrow.”—Stephanie http://t.co/JE0bTtA7"
233238881200381952,2012-08-08 16:30:57,Looking to get more involved with #Obama2012? There’s an app for that: http://t.co/PHJpuSeP
233015782429319169,2012-08-08 01:44:26,A must-read story from @WomensHealthMag—take a look and pass it along: http://t.co/NYCHwoU1
232974247553814528,2012-08-07 22:59:24,Something to share with all of the women in your life: http://t.co/p29ZNMZs
232916260466327552,2012-08-07 19:08:58,The President needs you to have his back from now until Election Day. Sign up to volunteer: http://t.co/jlhxlZuD
232891603981856768,2012-08-07 17:30:59,Use this tax calculator to see the choice your family faces on taxes this November: http://t.co/cC29H7uF #2200dollars
232884080377745408,2012-08-07 17:01:06,"""I want you all to remind folks that Barack has cut taxes for working families by $3,600."" –The First Lady in NH last week. Remind=RT."
232869062361878529,2012-08-07 16:01:25,"Inspiration from @OFA_OK's Stephanie: ""Even if you don't think you have anything to contribute, chances are—you do."" http://t.co/dddBfS8r"
232840452393549824,2012-08-07 14:07:44,"RT @BarackObama: ""It was easy to invite people to volunteer—especially for a canvassing trip. It was kind of a big adventure."" http://t. ..."
232140291883278336,2012-08-05 15:45:33,"A Sunday afternoon idea: Vote in @FamilyCircle’s Presidential Cookie Bake-off, then test out a batch of your own! http://t.co/EWTDHLor"
231837740138901504,2012-08-04 19:43:20,"Happy birthday, @BarackObama! Here’s an old favorite photo from three of your biggest fans. We’re so proud of you!–mo http://t.co/7alDwpDQ"
231539141253423106,2012-08-03 23:56:48,The First Lady took a tour of @OFA_NC's downtown Raleigh field office on Wednesday: http://t.co/U7NjmYlj
231497859114074112,2012-08-03 21:12:45,"White, dark, and mint chocolate chip cookies—one of the First Family’s favorite treats is up for a vote: http://t.co/Sx7Ux7Vu"
231191189775319040,2012-08-03 00:54:09,"RT @OFA_NH: The First Lady tells the #Manchester crowd: ""Multiply yourselves, bring one person into the fold."" http://t.co/vtkJF3bS #Mic ..."
231172403722608642,2012-08-02 23:39:30,President Obama turns 51 on Saturday—take a second to sign his birthday card: http://t.co/MnFlLGzR
231127782946648064,2012-08-02 20:42:12,Your personal story of getting involved could get someone else fired up. Tell your story here: http://t.co/rMATcACg
230796155234177024,2012-08-01 22:44:26,This campaign gets stronger one person at a time—share the story of how you got involved: http://t.co/uSyUurca
230723344155164672,2012-08-01 17:55:06,The First Lady is in North Carolina today asking supporters to get involved through It Takes One: http://t.co/Rs3lGBLp
230468925241057281,2012-08-01 01:04:08,RT @BarackObama: Today is one of the most important fundraising deadlines of this campaign so far. Pitch in $3 before midnight: http://t ...
230406346019831809,2012-07-31 20:55:28,Join Michelle: Sign the birthday card for @BarackObama. http://t.co/YmaVgY4C
230388883966263297,2012-07-31 19:46:05,"RT @BarackObama: Deadline deal: Give $10 or more before midnight, get a Vote Obama car magnet. Simple as that: http://t.co/nAXQ0cvE"
230377457071558657,2012-07-31 19:00:41,A photo that makes us smile: http://t.co/Es1SP1LT
230362726998876160,2012-07-31 18:02:08,The First Lady has a card going around for @BarackObama’s birthday—sign it here: http://t.co/5bDn3h5N
230349619157147648,2012-07-31 17:10:03,Pitch in $5 before the campaign’s big fundraising deadline tonight: http://t.co/KFdkekIW
230323535573311488,2012-07-31 15:26:24,RT @LatinosforObama: ¡Felicidades Mayor @JulianCastro! Join Latinos for Obama today. http://t.co/H8jrxZvK #Latinos2012 http://t.co/8sdwK4Cl
230030054946643969,2012-07-30 20:00:13,The election is less than 100 days away—make all of them count: http://t.co/B9hXcMIx
229980343321624576,2012-07-30 16:42:41,Join Young Americans for Obama today: http://t.co/kwd5bGEF
229979668185505793,2012-07-30 16:40:01,Use your voice to keep us moving forward: http://t.co/MMsjDQRO
229963918351671296,2012-07-30 15:37:25,"RT @letsmove: Photo: After a match at Wimbledon, the First Lady hugs @Venuseswilliams &amp; @serenawilliams during the #Olympics: http:/ ..."
229317358869676032,2012-07-28 20:48:13,RT @letsmove: Just arrived at swimming w @SummerSanders_ ! Go #teamUSA! http://t.co/j7j5hIwi
229304078398799873,2012-07-28 19:55:27,RT @whitehouse: Go #TeamUSA! The First Lady has her picture taken with athletes at the US Olympic Training Facility in London: http://t. ...
229214086196498432,2012-07-28 13:57:51,"RT @whitehouse: Photo of the Day: At the #London2012 #Olympics, the First Lady gets a lift from US wrestler Elena Pirozhkova: http://t.c ..."
228953295526449152,2012-07-27 20:41:34,This campaign grows one person at a time—share the story of how you got involved: http://t.co/Nri5qDKe
228930166922027008,2012-07-27 19:09:39,Every parent wants a better world for their kids—and that’s exactly what drives the President. Join him: http://t.co/XNt5fwu0
228912761533513729,2012-07-27 18:00:30,Find a weekend of action event near you—and bring a friend along: http://t.co/BrPIM2fo
228888753979129856,2012-07-27 16:25:06,"RT @letsmove: The First Lady on leading the US Delegation to London: ""It will be awe inspiring...It will be proud moment for me personal ..."
228648181565628416,2012-07-27 00:29:09,Last call: Be a part of @BarackObama’s birthday party at home in Chicago—we’ll fly you in. http://t.co/vAp4Ob12
228590995426664448,2012-07-26 20:41:54,"The First Lady heads to London today, leading the U.S. delegation to the 2012 Olympic Games. Follow @LetsMove for updates on her trip."
228568981546618880,2012-07-26 19:14:26,One thing you can do this week to help this campaign grow: Bring a friend along when you volunteer. http://t.co/A0ZVZZWB
228551530826039297,2012-07-26 18:05:05,"If you’re a woman and you’re for Obama, this is the group you need to join: http://t.co/Vl4P94eB"
228228461569929216,2012-07-25 20:41:20,"Saturday, people all across the country will be registering voters and reaching out to their neighbors. Join in: http://t.co/w8Cyz5NS –mo"
228204839610486785,2012-07-25 19:07:28,"There’s a birthday party for @BarackObama coming up, and you could be on the guest list: http://t.co/tHZCK4Si"
228191648880922624,2012-07-25 18:15:03,"The next time you volunteer for #Obama2012, invite a friend. Here’s how it makes a difference: http://t.co/03hQVDJU"
228176674980761601,2012-07-25 17:15:33,"President Obama puts families first—if you’re a parent for Obama, this is the place to say so: http://t.co/8gxrPkQm"
228163213588570112,2012-07-25 16:22:03,The First Lady on what it's like to be First Mom: http://t.co/2WH3Z0fz
227954062254022656,2012-07-25 02:30:58,The First Lady had a full house in Ohio today: http://t.co/HDoefgSV
227945901505773569,2012-07-25 01:58:32,"A colorful afternoon with a few new friends, thanks to @OFA_OH: http://t.co/hznLMahb"
227922908671012865,2012-07-25 00:27:10,Thank you to the thousands of Ohioans who made this an inspiring visit. I'm fired up! –mo
227905010908930049,2012-07-24 23:16:03,Don’t miss the chance to help celebrate @BarackObama’s 51st birthday with him in Chicago—airfare’s on us: http://t.co/NqyMsJ51
227871147214135298,2012-07-24 21:01:29,Everyone has a story of how or why they got involved in this campaign—what’s yours? http://t.co/wPhRVrbV
227520361602879488,2012-07-23 21:47:35,Attention Buckeyes: The First Lady will be in Columbus on Tuesday. Pick up tickets at your local @OFA_OH office today. http://t.co/MB9J9GT6
225994081917095936,2012-07-19 16:42:42,Watch a message from the First Lady kicking off a new way to get involved—It Takes One: http://t.co/ZQLYYfje
225993542546386945,2012-07-19 16:40:33,Every single person can make a difference in this election.  Start today by committing to one action that will help grow our campaign.  –mo
225765956188790784,2012-07-19 01:36:13,The President and First Lady honor Nelson Mandela International Day: http://t.co/OMAo2xI3
225694079156113408,2012-07-18 20:50:37,He’s fighting for our families: http://t.co/Sc1JvVQs
225412180722458624,2012-07-18 02:10:26,"In case you missed it, @Beyonce had a few kind words for the First Lady: http://t.co/GYsUFsTi"
225323077951696896,2012-07-17 20:16:22,.@BarackObama turns 51 soon—and here’s your chance to celebrate with him at home in Chicago: http://t.co/kXxr4v8B
225290316729679873,2012-07-17 18:06:11,"Four years after her first @BlogHer post, the First Lady reflects on promises kept and what's needed for the next four: http://t.co/61nxAHyk"
224883323481243649,2012-07-16 15:08:57,From one leading lady to another—here's @Beyonce on the First Lady: http://t.co/v6xWsZ8d
223467317420498944,2012-07-12 17:22:14,A favorite Obama family recipe is up for a vote: http://t.co/Le8w4d7y
223184456721248256,2012-07-11 22:38:16,The First Lady made some new friends while visiting a Florida YMCA yesterday: http://t.co/kSSOy7MR
223136080940105728,2012-07-11 19:26:02,I had the chance to talk with some incredible Latina moms from around the country yesterday. Thanks @Mamiverse for hosting me! –mo
223102381095796737,2012-07-11 17:12:07,For our daughters and our sons alike: http://t.co/vaXjPuhl
222733385683054593,2012-07-10 16:45:51,Watch live: First Lady Michelle Obama talks to @Mamiverse at 12:45pm ET: http://t.co/yCnjSofg #Latinos2012
222724019080802307,2012-07-10 16:08:38,RT @LatinosforObama: .@MichelleObama is chatting with Latina moms today. Watch the livestream at 12:45PM EST here: http://t.co/os8UKeQD  ...
222437796445569025,2012-07-09 21:11:18,Start the week off with a treat (and don’t forget to vote for your favorite!): http://t.co/H5i3t6eR
222412839036530688,2012-07-09 19:32:07,RT @LatinosforObama: No te lo pierdas: @MichelleObama  chats with Latina moms tomorrow. #Latinos2012 http://t.co/2wsFHkiZ
222370688479133696,2012-07-09 16:44:38,The First Lady is sitting down with a few of the moms from @Mamiverse in Orlando on Tuesday. Tune in here: http://t.co/xIok71qk #Latinos2012
221657488594972672,2012-07-07 17:30:39,A photo that makes us smile: http://t.co/Gqwz95jf
221391604202745859,2012-07-06 23:54:06,"A few favorite photos, a few good recipes—follow the First Lady on Pinterest: http://t.co/MuK6usjX"
221335403687452673,2012-07-06 20:10:47,"The First Lady is winning, Jimmy: http://t.co/ymopqJ5S"
220997848643280896,2012-07-05 21:49:27,"Check out a delicious cookie recipe (an Obama family favorite), then vote in the Presidential Cookie Bake-Off: http://t.co/HEfAVnzR"
220578759286337536,2012-07-04 18:04:09,Shaking hands and giving hugs on another Fourth of July: http://t.co/MKlngkIl
220548333473763328,2012-07-04 16:03:14,"Happy Fourth! What makes this day even more special is that it’s the day our first child was born. Happy birthday, Malia! We love you. –mo"
220236035626504192,2012-07-03 19:22:18,"For everyone gearing up for Fourth of July celebrations, be safe and enjoy the fireworks: http://t.co/crk3XHz6"
219192460507754496,2012-06-30 22:15:29,Tonight is one of the most important fundraising deadlines of this campaign so far. Pitch in $3 before midnight: http://t.co/qqeQI7zz
218869228353241088,2012-06-30 00:51:05,"If you support the President and First Lady, now’s the time to give to this campaign: http://t.co/WokXzGE9"
218487292841566210,2012-06-28 23:33:24,"President Obama: ""Today’s decision was a victory for people all across this country whose lives will be more secure."""
218129154296659968,2012-06-27 23:50:17,Cast your vote in @FamilyCircle’s Presidential Cookie Bake-off—we’re partial to the white and dark chocolate chip: http://t.co/aqVCcw2x
218080676853977089,2012-06-27 20:37:39,"We shouldn’t make it harder for kids to get an education. If you agree, pass this on: http://t.co/ULkE9IQf"
218024686028718080,2012-06-27 16:55:11,A photo that makes us smile: http://t.co/7vlUSWQC
217752541344178176,2012-06-26 22:53:47,I just dropped in on our team at Obama for America headquarters. You all are doing a great job! –mo http://t.co/VV5FIxLW
217733803626606592,2012-06-26 21:39:18,The President and First Lady recount the first time they went out (it’s pretty cute): http://t.co/DBhVd2cF
217696683117641730,2012-06-26 19:11:48,"As the son of a single mom, @BarackObama knows that pay inequality hurts families. That’s why he's fighting it: http://t.co/XIBeDJDA"
217662138397888512,2012-06-26 16:54:32,Today’s your last chance to join the Obamas for dinner—take a minute to enter #DinnerWithBarack (and Michelle!): http://t.co/tYHaltnl
217658794090561536,2012-06-26 16:41:15,I'm really looking forward to the next Dinner With Barack. We've been a little busy for date nights lately! Hope you can join us. –mo
217639212151865344,2012-06-26 15:23:26,Check out a favorite Obama family cookie recipe—then cast your vote in @FamilyCircle’s Presidential Cookie Bake-Off: http://t.co/1krH7vKi
217353965648609280,2012-06-25 20:29:58,Throw your name in the hat for dinner with the President and First Lady before tomorrow's deadline: http://t.co/ENcSWyzf
217348897138417667,2012-06-25 20:09:49,The Obamas tell their first date story: http://t.co/AdDo1oA6
216928284536086530,2012-06-24 16:18:28,"The First Lady was out west last week, saying “thank you” to @OFA_NV and @OFA_CO volunteers. Check out the photos: http://t.co/XBcoyjSh"
216638200112873472,2012-06-23 21:05:46,Check out @BarackObama's op-ed on what the 40th anniversary of Title IX means to him as President and as a father: http://t.co/HHPv9u95
216289591802601472,2012-06-22 22:00:32,Cue a little night music: http://t.co/8hKX2ngC
216211519074091008,2012-06-22 16:50:17,"Volunteers are going to make the difference this fall. If you're in, sign up here: http://t.co/29jojZYu"
215955268276723712,2012-06-21 23:52:02,The First Lady is coming along for the next #DinnerWithBarack—here's your chance to be there: http://t.co/He6eITHv
215872979668713474,2012-06-21 18:25:04,Fair pay for women means a stronger middle class. #Women2012 http://t.co/FibZKlpy
215599257892298752,2012-06-21 00:17:23,"First Lady Michelle Obama chatting with customers at Nacho's restaurant in Pueblo, Colorado today: http://t.co/Ax0u0Xjy"
215569268710981632,2012-06-20 22:18:13,Thank you to @OFA_NV and @OFA_CO for a great couple days. Volunteers like you are how the West will be won! –mo
215487163050110977,2012-06-20 16:51:57,You have a chance to sit down with the President while supporting #Obama2012. It's the chance of a lifetime: http://t.co/2e4LuwMX
215121479916978176,2012-06-19 16:38:52,"The First Lady is a Woman for Obama. If you are, too, sign up here: http://t.co/fBWahmlh"
214804451335217153,2012-06-18 19:39:06,Great teachers make the difference for our kids. Stand with Educators for Obama: http://OFA.BO/vKsR41
214468188832940032,2012-06-17 21:22:55,The First Lady taped a Father’s Day video to thank @BarackObama and all the other great dads out there. Watch here: http://t.co/As0JJ4KA
214397987470852097,2012-06-17 16:43:58,Father's Day is today—take a minute to sign the card for @BarackObama: http://t.co/Sa2XEd7W
214382855059537923,2012-06-17 15:43:50,Thinking of two fathers I love dearly—the one who raised me and the one I married. Incredibly grateful for both. –mo
214374949287231489,2012-06-17 15:12:25,The First Lady gives the commencement address at @OregonStateUniv today—congratulations to the graduates!
214106187887677440,2012-06-16 21:24:27,Sign Michelle's Father's Day card for Barack: http://t.co/wC0nwSSK
214063271819476992,2012-06-16 18:33:55,For any weekend pinners—be sure to check out the First Lady’s new Pinterest page: http://t.co/Xr65QDZR
214026369959596033,2012-06-16 16:07:18,Hope everyone has some family fun planned this weekend: http://t.co/NJfPn2A8
214012817173516290,2012-06-16 15:13:26,It's not too late to join a Weekend of Action event in your neighborhood this weekend: http://t.co/HCN0s0C9
213757007805693952,2012-06-15 22:16:56,A big weekend of action starts tomorrow—help register voters in your community: http://t.co/2tC0adFN
213725600341434368,2012-06-15 20:12:08,Join the First Lady in wishing @BarackObama a happy Father's Day: http://t.co/onLjGEhi
213414195281149953,2012-06-14 23:34:43,"20,000 people have followed the First Lady since she joined Pinterest yesterday. Check it out: http://t.co/lE0S15OD"
213311869568561152,2012-06-14 16:48:07,Don't miss @BarackObama's address on the economy today—streaming live here starting at 1:45pm ET: http://t.co/QXTtNBO5
213298579526266881,2012-06-14 15:55:18,Sandra Fluke talks about why this election is so personal: http://t.co/rHc1gssu
213055003865260034,2012-06-13 23:47:25,RT @BarackObama: Don't miss the President's speech tomorrow: RSVP to watch it live at 1:45 pm ET. http://t.co/9AQdjT7X
212919219304677376,2012-06-13 14:47:52,The First Lady just joined Pinterest—check out her special Father's Day board: http://t.co/K3hTKlfO
212686856784056320,2012-06-12 23:24:33,Sometimes even Bo needs a little help to get moving: http://t.co/LzLIS4fk
212285824040054784,2012-06-11 20:50:59,The First Lady has one question for you: Are you in? http://t.co/lrgjeWqq
212226902088355840,2012-06-11 16:56:51,"Read Robin’s post here, and find out how you can help: http://t.co/T3l9sAAQ"
212225685257859072,2012-06-11 16:52:00,".@RobinRoberts, Barack and I have you in our prayers. We believe in you and thank you for bringing awareness and hope to others. –mo"
211487463993114625,2012-06-09 15:58:36,"Wishing everyone a great Saturday, hula hoops optional: http://t.co/TfhiLcRe"
211180149029355521,2012-06-08 19:37:25,This week’s #FF goes out to @OFA_PA and @OFA_VA. The First Lady saw them “fired up” firsthand this week.
211126686304043008,2012-06-08 16:04:59,Good work is happening out in NOVA! Thank you @OFA_VA and keep it up. –mo
210842949683118080,2012-06-07 21:17:31,RT @OFA_VA: First Lady @MichelleObama got a short concert from 6 year old Sydney at Mom's Apple Pie in Occoquan. #MichelleinVA http://t. ...
210557548485541891,2012-06-07 02:23:26,"RT @BarackObama: The First Lady to @OFA_PA volunteers today: ""You will make the difference in this election."" http://t.co/MPUMf8CF"
210541126522900480,2012-06-07 01:18:10,"RT @OFA_PA: This 1st grader had to miss class to meet @MichelleObama, but made sure to get an absence note from the First Lady: http://t ..."
210510273092648960,2012-06-06 23:15:34,It was great to be back in Philly today with such a fantastic crew of supporters. You guys truly inspire me. –mo
210490125887614976,2012-06-06 21:55:31,"RT @OFA_PA: ""We worked tirelessly to elect @barackobama in 2008 and we're doing it again this year."" #MichelleinPhilly http://t.co/SFwHfvDB"
210405380931600384,2012-06-06 16:18:46,"In case you missed it, the First Lady answered a few questions from all of you on Twitter: http://t.co/JZPSEo7h"
210181186310508545,2012-06-06 01:27:54,RT @BarackObama: It's a family issue: http://t.co/ZO3onYKU
210098059328237569,2012-06-05 19:57:36,A photo that makes us smile: http://t.co/BBIjtR2g
209758392565252096,2012-06-04 21:27:52,Only a few hours left: Put your name in to join the Obamas at Sarah Jessica Parker’s home in New York—airfare's on us. http://t.co/wfnRqk9n
209724150850400256,2012-06-04 19:11:48,An invitation from Sarah Jessica Parker: http://t.co/sTRZC7Hm
209679016729382913,2012-06-04 16:12:27,A group of students joined the First Lady last week for a spring harvest from the @WhiteHouse vegetable garden: http://t.co/c2aPsFLb
209007103405330432,2012-06-02 19:42:31,"If you've got the President's back, say you're in for 2012: http://t.co/fTQX8lkT"
208731003244658688,2012-06-02 01:25:25,Photo that makes us smile: http://t.co/g3HJVPQv
208342360625659905,2012-05-31 23:41:04,You asked and the First Lady answered: http://t.co/Wv4OoaPZ
207959364168982529,2012-05-30 22:19:10,Sarah Jessica Parker is hosting the Obamas for a night in New York. Add yourself and a +1 to the guest list: http://t.co/8uS94NTk
207942488953061377,2012-05-30 21:12:07,Summer is here and this campaign is heating up—join Women for Obama today: http://t.co/935QihDW
207157042979418114,2012-05-28 17:11:02,Today we pay tribute to those who gave their lives for our country and offer our support to those who loved them. –mo
206093761757986816,2012-05-25 18:45:57,This photo makes us smile (vintage edition): http://t.co/SyvtexOH
205693267797479424,2012-05-24 16:14:31,Do you know what the voting laws are in your state? It’s easy—get the latest: http://t.co/050j63QC #RegToVote
205691578055004160,2012-05-24 16:07:48,"Every vote counts, and people like 96-year-old Dorothy Cooper are making sure their voices are heard: http://t.co/OnLv4hHH"
205330135157714944,2012-05-23 16:11:33,Sarah Jessica Parker is hosting the Obamas at her home in NYC. Win a spot on the guest list for you and your +1: http://t.co/XvDxw6rR
205093782197252096,2012-05-23 00:32:22,"The First Lady delivered a special message in person to @OFA_OH volunteers: ""I want to thank every single person."" http://t.co/Y4rPYdhk"
204654174305136640,2012-05-21 19:25:32,The ACA means Katherine's daughter can’t be denied coverage for being a cancer survivor: http://t.co/1XMwRIny
203900460028014592,2012-05-19 17:30:32,"Our daughters are “counting on us to fight for them.” Beautifully said, and worth a watch: http://t.co/LWkVnxVK"
203255881213804544,2012-05-17 22:49:13,Join @Vets4Obama to help President Obama make sure those who have served this country continue to be a top priority: http://t.co/AOjfpjO8
203244774889762816,2012-05-17 22:05:05,“Veterans have done so much for this country—and your families set an example for all of us.” http://t.co/Ak03Dx1v
202849109357506560,2012-05-16 19:52:51,RT @JoeBiden: Join Iowa's #Women2012 leaders call with Dr. Jill Biden tonight to discuss what’s at stake this November: http://t.co/40epfzha
202517547906646016,2012-05-15 21:55:20,We’re giving away free Women for Obama bumper stickers. Show your support for @BarackObama and get yours here: http://t.co/DHabBIW6
202484133258211328,2012-05-15 19:42:34,"Stevie Wonder, @Beyonce, @SaraBareilles, @JLo—find out who gets the First Lady moving: http://t.co/oGYCQBfI"
202451989697798145,2012-05-15 17:34:51,A message from the First Lady to graduates on Saturday: http://t.co/wHdDc8aN
202133227543068672,2012-05-14 20:28:11,"The First Lady shares her tips for staying fit and healthy, along with a few of her favorite workout songs: http://t.co/65a9TZ3R #NWHW"
202108990669324289,2012-05-14 18:51:53,"RT @WomensHealthMag: A message from First Lady @michelleobama for National Women's Health Week: ""No more excuses."" http://t.co/cjkNjhvg  ..."
201687898481897473,2012-05-13 14:58:36,"I want to wish a very happy Mother’s Day to all of the moms out there, especially mine. She’s my rock every single day. Love you, mom. –mo"
201345066541912064,2012-05-12 16:16:19,"The First Lady’s message for @NCATSU graduates today: ""It’s time for you to wake the rest of us up and show us everything you’ve got."""
201087568371134465,2012-05-11 23:13:07,This photo makes us smile: http://t.co/MP7VHFvo
